,날짜,기사제목,기사내용
70,2018.06.27. 오후 5:09,[쏙쏙! 세계경제] 무더운 여름 유럽서 콜라ㆍ맥주도 못 마실라... 탄산가스 공급난에 식품업체 ‘비상’,"탄산음료. 케티 이미지 뱅크유럽에서 때 아닌 탄산가스 공급 차질로 여름철 성수기를 기다리던 식품 업계에 비상이 걸렸다. 27일(현지시간) 영국 BBC 등 외신에 따르면 영국 및 유럽대륙 전역에 지난 주부터 탄산가스 공급이 차질을 빚으면서 관련 업체들이 비상 대책을 마련하고 있다. 기체로 존재하는 이산화탄소(CO2)를 지칭하는 탄산가스는 콜라, 사이다 등 청량음료는 물론이고 맥주 제조에 필수적인 원료다. 고체상태 탄산가스인 드라이아이스는 샐러드ㆍ육류ㆍ생선류 등의 신선도를 유지하는 냉장재로 활용되는 등 용도가 폭넓다.갑작스런 탄산가스 공급난은 프락자이어, 에어리퀴데 등 유럽지역 액체탄산가스 메이저들이 예고 없이 공급량을 줄였기 때문이다. 탄산가스는 비료원료인 암모니아 제조할 때 부산물로 나오는데 올 들어 암모니아 가격이 하락하면서 비료업체들이 프락차이더 등에 탄산가스 공급을 감축하면서 촉발됐다. 당초 5대 업체가 탄산가스를 생산했지만, 원료공급이 끊기면서 2개 업체만 가동되고 있는 상황이다.탄산가스 공급난으로 유럽의 대형 식품유통업체 부커는 소매상들에게 한 번에 구매할 수 있는 맥주를 10박스, 청량음료는 5박스로 제한했다. 영국 최대 식료품 유통업체 오카도는 냉동식품에 대한 판촉을 중지하고 고객들에게 신선 식품을 구매하도록 권유하고 있다. 냉장재인 드라이아이스 부족으로 냉동식품 장거리 배송이 불가능해졌기 때문이다. 영국 대형 슈퍼체인인 모리슨스도 냉장식품 주문을 받지 않고 있다. 식음료ㆍ주류회사들은 직격탄을 맞았다. 80곳의 거래처를 갖고 있는 영국 중부지방의 소규모 식음료업체인 홀덴은 지난 주 금요일부터 공장가동을 멈췄다. 하이네켄 계열사 존스미스의 대표맥주인 존스미스스미스와 암스텔도 탄산가스 수급이 어려워지면서 생산차질이 생겼다. 코카콜라 역시 제품생산에 어려움을 겪고 있다.육류 및 가금류 가공업체도 위기에 몰렸다. 탄산가스가 돼지, 닭 등 도축에 쓰이는 가스총에 사용되기 때문이다. 매주 6,000마리 가량의 돼지를 도살하는 스코틀랜드의 브레친돼지도살장은 26일 가동을 중단해야 했다. 닭고기 가공업체 투시스터스는 지난 주부터 가스총 대신 작업 시간이 긴 전기충격 방식으로 도살하고 있다. 영국 가금류협회(BPC)는 “탄산가스 공급난으로 전체 공장의 60%가 수일 내 문을 닫을 판”이라고 우려했다. 한편 업계에서는 7월초면 정상화될 것으로 예측하고 있지만 ‘동물복지’를 주장하는 육ㆍ가금류 가공업체와 대형 식음료 업체에 먼저 공급될 가능성이 높아, 중소업체들의 시름은 깊어지고 있다. 여름철 성수기와 월드컵 특수를 누리지 못할 가능성이 생겼기 때문이다. 이왕구 기자 fab4@hankookilbo.com▶한국일보 [페이스북] [카카오 친구맺기]▶네이버 채널에서 한국일보를 구독하세요![ⓒ 한국일보(hankookilbo.com), 무단 전재 및 재배포 금지]		"
71,2018.06.20. 오전 9:42,"맘스터치, '삼계탕'으로 가정간편식 시장 진출","패스트푸드 브랜드 최초 가정간편식 제품 선봬[이데일리 이성기 기자] 버거&치킨 브랜드 ‘맘스터치’가 오는 21일 첫 가정간편식(HMR) 제품 ‘맘스터치 삼계탕’(사진)을 선보인다. 패스트푸드 브랜드가 가정간편식 시장에 진출하는 것은 처음이다. 맘스터치 삼계탕은 오랜 기간 닭고기 활용 메뉴를 개발하며 축적해 온 노하우를 바탕으로 개발한 제품으로, 100% 국내산 닭에 찹쌀·인삼·대추를 넣고 긴 시간 우려내 깔끔하면서도 깊은 맛을 선사한다. 상온보관 후 간단히 데우기만 하면 조리가 끝나, 집에서 편하게 외식을 즐기려는 1인 가구와 혼밥족 등에게 큰 호응을 얻을 것으로 기대된다. 제품은 크기에 따라 대중삼계탕(800g), 소중삼계탕(600g) 2종으로 나뉘며 가격은 각각 6900원, 4900원으로 뛰어난 가성비를 자랑한다. 특수 매장 등 일부 매장을 제외한 맘스터치 전 매장에서 구입할 수 있다. 맘스터치 관계자는 “최근 가정간편식 수요가 급증함에 따라 집에서도 간편하게 여름철 대표 보양식인 삼계탕을 즐길 수 있도록 기획된 제품“이라며 “삼계탕을 시작으로 가정간편식 제품을 지속적으로 선보여 포트폴리오를 강화해 나갈 계획”이라고 말했다.이성기 (beyond@edaily.co.kr)'스냅타임' 페이지 좋아요 하면 경품이 펑펑 [선물받기▶]6·13 지방선거, '선거판 한 눈에 보기' [바로가기▶]최신 웹툰이 매일 공짜... 꿀잼 '웹툰' [감상하기▶]＜ⓒ종합 경제정보 미디어 이데일리 - 무단전재 & 재배포 금지＞"
72,2018.06.20. 오후 6:45,"맘스터치, ‘삼계탕’으로 가정간편식 시장 진출","			버거·치킨 브랜드 ‘맘스터치’가 21일 첫 가정간편식(HMR) 제품 ‘맘스터치 삼계탕(사진)’을 선보인다. 패스트푸드 브랜드가 가정간편식 시장에 진출하는 것은 처음이다.맘스터치 제공맘스터치 삼계탕은 오랜 기간 닭고기 활용 메뉴를 개발하며 축적해 온 노하우를 바탕으로 개발한 제품이다. 100% 국내산 닭에 찹쌀·인삼·대추를 넣고 긴 시간 우려내 깔끔하면서도 깊은 맛을 낸다.상온보관 후 간단히 데우기만 하면 조리가 끝나 집에서 편하게 외식을 즐기려는 1인 가구와 혼밥족 등에게 큰 호응을 얻을 것으로 기대된다. 제품은 크기에 따라 대중삼계탕(800g), 소중삼계탕(600g) 2종으로 나뉘며 가격은 각각 6900원, 4900원이다. 특수 매장 등 일부 매장을 제외한 맘스터치 전 매장에서 구입할 수 있다.맘스터치 관계자는 “최근 가정간편식 수요가 급증함에 따라 집에서도 간편하게 즐길 수 있도록 여름철 대표 보양식인 삼계탕 제품을 기획했다”이라며 “삼계탕을 시작으로 가정간편식 제품을 지속적으로 선보일 계획”이라고 말했다.[백예리 기자 byr@chosunbiz.com]chosunbiz.com"
73,2018.06.12. 오후 4:47,‘트럼프·김정은 버거’ 무료로 드립니다!… 싱가포르 호텔의 ‘응원’,"사진=싱가포르 일간지 '더 스트레이츠타임즈' 캡처역사적인 북미정상회담을 맞아 싱가포르의 식음료 업계도 활기를 띠고 있다. 식품 업체와 레스토랑들은 김정은 북한 국무위원장과 도널드 트럼프 미국 대통령을 상징하는 다양한 메뉴를 내놓으며 ‘정상회담 특수’를 즐기고 있다. 한 호텔은 북미정상회담의 성공적 개최를 기원하며 미니 사이즈 ‘트럼프-김정은 버거’ 250개를 무료로 나누기도 했다.싱가포르에 위치한 로열 플라자 온 스콧 호텔은 6월 8일부터 15일까지 ‘트럼프-김정은 버거’를 판매하고 있다. 다진 닭고기와 김치 패티로 만든 버거에 한국산 쌀로 만든 롤과 감자튀김을 곁들인 메뉴다. 여기에 아이스티에 꿀을 넣어 한국의 ‘유자차’와 비슷한 맛을 내는 음료도 내놨다. 미니 햄버거와 음료는 각각 12달러, 6달러로 그리 저렴한 가격은 아니지만 반응은 매우 긍정적이다.로열 플라자 온 스콧 호텔에서 판매 중인 '트럼프-김정은 버거'. (사진=뉴시스)호텔은 특별 제작한 250개의 ‘트럼프-김정은 미니버거’를 북미정상회담이 열린 이날 낮 12시에 무료로 나눴다. 이 소식을 알린 싱가포르 일간지 더 스트레이츠타임즈가 12시15분쯤 행사장에 방문했을 때는 이미 마지막 버거만 남아 있을 만큼 큰 인기와 관심을 받았던 것으로 알려졌다.사진=싱가포르 일간지 '더 스트레이츠타임즈' 캡처호텔의 총괄 매니저인 패트릭 가르시아 피아트는 “이번 행사는 역사적인 북미회담을 축하하고 두 정상의 우정을 기리기 위해 계획된 것”이라며 “오후 6시에 한 번 더 무료 나눔 행사를 가질 예정”이라고 밝혔다. 또 “이 햄버거처럼 두 정상의 조화로운 소통과 화합을 기대한다. 싱가포르인들 역시 이 메뉴를 매우 좋아한다”고 말했다.무료 버거를 받은 한 여성은 “버거에서 미국과 한국의 맛을 동시에 느낄 수 있었다. 한국식 매운맛이 버거의 감칠맛을 더한다. 아주 맛있다”며 칭찬을 아끼지 않았다. 이어 “두 정상이 싱가포르를 떠나기 전에 다음 회담 일정을 약속하길 바란다. 6개월 전 만해도 아무도 여기서 이런 일이 일어날 거라고 상상도 못했다. 부디 회담이 성공적으로 마무리돼 세계 평화에 기여할 수 있기를 바란다”고 덧붙였다.사진=싱가포르 일간지 '더 스트레이츠타임즈' 캡처신혜지 인턴기자[카카오 친구맺기] [페이스북][취재대행소 왱!(클릭)]GoodNews paper ⓒ 국민일보(www.kmib.co.kr), 무단전재 및 재배포금지"
74,2018.06.12. 오전 11:07,"[ET투자뉴스]해마로푸드서비스, ""2Q18 큰 폭의 …"" 매수(유지)-IBK투자증권","IBK투자증권에서 12일 해마로푸드서비스(220630)에 대해 ""2Q18 큰 폭의 이익 개선 기대""라며 투자의견을 '매수(유지)'로 제시하였고, 아울러 목표주가로는 3,500원을 내놓았다. IBK투자증권 김태현 애널리스트가 동종목에 대하여 이번에 제시한 '매수(유지)'의견은 IBK투자증권의 직전 매매의견에서 큰 변화없이 그대로 유지되는 것이고  그리고 최근 분기내 발표된 전체 증권사 리포트의 컨센서스와 비교를 해볼 경우에 오늘 발표된 투자의견은 전체의견에 수렴하고 있어, 이번 의견은 시장의 평균적인 기대감이 객관적으로 표현된 것으로 분석되고 있다. 또한 전일 종가 기준으로 볼때 동종목의 현주가는 이번에 제시된 목표가 대비 30.1%의 저평가 요인이 존재한다는 해석이 제시되고 있다. ◆ Report briefingIBK투자증권에서 해마로푸드서비스(220630)에 대해 ""동사의 2Q18 연결 매출액과 영업이익이 각각 745억원(+20.1% yoy), 61억원(+110.0% yoy)으로 추정된다. 작년 2분기 브라질산 부패 닭고기 파동과 햄버거병(HUS:용혈성 요독 증후군) 논란으로 악화됐던 실적이 기저효과로 작용, 큰 폭의 이익 개선이 가능할 전망""라고 분석했다.  또한 IBK투자증권에서 ""치킨은 매장에서 바로 먹거나 포장해가기보다 전화주문을 통해 시켜먹는 수요가 더 많다. 동사 치킨 메뉴의 가성비가 높은 만큼 배달 서비스를 확대한다면 치킨 판매량이 증가해 가맹점 평균 매출이 상승, 동사의 실적 성장에 도움이 될 것으로 기대된다""라고 밝혔다.  한편 ""계절적 성수기에 돌입하고 작년 기저 효과 감안 시, 2분기 실적 가시성이 높은 상황이다. 또 맘스터치 배달 서비스 확대 및 붐바타 가맹점 모집이 원활히 진행될 경우 하반기 실적 업사이드 요인으로 작용할 것으로 기대된다""라고 전망했다. ◆ Report statistics증권정보제공 업체인 씽크풀에 따르면 동사에 대한 컨센서스는 '매수'이고 목표주가의 추이를 살펴보면 최근 두차례 연속해서 목표가가 높아졌고 또한 이번 목표가의 상승폭도 더욱 커진 추세이다. <컨센서스 하이라이트> 컨센서스최고최저투자의견매수매수매수목표주가3,3003,5003,100*최근 분기기준오늘 IBK투자증권에서 발표된 '매수(유지)'의견 및 목표주가 3,500원은 전체의견에 수렴하면서 시장의 평균적인 기대감이 비교적 객관적으로 표현된 것으로 풀이되며 목표가평균 대비 6.1% 초과하고 있는 것으로 집계되었다.  참고로 최근 증권사 매매의견 중에서 제일 보수적인 의견을 제시한 메리츠종금증권에서 투자의견 '매수'에 목표주가 3,100원을 제시한 바 있다.  의견제시일자투자의견목표가격20180612매수(유지)3,50020180531매수(신규)3,300<최근 리포트 동향>의견제시일자증권사투자의견목표가20180612IBK투자증권매수(유지)3,50020180503메리츠종금증권매수3,100(씽크풀에서 제공하는 컨센서스는 국내 전증권사에서 발표되는 기업분석 리포트 및 코멘트를 실시간으로 통계/분석처리되고 있습니다.)증시분석 전문기자 로봇 ET etbot@etnews.com전자신문과 씽크풀의 증시분석 전문기자 로봇 ET가 쓴 기사입니다▶ 전자신문 바로가기 [Copyright ⓒ 전자신문 & 전자신문인터넷, 무단전재 및 재배포 금지]"
75,2018.06.11. 오전 11:20," BHC 가맹점협의회, 본사에 대화촉구 2차 서한  ","			 [한겨레] “13일까지 대화의지 밝혀달라” 재요구튀김용 오일 등 거래내역 공개·인하 요청본사, 검토에 시간 필요…1차 요구엔 침묵점포당 200만원 지원은 6월 내 집행 계획지난 5월23일 오전 서울 여의도 국회 앞에서 치킨 프랜차이즈인 비에이치씨(BHC)의 가맹점주들이 협의회 설립총회와 기자회견을 열고 본사가 지나치게 비싸게 공급하는 구입 강제 품목의 거래내역 공개와 가격 인하를 요구하고 있다. 신소영 기자 viator@hani.co.kr  치킨 프랜차이즈인 비에이치씨(BHC) 가맹점주 모임인 ‘가맹점협의회’가 11일 본사에 가맹점과의 상생을 위한 협의를 촉구하는 2차 서한을 보내고, 오는 13일까지 대화 의지를 밝혀달라고 요청했다. 가맹점협의회는 지난 4일 1차 서한을 통해 8일까지 대화 의지 표명을 요청했으나, 본사는 아무런 답변을 하지 않았다.   비에이치씨 가맹점협의회(회장 진정호 울산 옥동점 대표)는 이날 비에이치씨 본사(대표 임금옥)에 보낸 2차 서한을 통해 “지난달 23일 협의회가 설립된 뒤 본사가 업계 상생의 모범사례를 만들자며 (협의회에 대해) 협력과 지원을 하겠다고 밝혔으나, 협의회의 상생협의 요청을 일방적으로 무시한 것은 대화 의지가 없다는 의심을 불러일으킨다”고 지적했다. 협의회는 이어 “본사가 가맹점주와의 소통창구로 운영해온 ‘신바람광장’에서 최근 이뤄지고 있는 과거 게시 글 일괄 삭제, 댓글 기능 차단, 협의회 관련 부정적인 글 게시 등도 가맹점주들을 불안과 두려움 속으로 밀어넣고 있다”고 우려했다.  협의회는 또한 “가맹점주들은 비에이치씨의 브랜드 가치가 훼손되거나, 성실하게 일하는 다수의 본사 임직원에게 고통을 주려고 하는 게 아니다”면서 “가맹점주들이 본사에서 구입하는 닭고기, 튀김용 오일 등 구입 강제 품목들이 지나치게 비싸게 공급되지는 않는지 거래내역을 투명하게 공개하고, 본사와 가맹점주 간의 수익구조를 합리적으로 조정해주기를 희망한다”고 밝혔다. 가맹점협의회에는 1400여명의 가맹점주 가운데 1100여명이 참여하고 있다.  비에이치씨 본사는 이에 대해 “협의회의 대화 요청을 거부하는 것이 아니라, 구입 강제 품목 가격 인하 등과 같은 요구사항을 검토하는데 시간이 걸리고 있는 것”이라며 “가맹점주에게 약속한 점포당 200만원의 지원금은 6월 안에 지급할 계획”이라고 말했다. 곽정수 선임기자 jskwak@hani.co.kr◎ Weconomy 홈페이지 바로가기: http://www.hani.co.kr/arti/economy◎ Weconomy 페이스북 바로가기: https://www.facebook.com/econohani ▶ 한겨레 절친이 되어 주세요! [신문구독] [사람과 동물을 잇다 : 애니멀피플] [카카오톡][ⓒ한겨레신문 : 무단전재 및 재배포 금지]"
77,2018.06.11. 오전 9:09,"[특징주]마니커, 상한…CJ제일제당이 2대주주로","			닭고기 업체 마니커가 CJ제일제당의 대규모 투자 소식에 가격제한폭까지 치솟았다.11일 오전 9시 5분 현재 마니커는 전날보다 260원(29.55%) 오른 1140원에 거래되고 있다.마니커는 CJ제일제당을 대상으로 신주 1633만6056주(보통주)를 발행하는 3자 유상증자를 실시해 140억원을 조달하기로 했다고 지난 8일 공시했다.신주 납입일은 다음달 25일이며 상장 예정일은 오는 7월6일이다. CJ제일제당은 신주 인수로 마니커 지분 12.27%를 확보해 이지바이오(지분 22.81%)에 이어 2대주주가 된다.CJ제일제당은 마니커 지분을 확보해 글로벌 생물자원과 사료사업 역량을 끌어올릴 것으로 기대하고 있다.정형석 한경닷컴 기자 chs8790@hankyung.com[한경닷컴 바로가기] [글방] [모바일한경 구독신청] ⓒ 한국경제 & hankyung.com, 무단전재 및 재배포 금지		"
80,2018.06.07. 오후 5:52,[오!클릭] 북미회담 앞두고 분위기 후끈…이색 음식 등장,"			북미정상회담을 앞두고 개최지인 싱가포르의 분위기가 후끈 달아오르고 있습니다.기념주화 발행에 이어, 이번에는 북미정상회담을 주제로 한 이색 음식들도 등장했습니다.<오! 클릭> 첫 번째 검색어는 '북미정상회담 음식'입니다.싱가포르의 한 음식점에서 출시한 '나시르막'이라는 음식입니다.나시르막은 코코넛 밀크를 넣고 지은 쌀밥에 반찬을 곁들인 음식으로 말레이시아어로 '맛있는 밥'이라는 뜻인데요, 이 특별 메뉴에는 미국산 소고기와 김치가 반찬으로 곁들여졌습니다.한 5성급 호텔은 내일(8일)부터 15일까지만 판매되는 '트럼프-김정은 햄버거 세트'와 '정상회담 아이스티'를 선보였는데요.닭고기 패티 위에 김치를 얹은 햄버거는 미국 성조기와 북한 인공기로 장식했고 감자튀김과 함께 김밥이 나옵니다.이 햄버거 세트의 가격은 우리 돈으로 9천600원, 미국식 아이스티에 유자를 가미한 정상회담 아이스티는 약 4천800원이라고 합니다.현지의 한 멕시코 음식점은 김 위원장의 별명과 트럼프 대통령의 이름을 각각 따 '로켓맨 타코'와 엘 트럼포 타코'라는 신메뉴를 내놨고요, 한 주점은 '트럼프'와 '김'이라는 이름의 칵테일을 내놨습니다.누리꾼들은 ""5성급 호텔 햄버거가 만 원도 안 되다니.. 제주에서 먹은 수제버거 보다 싸네??"" ""가만 보면 싱가포르 사람들이 제일 신이 난 거 같아ㅋㅋ"" 등의 반응을 보였습니다. ☞ [선거방송의 강자] SBS가 전하는 6.13 지방선거!☞ [마부작침 #페이미투] 남녀 임금차별 실상 공개☞ [다시 뜨겁게! 러시아월드컵 뉴스 특집] 바로가기※ ⓒ SBS & SBS Digital News Lab. : 무단복제 및 재배포 금지		"
81,2018.06.08. 오후 5:52,"트럼프+김정은 마케팅, 환상의 앙상블","체다치즈+불고기 ‘평화버거’ 등싱가포르 식당가 6ㆍ12메뉴 불티호텔 밖 광고판은 포토존 명소로대할인 시작하며 쇼핑가도 붐업로얄 플라자 호텔 외벽에 붙은 ‘트럼프-김정은 햅버거’ 광고판 앞에서 관광객들이 사진을 찍고 있다.북한과 미국의‘세기의 핵담판’ 이 목전으로 다가오면서 싱가포르 식당가에서는 북미 정상회담을 이용한 메뉴들이 속속 등장하고 있다. 장삿속이라는 비판도 나오지만 ‘평화’라는 메시지를 담고 있어 손님들의 반응은 뜨겁다. 8일 오후 찾은 싱가포르 선텍시티 내 울프버거는 빈 자리를 찾아보기 힘들었다. 전날부터 미국산 체다치즈와 한국의 불고기 조합으로 만든 ‘평화버거’를 팔고 있는 곳이다. 계산대의 직원은 “가장 많이 팔리는 메뉴는 아니지만, 어제 출시한 것 치고는 성적이 좋다”고 귀띔했다. 실제 가게 밖에 놓인 광고판은 손님 유인에 꽤 효과가 있는 듯 했다. 광고판을 보고 들어왔다는 브라질 국적의 한 여성 직장인은 “치즈와 불고기 맛이 의외로 잘 어울린다”며 “회담이 끝난 뒤 쭉 팔아도 되겠다”고 말했다. 이 햄버거는 17일까지만 판매된다. 인근의 다른 식당인 하모니 나시레막도 ‘트럼프-김정은 마케팅’ 효과를 톡톡히 보고 있었다. 이 식당은 북미 정상이 각각 자국의 김치와 미국산 쇠고기를 치켜세우는 그림을 밖에 내건 식당이다. 직원 코코씨는 “양 정상 그림을 밖에 내건 뒤 손님이 10% 이상 늘었다”고 말했다. 이 식당은 많은 손님들이 양 정상 그림을 사진으로 찍어가자 이날 아예 별도의 포토 존까지 설치했다.트럼프-김정은 햄버거 아이디어를 낸 로얄 플라자 호텔 패트릭 피아트 대표(CEO)와 레시피를 만든 수석 쉐프 에이브라함 탄.스콧가(街)에 자리잡은 로얄 플라자 호텔도 외부에 내건 햄버거 사진과 사진을 찍으려는 관광객들로 붐볐다. 앞서 외신들이 이 호텔에서 8~15일 ‘트럼프-김정은 햄버거’를 판매한다는 소식을 전하면서 명소 아닌 명소가 된 곳이다. 닭고기로 만든 패티 위에 김치가 얹혔고, 빵 위에는 인공기와 성조기가 꽂힌 햄버거다. 한국의 김밥과 미국의 감자튀김이 더해져 세트로 제공되며 가격은 회담 날짜에 맞춘 12싱가포르달러(약 1만원)다. 이날 오후 6시부터 트럼프-김 햄버거를 팔기 시작한 이 식당은 원래 뷔페식당으로 햄버거를 취급하지 않았던 곳. 그러나 트럼프 대통령이 후보 시절부터 “김정은과 햄버거를 먹으면서 대화할 수 있다”고 한데 착안해 한시적 판매에 나섰다. 호텔 대표(CEO) 패트릭 피아트씨는 “소식이 전해진 뒤 해외에서도 문의가 들어오고 있다”고 전했다. 트럼프-김정은 햄버거로 호텔 홍보까지도 톡톡히 한 셈이다.트럼프-김정은 메뉴를 내놓은 뒤 매출 증대 효과를 본 한 식당이 8일에는 포토존까지 설치했다.싱가포르 선택시티 내 울프버거가 7일부터 출시한 햄버거 광고판을 지나가는 직장인들이 쳐다보고 있다.8일 싱가포르 오차드 거리 풍경. 8일부터 8월 12일까지 이어지는 '더 그레이트 싱가포르 세일'을 알리는 다양한 배너들이 거리를 수놓고 있다.이날 시작된 ‘더 그레이트 싱가포르 세일’도 북미 정상회담 때문에 붐업될 것으로 보인다. 싱가포르에서 6월초는 쇼핑몰들이 일제히 할인에 들어가는 때로 외국인들이 가장 많이 찾는 시기다. 특히 시내 곳곳에 할인행사 소식을 알리는 각양각색의 배너들이 내걸리면서 임박한 북미 정상회담과 맞물려 분위기가 고조되고 있다. 현지 PR업체 ‘MyagenC’의 노라 쨩 대표는 “화합ㆍ평화라는 컨셉트는 식품에 연관시키기가 쉽지 않은 개념”이라면서 “이런 상품들이 인기를 끌고 있는 만큼 오늘 시작한 대할인행사에서도 이용될 가능성이 높다”고 말했다. 싱가포르 대할인 행사는 8월 12일까지 이어진다.싱가포르=글ㆍ사진 정민승 특파원 msj@hankookilbo.com▶한국일보 [페이스북] [카카오 친구맺기]▶네이버 채널에서 한국일보를 구독하세요![ⓒ 한국일보(hankookilbo.com), 무단 전재 및 재배포 금지]		"
