,날짜,기사제목,기사내용
0,2018.06.13. 오전 8:11,끝 모르고 떨어지는 닭고기·계란 값…바닥 언제 치나,"닭고기 가격 평년대비 27.1% 하락, 계란 값도 평년보다 46.3% 추락  [아시아경제 심나영 기자] 계란과 닭고기 가격이 좀처럼 오를 기미를 보이지 않고 있다. 공급량이 늘면서 오는 8월까지도 가격은 계속 하락 추세일 것으로 예상된다.13일 aT한국농수산식품유통공사가 발표한 주요 농산물 일일 도매가격에 의하면 12일 기준 닭고기(산지 1kg 기준) 가격은 1117원으로 집계됐다. 평년 6월 중순 가격인 1532원보다 27.1% 하락한 가격이다. 지난달 대비해서도 떨어졌는데 5월 중순까지만해도 1462원이었다. 전달 대비해선 가격이 23.6%나 주저앉은 셈이다.계란(산지 특란10개 기준) 가격은 696원으로 전년 같은 기간 가격(1297원) 대비 46.3%나 떨어졌다. 계란 역시 지난달에 비해서도 20.3% 가격이 추락했다.한국농촌경제연구원 농업관측본부는6월 육계 산지가격에 대해 ""병아리 생산 증가로 6월 육용계 사육 마릿수 전년보다 8.7% 증가한 것으로 추정된다""며 ""6월 도계 마릿수는 육용계 사육 마릿수 증가로 전년 대비 9.2% 증가할 전망""이라고  말했다.이에 따라 7~8월에도 육계 산지가격 전년보다 하락할 전망했다.한국농촌경제연구원  6∼8월 사이 계란 산지 가격도 전년보다 크게 낮을 것으로 예상했다. 6월 산란용 닭 마릿수는 산란 가담 신계군 증가로 전년보다 29.6% 증가한 5770만 마리로 전망했다. 6개월령 이상 산란용 닭 마릿수 증가로 6∼8월 계란 생산량은 전년보다 20% 내외 증가. 6∼8월 계란 산지 가격은 계란 생산량 증가로 전년보다 크게 하락한 750∼900원(특란 10개)선에 머물 것으로 보인다.심나영 기자 sny@asiae.co.kr▶ 네이버 홈에서 '아시아경제' 뉴스 확인하기▶ 양낙규의 '군사이야기' ▶ 재미와 신기 '과학을읽다'<ⓒ세계를 보는 창 경제를 보는 눈, 아시아경제 무단전재 배포금지>		"
1,2018.06.24. 오전 6:40,"""곧 복날인데""…닭값 '폭락'에도 '삼계탕'은 되레 올라","닭고기 1㎏ 도매가 1164원 … 평년보다 25% 하락닭고기 1㎏ 소매가도 4735원으로 평년보다 18% 떨어져 … 전년보다는 15% 하락지난달 삼계탕 외식가격 전국 평균은 1만2939.8원 … 전년比 2.7% 상승16개 시·도 중 삼계탕 가격 14곳서 오르고 2곳은 동일 … 떨어진 곳 無대형마트 매대에 놓인 닭고기(사진=아시아경제 DB)[아시아경제 박미주 기자]1년 새 닭고기 도·소매 가격이 급락했음에도 삼계탕 외식 가격은 되레 오른 것으로 나타났다. 생닭 가공식품 가격은 찔끔 하락하는 데 그쳤다.24일 한국농수산식품유통공사(aT)에 따르면 지난 22일 기준 닭고기(산지)의 ㎏당 도매가격은 1164원으로 평년 대비 24.9% 하락했다. 닭고기 중품 1㎏의 소매가격 또한 전국 평균 4735원으로 평년 대비 18.1%, 1년 전 대비 15.0% 각각 떨어졌다.그러나 닭고기 가공식품 가격은 한국소비자원의 가격 정보 사이트 '참가격'을 보면 이달 '하림 토종닭백숙(1050g)'의 가격은 9365원으로 1년 전 9990원 대비 6.3% 하락하는 데 그쳤다. 같은 기간 하림 자연실록백숙(830g) 가격은 7797원에서 7768원으로 0.4%만 내렸다.삼계탕 외식 가격은 오히려 올랐다. 지난달 기준 전국의 삼계탕 가격 평균은 1만2939.8원으로 1년 전 1만2599.5원보다 340.3원(2.7%) 상승했다.16개 시·도 중 2곳을 제외한 전 지역에서 삼겹살 외식 가격이 올랐다. 광주와 제주도의 삼계탕 지난달 외식 가격이 1년 전과 동일했다. 떨어진 곳은 없었다.지역별로 지난달 삼계탕 외식 가격이 가장 비싼 곳은 광주였다. 1만4400원으로 전국 평균보다 11.3%나 높았다.다음으로 비싼 곳은 서울(1만4077원)이었다. 이어 경상남도(1만3800원), 전라북도(1만3600원), 부산(1만3286원), 전라남도(1만3222원), 인천(1만3167원), 경기도·대구(1만3000원) 순으로 전국 평균보다 가격이 높았다.가장 삼계탕 외식 가격이 저렴한 곳은 1만1857원인 충청북도였다. 다음으로 대전·경상북도(1만2000원), 울산(1만2200원), 제주도(1만2250원), 충청남도(1만2400원), 강원도(1만2778원) 등의 가격이 전국 평균보다 낮았다.삼계탕(사진=롯데마트)박미주 기자 beyond@asiae.co.kr▶ 네이버 채널 설정하고, 룰렛 당첨 확인 GO ▶ 양낙규의 '군사이야기' ▶ 재미와 신기 '과학을읽다'<ⓒ세계를 보는 창 경제를 보는 눈, 아시아경제 무단전재 배포금지>		"
2,2018.06.24. 오후 7:55,산지 닭값 급락했는데도 삼계탕 가격은 올라,"			【 앵커멘트 】  본격적인 무더위가 시작되면서 여름 보양식인 삼계탕 찾는 분들 많으실 텐데요.  그런데 최근 산지 닭고기값이 20년 만에 최저 수준으로 떨어졌다는데, 삼계탕 가격은 오히려 왜 오르고 있을까요?  서영수 기자입니다.【 기자 】  닭고기 1㎏당 산지 도매가격은 25%나 떨어졌고,  시중에 팔리는 생닭 가격도 지난해보다 15% 넘게 떨어졌습니다. 20년 만에 최저 수준입니다.  농가들이 조류인플루엔자 이후 닭 사육을 늘리고, 월드컵 등 시즌 특수를 노려 공급량을 많이 늘렸기 때문입니다  그런데 여름 보양식인 삼계탕값은 오히려 오르고 있습니다.  지난달 전국의 삼계탕값 평균은 1만2천9백 원으로 1년 전 보다 2.7%, 340원 올랐고,   특히 서울과 광주는 삼계탕 한 그릇이 1만 4천 원을 넘어섰습니다.▶ 인터뷰 : 서민석 / 인천 용현동- ""음식점에서 사먹는 경우에 삼계탕이 가격이 올라서 평소에 먹고 싶다고 할 때는 먹기가 좀 부담스러운 가격이죠.""  양계농가와 유통업체 간에 계약구조 탓에  산지 닭값이 폭락해도 식당에 들어오는 닭고기값에는 전혀 차이가 없습니다.▶ 인터뷰 : 삼계탕 식당 상인- ""내릴 수가 없는 거죠. 들어오는 가격이 내려줘야 하는데 거기서 안 내려주니까요. 도매상에서 올 때는 오히려 200원 올려서 왔어요.""  산지 가격 폭락에도 요지부동인 닭고기 가격 탓에 곧 다가올 복날에도 비싼 삼계탕을 먹을 수밖에 없는 현실입니다. MBN뉴스 서영수입니다.  영상취재 : 김 원 기자  영상편집 : 김민지< Copyright ⓒ MBN(www.mbn.co.kr) 무단전재 및 재배포 금지 >		"
4,2018.06.26. 오전 8:39,"더 비싸진 한우…""소고기 먹기 힘들어졌다""","한우 공급 감소하며 가격 상승세…평년 대비 14.7% 가격 올라 [아시아경제 심나영 기자] 한우 가격이 크게 올랐다. 한우 고기 공급이 감소하면서 도매시장 기준 가격이 상승했다. 26일 한국농수산식품유통공사가 발표하는 주요 농산물 일일 도매가격에 따르면 25일 기준 소고기 가격은 한우 지육 kg당 1만7961원으로 평년 대비 가격이 14.7% 올랐다. 이달 중순 가격은 1만8376원으로, 최고점 대비 가격이 하락했지만 여전히 높은 수준이다.7월에도 한우가격은 상승세를 탈 전망이다. 한국농촌경제연구원 농업관측본부는 ""3~5월 등급판정 마릿수는 지난해 같은 기간보다 3.6%감소했으며, 6월에도 등급판정 마릿수가 3만3000마리로 전년 동기간 보다 6.0% 떨어졌다""고 설명했다.공급 감소에 따라 가격이 오르면서 쇠고기 수입량은 지난해 대비 늘어났다. 올해 1~5월 쇠고기 수입량은 지난해 같은 기간보다 16.6% 증가한 15만6000t으로 집계됐다.반면 돼지고기 가격은 아직까지 평년수준을 유지하고 있다. 25일 기준 돼지고기 지육 1kg가격은 5523원으로 평년 대비 3.1% 정도 상승했다.그러나 7월부터 돼지 도매가격은 공급량 증가로 하락할 것으로 예상된다.등급판정 마릿수 증가에 따라 돼지고기 생산량도 늘어났기 때문이다. 전년 동월보다 하락한 kg당(탕박 기준) 평균 4900∼5200원으로 전망된다.농업관측본부는 ""6월 사육 마릿수는 1.0∼2.8% 증가한 1130∼1150만 마리로 집계됐다""며 ""7월 돼지고기 생산량은 등급판정 마릿수가 증가함에 따라 전년 동월보다 6.5% 증가한 6만 6000t으로 전망된다""고 설명했다.다음달에도 닭고기와 계란 가격은 여전히 하락세일 것으로 보인다. 농업관측본부는 ""육계 산지가격은 전년보다 낮은 kg당 950~1150원선에서 판매될 것""이라며 ""6~8월 계란 산지가격도 생산량 증가로 특란 10개 기준 750~900원선으로 전녀보다 크게 하락할 것""이라고 말했다. 25일 기준 닭고기 가격은 육계 kg기준, 1169원으로 평년 대비 24.5% 하락했으며, 계란도 특란 10개 기준 579원으로 평년 대비 54.4% 떨어졌다.심나영 기자 sny@asiae.co.kr▶ 네이버 채널 설정하고, 룰렛 당첨 확인 GO ▶ 양낙규의 '군사이야기' ▶ 재미와 신기 '과학을읽다'<ⓒ세계를 보는 창 경제를 보는 눈, 아시아경제 무단전재 배포금지>		"
5,2018.06.14. 오전 11:00, BHC 가맹점주들이 김상조 취임 1주년에 모인 이유 ,"			 [한겨레] 가맹점협의회 14일 세종시 공정위 앞에서 평화집회“소상공인 위한 갑질근절 대책으로 용기” 긍정 평가“외국계 사모펀드 인수 뒤 가맹점 희생 강요” 주장협의회 결성 뒤 닭고기 인하·판촉물 강요 개선 성과본사, 협의회 공식 인정했으나 협의 요청에는 ‘침묵’치킨 프랜차이즈인 비에이치씨BHC) 갸맹점주 모임인 ‘가맹점협회의’ 회원 350여명이 14일 오전 세종시 공정거래위원회 청사 앞에서 평화집회를 열고, 김상조 공정위원장의 취임 1주년을 축하하며 비에이치씨 본사의 불공정행위 개선을 촉구하고 있다. 가맹점협의회 제공  치킨 프랜차이즈인 비에이치씨(BHC) 가맹점주들의 단체인 ‘가맹점협의회’(회장 진정호 울산 옥동점 대표)가 14일 세종시 공정거래위원회 앞에서 집회를 갖고, 김상조 공정위원장의 취임 1주년을 축하하고 비에이치씨 본사의 불공정행위 개선을 촉구했다.  가맹점협의회 회원 350여명은 이날 집회에서 “지난해 6월 김 위원장의 취임 이후 소상공인들을 위한 정책으로 가맹점주들이 용기를 얻을 수 있었다”면서 “취임 1주년을 진심으로 축하한다”고 밝혔다. 또 “김 위원장 취임 이후 갑질 근절의 일환으로 사회적 감시의 사각지대에 있던 가맹·유통·하도급·대리점에 대한 이른바 ‘4대 갑질 근절대책’을 내놓아 소상공인의 경제환경 개선을 위해 상당히 좋은 변화가 있었다”고 평가했다.   협의회는 이어 “프랜차이즈 업계는 가맹본부와 가맹점 간의 불균형 거래구조가 여전하다”면서 “특히 외국계 사모펀드가 운영하는 프랜차이즈는 국내기업에 비해 사회적 감시체제가 상당히 미비해서 기업실적을 공개하지 않고, 수익성 극대화만을 위해 음성적인 불공정행위들이 상당수 발생하고 있다”고 지적했다. 또 “비에이치씨 가맹본부의 불공정행위도 2013년 외국계 사모펀드(미국계인 로하틴그룹)가 인수한 뒤 가맹점주들의 희생을 강요해온 결과”라면서 “외국계 사모펀드가 비에이치씨를 재매각한다면, 이전보다 더 큰 수익성을 올리기 위해 가맹점주들을 더 착취하고 불공정한 거래를 할 것으로 예견되기 때문에, 지금 비에이치씨 본사와 가맹점 간의 왜곡된 수익구조와 같은 근본적인 문제점들을 바로잡아야 한다”고 주장했다.  김 위원장은 지난달 23일 협의회가 출범한 뒤 가맹점주들의 면담 요청에 응하겠다고 약속했고, 공정위 담당자들이 협의회와 만나 현황을 파악하고 요구사항을 들었으나, 아직 면담은 이뤄지지 않고 있다. 협의회는 본사가 가맹점에 공급하는 닭고기와 튀김용 오일 등 이른바 구입강제 품목들이 지나치게 비싸다며 거래내역의 투명한 공개와 가격인하를 요청하고 있다.  협의회는 비에이치씨 본사가 상생을 위한 공식 협의 요청에는 응하지 않고 있으나, 협의회 출범 이후 일부 성과가 나타나고 있다고 밝혔다. 진정호 협의회 회장은 “본사에서 일괄적으로 발주하거나 사실상 강제적인 판촉물 밀어넣기 행위가 사라졌고, 이유는 알 수 없지만 닭고기 신선육 공급가격이 일부 인하됐다”고 밝혔다. 비에이치씨 본사는 또 4월부터 집행을 미뤄왔던 가맹점별 200만원 지원금 지급도 6월 중에 이행하겠다는 방침을 언론을 통해 알렸다.  협의회는 지난 4일과 11일 두차례에 걸쳐 본사에 공식 서한을 보내 협의회에 공식 인정과 상생을 위한 협의를 요청했다. 비에이치씨 본사는 지난 12일 누리집 게시판을 통해  협의회를 공식 인정한다고 발표했으나, 정식 협의 요청에는 직접적인 답변을 하지 않고 있다. 협의회는 1400여명의 가맹점주 가운데 1100여명이 참여하고 있다.  곽정수 선임기자 jskwak@hani.co.kr◎ Weconomy 홈페이지 바로가기: http://www.hani.co.kr/arti/economy◎ Weconomy 페이스북 바로가기: https://www.facebook.com/econohani ▶ 한겨레 절친이 되어 주세요! [신문구독] [사람과 동물을 잇다 : 애니멀피플] [카카오톡][ⓒ한겨레신문 : 무단전재 및 재배포 금지]"
6,2018.06.24. 오후 9:13,"[이슈플러스] 치킨 '월드컵 특수', 정작 양계농가는 '울상'…왜?","			[앵커]월드컵 시즌에 가장 많이 먹는 야식, 역시 치킨입니다. 멕시코 전이 열린 어제(23일), 한 치킨 프랜차이즈의 매출은 다른 주말보다 70% 늘었습니다. 스웨덴 전이 열린 18일에는 치킨에 쓴 카드 금액이 일주일 전의 133%, 그러니까 2배도 넘습니다. 소비자들 사이에서는 부쩍 오른 치킨 값에 불만도 나옵니다. 양계 농가에서는 정작 닭고기 값이 폭락해 울상입니다. 산지 가격과 소비자 가격이 왜 이렇게 다른지, 알아봤습니다.박영우 기자입니다. [기자]주말 여의도 한강공원이 나들이 나온 시민들로 북적입니다.간식은 뭐니뭐니해도 치킨입니다. 하지만 부쩍 오른 가격은 부담스럽니다.   [박우현/경기도 안양시 : 닭고기 가격이 뉴스에서 내려간다고 봤는데 치킨집에서 파는 거는 2만원이 넘어가고 너무 비싸져서 사 먹기가 부담스러워졌어요.]치킨 뿐 아니라 삼계탕도 전국 평균 가격이 1만 3000원에 육박하며 1년전보다 3% 가량 올랐습니다.반면 산지 닭값은 폭락했습니다.가장 많이 팔리는 10호 닭은 마리당 산지가격이 1kg 당 1137원입니다.1년 전보다 26% 떨어진 수준입니다.AI 사태가 마무리된데다 농가들이 월드컵 특수를 기대하고 사육을 늘리면서 입니다.산지 닭값이 이처럼 떨어졌는데도 소비자가 체감하기 어려운 건 유통구조 때문입니다.국내 농가 상당수는 도계업체와 미리 위탁 사육 계약을 합니다.이과정에서 닭값도 미리 정해놓는데 시세가 오르거나 내려도 계약 당시 가격으로 거래됩니다.업체들은 또 인건비와 운송비, 임대료 등 유통 비용이 꾸준히 오르고 있어 원료값 하락을 가격에 반영하기 어렵다고 말합니다.산지 가격과 소비자 가격의 괴리를 줄이기 위해서는 복잡한 유통단계를 줄이고, 프랜차이즈 본사가 과도한 이익을 챙기는 것을 견제할 장치가 필요하다는 지적입니다.박영우(november@jtbc.co.kr) [영상취재: 김재식 / 영상편집: 김정은]▶ 라이브 시청은 유튜브로, 제보는 뉴스룸으로!▶ 스토리, 라이브, 비하인드! JTBC 소셜스토리Copyright by JTBC(http://jtbc.joins.com) and JTBC Content Hub Co., Ltd. All Rights Reserved. 무단 전재 및 재배포 금지		"
7,2018.06.19. 오전 6:01,"계란값 폭락에 살충제 공포 여전…농가 ""수급조절 대책을""","- 계란값 3916원, 1년 전 가격의 ‘반값’- 계란 공급량 크게 늘었지만 소비 줄어- 살충제 계란 파동 후 불신 해소 안 돼- 정부, 무항생제 축산물 관리감독 강화(사진=연합뉴스)[이데일리 강신우 기자] “계란값이 폭락하고 있다. 공급량이 늘어난 영향도 있지만 소비가 줄어든 탓도 있다. 소비가 준 이유는 단 하나다. 지난해 여름 살충제 계란 파동 이후 계란에 대한 소비자 불신이 높아진 데 대해 정부가 똑부러지는 대책을 내놓지 못했기 때문이다.”한 축산업계 관계자는 18일 이렇게 말했다. 지난해 발생한 조류인플루엔자(AI)와 살충제 계란 파동으로 1만원대까지 치솟던 계란값이 올해 들어 연일 하락세를 보이며 폭락하자 정부가 수급조절을 제대로 못 한 것 아니냐는 비판이 인다. 여기에 살충제 계란 파동 후 농림축산식품부가 농가 관리를 강화한다는 방침을 세웠지만 소비자 불신은 여전하다는 평가다. ◇계란 생산량 전년比 20% 늘자 가격 뚝한국농수산식품유통공사(aT)에 따르면 계란 값 평균은 3916원(15일 기준·30개)으로 집계됐다. 이는 불과 한 달 전 가격인 4364원에 비해 10%가량 떨어졌으며 평년(5년간 해당일에 대한 최고, 최소값을 제외한 3년 평균값) 6018원에 비해서도 크게 하락했다. 살충제 파동이 있던 작년 같은 시기 대비해서는 거의 반값 수준이 됐다. 계란값이 폭락한 것은 공급량이 크게 늘었기 때문이다. 한국농촌경제연구원 농업관측본부가 낸 자료를 보면 지난 3월 산란계 총 사육 마릿수는 전년보다 38.2% 증가한 7132만 마리였으며 이 중 6개월령 이상 산란용 마릿수는 전년보다 29.7% 증가한 5200만 마리로 나타났다. 알을 낳는 닭이 1년 전에 비해 크게 늘었다는 이야기다. 공급이 늘다 보니 자연스레 가격은 떨어졌다. 지난 5월(1~23일) 계란 산지가격은 계란 생산량 증가로 전년(2109원) 대비 57.7% 하락했다. 평년에 비해서도 30.4%나 값이 덜 나간다. 향후 전망도 밝지 않다. 6월부터 8월까지 계란 생산량은 전년대비 20% 증가하고 계란 산지가격도 약세가 지속될 것으로 농업관측본부는 보고 있다. 육계 역시 다르지 않다. 6월 육계 사육 마릿수는 병아리 생산 증가로 전년보다 8.7% 증가한 1억1325만 마리로 집계됐다. 공급량 증가로 닭고기 가격은 전년보다 최대 24.6% 하락, ㎏당 1500 수준이다. [이데일리 이동훈 기자]◇“관리감독 허술, 정부가 불신키워”상황이 이렇자 업계에서는 볼멘소리가 나온다. 지난 2016~2017년 조류 인플루엔자(AI)로 국내 가금류의 약 3분의 1이 살처분 되면서 공급량이 감소, 계란 한판 가격이 1만원에 육박했다. 이에 정부는 가격 잡기에 나서며 계란과 종계 수입을 대대적으로 단행했고 이후 공급량 증가로 이어졌다는 주장이다. 한 업계 관계자는 “가격이 오를 때는 사력을 다해 뛰는 가격을 잡으려 했던 정부가 폭락 하니 아무런 대책도 내놓지 않고 있다”고 말했다. 소비자의 불신이 완전히 해소되지 않은 것도 계란값 폭락의 주요 원인으로 분석된다. 살충제 계란 파동 당시 친환경 인증에 포함된 무항생제 계란에서도 살충제 성분이 검출되면서 불신이 일파만파 커졌다. 업계 관계자는 “정부는 농가에 ‘제대로 하라’는 지침만 내렸을 뿐 관리감독을 허술하게 해 벌어진 일이었다”며 “농식품부가 무항생제 축산물 기준을 강화했다지만 소비자들은 아직도 계란 사 먹기를 꺼려 하는 분위기”라고 했다. 농림축산식품부는 지난 1월 ‘무항생제 축산물 인증제도 개선방안’을 내놨다. 무항생제 축산물은 친환경농산물 인증에서 제외하고 축산법에 무항생제축산물 인증기준을 따로 뒀다. 또 무항생제 인증 마크는 사용할 수 있지만 ‘친환경’ 표시는 못하게 했다. 관리감독을 더욱 강화하겠다는 것으로 무항생제 축산물은 전 생애에 걸쳐 동물용의약품 사용이 원칙적으로 금지된다. 또 고의로 농약을 사용했거나 인증 취소 3회 처분을 받은 축산 농가는 퇴출하는 방안도 거론되고 있다. 농식품부 관계자는 “기존 계란 상품에 부착했던 ‘친환경’ 마크는 빠지지만 무항생제 표시는 기준에 부합한 농가에 한해 계속 할 수 있게 했다”며 “무항생제 기준을 어길 시에만 무항생제 마크 표시를 할 수 없게해 소비자가 어느 상품이 무항생제 계란인지 구분할 수 있게 했다”고 말했다. 강신우 (yeswhy@edaily.co.kr)＜ⓒ종합 경제정보 미디어 이데일리 - 무단전재 & 재배포 금지＞"
