,날짜,기사제목,기사내용
25,2018.04.24. 오후 6:50,"인터컨티넨탈 서울 파르나스, 9개국 메뉴 맛보는 ‘I-셰프 프로모션’ 선봬","그랜드 인터컨티넨탈 서울 파르나스가 뷔페 레스토랑 그랜드 키친에서 호텔 내 레스토랑 11인의 셰프 대표 메뉴를 내놓는 'I-셰프 프로모션'(I-Chef Promotion)을 5월 1일부터 8일까지 운영한다고 밝혔다. 5월 가정의 달을 맞아 내놓는 특별 기획이다. 그랜드 인터컨티넨탈 호텔과 인터컨티넨탈 코엑스센터 두 호텔 모든 레스토랑의 독일 인도 아랍  수석 셰프들이 내놓는 대표 메뉴를 한 자리에서 맛 볼 수 있는 기회다. 그랜드 인터컨티넨탈 서울 파르나스 제공     그랜드 인터컨티넨탈 서울 파르나스가 뷔페 레스토랑 그랜드 키친에서 호텔 내 레스토랑 11인의 셰프 대표 메뉴를 내놓는 'I-셰프 프로모션'(I-Chef Promotion)을 5월 1일부터 8일까지 운영한다고 밝혔다. 5월 가정의 달을 맞아 내놓는 특별 기획이다.아이 셰프 프로모션은 인터컨티넨탈의 영문 약자인 알파벳 I를 따서 네이밍한 행사로, 그랜드 인터컨티넨탈 호텔과 인터컨티넨탈 코엑스센터 두 호텔 모든 레스토랑의 독일 인도 아랍  수석 셰프들이 내놓는 대표 메뉴를 한 자리에서 맛 볼 수 있는 자리다. 아이 셰프 프로모션은 2009년부터 2013년까지 1년에 단 한 번씩 선보였던 인터컨티넨탈 만의 대표 행사였다. 기존 뷔페와 동일한 가격으로 호텔 내 모든 레스토랑의 대표 메뉴를 맛볼 수 있는 기회이다보니 오픈과 동시에 예약이 마감되는 등 뜨거운 호응을 얻은 바 있다. 올해 다시 한 번 가정의 달을 맞아 고객 감사의 의미로 5년 만에 다시 선보이게 됐다. 특별히 5월 5일 어린이날에는 어린이들이 좋아하는 추로스, 베리 크레페, 떡갈비 핫도그 등 약 15가지 메뉴를 추가로 제공한다. 페이스 페인팅과 피에로 풍선 이벤트도 선보일 예정이다. 아이 셰프 프로모션 기간 동안 만날 수 있는 메뉴로는 ▲독일 출신 총주방장인 벨라 뤽의 '독일 북부 스타일 감자 샐러드와 독일식 미트볼' ▲일식당 하코네 김명우 셰프의 '소고기 스키야키' ▲중식당 웨이루 양수인 셰프의 '사천 단단면' ▲프렌치 레스토랑 테이블 34 임호택 셰프의 '프로방스 스타일의 달팽이 요리' ▲뷔페 그랜드 키친의 김상태 셰프의 '하리사 새우와 컬리플라워 무스' ▲뷔페 브래서리 이정우 셰프의 '비스큐 소스와 마늘 감자 퓨레를 곁들인 해산물' ▲아시안 라이브 박광묵 셰프의 '불고기 샐러드' ▲아랍 요르단 출신 아흐마드 셰프의 '샤워르마'(닭고기로 만든 아랍식 샌드위치) ▲20년 인도 현지 경력으로 올해 초 아시안 라이브에 새로 부임한 모하마드 셰프의 '달마카니'(검정콩으로 만든 인도 대표 커리) ▲스카이 라운지 김창배 셰프의 '오징어 먹물 감자 뇨끼' ▲그랜드 델리 박정훈 셰프의 '베리 오페라'까지 총 9개국의 11개 대표 메뉴다. 아이 셰프 프로모션은 5월 1일부터 8일까지 운영한다. 프로모션 기간에도 이용 가격은 이전과 동일하다. 점심은 평일 9만원, 주말 및 휴일 9만 5000원, 저녁은 평일 10만원, 주말 및 휴일 10만 5000원(모두 세금 및 봉사료 포함)이다. 이규화 선임기자 david@dt.co.kr 디지털타임스 홈페이지 바로가기 디지털타임스 영문뉴스 바로가기 / 카드뉴스 바로가기이규화		"
26,2018.04.12. 오전 4:09,[비즈니스맨 레스토랑] 청담동 `네스트 가스트로바`,"미식+와인바…유러피안 요리의 진수를 맛보다천장 매달린 우아한 전등 눈길…조인성등 연예인들 즐겨 찾아 명품 매장이 즐비한 청담동. 이곳 도산대로 NH농협은행 인근에서 한 블록만 안쪽으로 들어오면 네스트 가스트로바(압구정로80길 33 아트빌딩 6층)가 있다. 이름에서도 알 수 있듯이 미식(가스트로노미)과 와인바를 결합한 콘셉트다. 정통 유러피안 퀴진을 추구한다. 6층 엘리베이터에서 내려 왼쪽으로 돌면 진갈색 나무문이 보이는데 문을 열고 들어가면 정말 '둥지(nest)'가 연상되는 아늑한 공간이 있다.가장 눈에 띄는 것은 천장에 매달린 길쭉한 모양의 전등이다. 전체적으로 오렌지빛 조명은 고급스러운 원목 인테리어와 함께 따뜻하면서도 우아한 분위기를 만들어준다. 분위기는 합격점이다.매니저로부터 대표 메뉴들을 차례로 추천받아봤다. 스타터로 토마토 렐리시를 얹은 크로스티니(구운 작은 빵)가 나왔다. 바삭한 빵 위에서 토마토와 렐리시의 맛이 입맛을 돋워준다. 두 번째로 와사비 매시트포테이토와 브로콜리를 곁들인 문어구이가 나왔다. 쫄깃하게 저온 조리된 문어다리를 메시트포테이토에 비벼 먹는 맛이 일품이었다. 특히 와사비의 은근한 맛이 느끼함을 깔끔하게 없애준다. 세 번째 메뉴를 기다리고 있는데 어딘가 많이 봤던 키 큰 남자가 눈앞을 지나간다. 배우 조인성이다.네스트는 연예인들이 많이 찾는 가게로 알려져있다. 청담동이라는 위치와 고급스러운 분위기 때문이다. 메인홀 아래에 6~8명 수용가능한 룸 같은 공간이 있는데 연예인들이나 비즈니스 고객들이 예약해서 자주 사용한다고 한다. 네스트 인스타그램을 뒤져보니 가수 보아, 아이돌 손나은, 배우 김사랑 등이 방문한 기록이 남아 있다.세 번째 메뉴는 부가티니를 곁들인 조개 스튜였는데 조인성의 기럭지에 감탄하다 보니 맛이 거의 기억나지 않았다. 네 번째 메뉴인 카르보나라는 베이컨과 함께 노른자가 제대로 올라 있어서 그동안 먹어봤던 카르보나라 중 역대급 퀄리티였다. 마지막 메뉴는 구운 닭과 미니 양배추 요리인데 닭의 안에 ?셀(곱게 다진 버섯, 양파, 허브 등을 버터에 넣고 으깬 반죽이 될 때까지 조리한 것)이라는 것을 넣은 것이 특징이다. 버섯의 향과 함께 부드러운 닭고기 맛이 완벽하게 어울렸다.미식이라는 콘셉트에 맞게 모든 요리들이 수준급이다. 베스트 메뉴였던 문어구이 2만9000원, 카르보나라가 2만1000원이다. 위치와 분위기를 감안하면 합리적인 가격이라는 것이 네스트의 설명이다.음식과 함께 추천받은 와인은 이탈리아 와인인 소뇨 디 율리세 몬테풀치아노(Sogno di Ulisse Montepulciano)와 호주 와인 체라볼로(Ceravolo Petit Verdot)였다. 가장 저렴한 와인 가격이 7만9000원에서 시작한다.네스트 가스트로바는 저녁식사를 마치고 늦은 시간에 찾는 손님이 많다. 새벽 1시까지 운영하며 마지막 주문은 12시까지 받는다. 9시를 넘으면 안주 메뉴 주문이 가능하며 짜장·짬뽕 등 특별 면요리도 가능하다. 트러플 오일이 들어간 감자튀김도 안주로 추천했다. 비즈니스 미팅이라면 홀보다는 룸을 사전에 예약하기를 네스트에서는 권했다. [이덕주 기자]▶뉴스 이상의 무궁무진한 프리미엄 읽을거리 ▶아나운서가 직접 읽어주는 오늘의 주요 뉴스[ⓒ 매일경제 & mk.co.kr, 무단전재 및 재배포 금지]		"
27,2018.04.12. 오후 2:42,쇠구슬 발사총을 한참이나 들여다봤다 ,"김강현의 모터사이클 다이어리⑤[오마이뉴스 김강현 기자]러시아 블라디보스토크에서 출발해 몽골과 중앙아시아, 유럽을 거쳐 다시 중앙아시아까지, 1만 8000km의 거리를 282일 동안 바이크 한 대로 누볐던 내 무모한 이야기가 펼쳐진다.-기자 말또 해가 중천에 뜬 후에야 일어났다. 늘 '일찍 일어나 해가 뜬 후 바로 여행을 시작해야지'라고 생각하지만, 지치고 힘든 몸은 일찍 깨어날 줄을 모른다.날씨는 아주 화창했다. 뜨거운 햇빛이 텐트를 휘감아 땀을 흘릴 정도로 해가 강하게 비추고 있었다. 부시시 일어나 텐트 밖으로 나와 보니 주변에서 사람들이 우리를 힐끔힐끔 바라보고 있었다.지난밤, 어둠 속에서 '이 정도면 사람들한테 안 보이겠지' 하고 자리를 잡았는데, 잘못된 판단이었던 듯하다.다행히 짐이 사라지거나 우리에게 해를 가한 사람은 없었다. 그래도 조금은 주변을 경계하며 일어나자마자 빠르게 짐을 정리하기 시작했다.침낭을 말아 넣고 옷을 갈아입은 후 텐트폴대를 빼서 정리하고 있는데, 저쪽에서 스쿠터가 한 대 다가온다. '경찰인가? 아니면 시비를 걸려는 건가?' 하고 경계하고 있는데, 어린 아이와 함께 바이크를 타고 오는 것을 보고는 안심하고 그에게 인사를 건넸다. ""즈드랏스부이?!""우리에게 다가온 그는 자신도 라이더라며 자신의 바이크를 보여 주겠다면서 집으로 우리를 초대했다. 하지만 우리는 캠핑 장비를 정리하고 출발 준비를 하고 있었기에 그의 초대를 거절했다. 아쉬워하던 그는 우리에게 선물이라며 러시아의 화폐 중 가장 큰 단위인 5000루블(한화 약 9만원)짜리 지폐를 크게 확대한 기념품을 한 장씩 건넸다. ▲  러시아 바이크 라이더가 준 5000루블 짜리 지폐 기념품(위) ⓒ 김강현언어가 통하지 않는데도 같은 라이더라는 것만으로 우리에게 선물을 챙겨주는 그가 참 고마웠다. 다시 한 번 러시아 라이더들의 정을 느낄 수 있었다.그가 떠나고, 남은 짐을 정리한 우리는 노인과 마지막 인사를 했다. 한국에 돌아가면 꼭 연락을 달라고 몇 번이나 이야기하고 무사히 한국에 도착하길 바란다고 당부했다. 어제 먼저 하바롭스크에 도착해 숙소를 잡고 있던 형님 두 명과도 인사를 나눴다.우리는 시내 쪽으로 이동해 식당에 가기로 했다. 며칠 동안 라면만 먹었더니 맛있는 음식이 먹고 싶었고, 여행객을 대상으로 하는 식당이 아닌 현지인들이 즐겨 찾는 식당에서 음식을 먹어보고 싶기도 해서였다.러시아에서는 식당을 주로 '카페(Кафе)'라고 부른다. 시내를 돌아다니다가 괜찮아 보이는 식당에 들어가서 말로만 들었던 러시아 음식인 샤슬릭을 주문했다.기대했던 샤슬릭이...샤슬릭은 '꼬치구이'를 뜻하는데, 양고기ㆍ소고기ㆍ돼지고기ㆍ닭고기뿐만 아니라 지역에 따라서는 해산물도 꼬치로 구워 먹는단다. 고기를 양념에 재놓은 뒤 숯불에서 골고루 익혀 먹는데, 러시아 사람들이 가장 즐겨 먹는 음식 중 하나라고도 한다.우리는 식당에 들어가 큰 페트병 콜라 한 병과 샤슬릭을 하나씩 주문했다. 식당에는 숯불 화로대가 준비돼있었는데, 점원이 계란판과 종이 등 쓰레기를 화로대에서 태우고 있었다. ▲  러시아의 전통음식인 샤슬릭을 먹기 위해 식당을 찾았는데, 화로대에 계란판 등 쓰레기를 태우고 있다. ⓒ 김강현'쓰레기도 저기서 다 태우는 구나' 하고 아무렇지 않게 음식을 기다렸다. 잠시 후 아주 먹음직한 샤슬릭이 나왔다. 두툼한 고기가 긴 꼬치에 끼워져 육즙이 뚝뚝 흐르고 있었는데, 한 입 베어 물자 입안에서 종이 탄 냄새가 진동했다. ▲  잠시 기다린 후 받은 샤슬릭. 먹음직한 모습과는 반대로,종이 탄내가 진동을 하는 독특한 맛이었다. ⓒ 김강현힘들고 배도 많이 고픈데다가 모처럼 돈을 내고 식당에서 음식을 사먹는데, 이 정도 수준의 음식밖에 안 된다는 것에 순간 짜증이 났다. 하지만 말이 통하지 않으니 따질 수도 없었다. 결국 여행 첫날 양고기 햄을 먹을 때처럼 '식량이다' 생각하고 주문한 음식을 싹 비웠다.식사를 마치고는 식당 화장실 세면대에서 한 명씩 돌아가며 씻었다. 개운해진 우리는 도시를 떠나기 전에 먹을거리도 살 겸 동네를 조금 돌아다니기로 했다. 잠시 후 바이크 숍이 보였다.러시아에서 처음 만난 바이크 숍이었다. 들어가 보니 중국산 바이크들과 엔진오일 등 소모품을 팔고 있어서 각자 필요한 물품을 구입했다. 나는 특별히 필요한 물품이 있던 것도 아니고 돈 걱정을 한참 하던 터라 그냥 구경만 하고 나왔다.포기해야 느낄 수 있는 것바로 비로비잔을 향해 출발했다. 아침에 화창했던 날씨는 어느새 먹구름이 가득하고 비가 오기 시작했다.빠르게 달릴수록 빗방울은 굵어졌다. 도로는 완전히 다 젖었고 군데군데 물웅덩이도 생겼다. 러시아의 도로는 정비 상태가 굉장히 안 좋다. 아스팔트는 다 깨져 멀쩡한 곳을 찾기 힘들 정도고, 뚜껑 없는 맨홀이 덩그러니 있는 곳도 있다.발목 높이 정도의 포트홀(도로가 파손돼 냄비(Pot)처럼 생긴 구멍(Hole)이 파인 곳)을 만날 때마다 급하게 바이크를 기울여 피하곤 했는데, 비 때문에 미끄러질까 걱정하기도 했다.주유소에서 잠시 비를 피해 챙겨온 우비를 입고, 핸드폰을 지퍼팩 안에 넣고, 방수 부츠커버를 신었다. 완벽하게 채비를 끝냈지만 그칠 줄 모르는 거센 비는 이내 온몸으로 스며들어 속옷까지 적셨다.처음에는 스며드는 비가 짜증나고 찝찝했는데, 어느 정도 젖고 나니 '그래 차라리 왕창 내려라' 하는 생각을 했고, 이내 홀가분했다.여행자만이 느낄 수 있는 감정이었다. 온몸이 완전히 다 젖고 나서야 느끼는 해방감이 그렇게 달콤할 줄 몰랐다. 다 포기하고 나서 비로소 느낄 수 있는 감정이다. 옷이나 짐을 말리는 것도 별로 생각하지 않고, 비가 그치지 않고 더 많이 내리길 바라며, 시야 확보를 위해 헬멧 쉴드(shield)를 닦으며 계속 달렸다.한참을 달려 비가 오는 지역을 벗어나 잠시 멈춰 우비를 벗었다. 앉아서 잠시 쉬고 싶었지만, 온갖 벌레들이 몰려와 우리를 공격했다.모기뿐만 아니라 쇠파리, 처음 보는 이상하게 생긴 벌레들이 온몸에 달라붙어 피를 빨아대는 통에 도저히 가만히 쉴 수 없었다. 계속 움직이며 우비를 벗고 주변을 빙빙 돌아다니면서 빵을 먹었다. 결국 빵을 먹자마자 바로 출발해 잠시 후 비로비잔에 도착했다.비로비잔과 골목대장비로비잔은 하바롭스크보다는 규모가 작지만 그래도 있을 건 다 있는 마을이다. 마을을 돌아다니다가 철물점 같은 가게를 발견하고 안으로 들어가 구경하기로 했다. 안에는 각종 칼과 도끼, 가스총 등이 진열돼있었는데, 한참을 구경하다가 단도 등 물건을 하나씩 구매했다. ▲  쇠로 된 비비탄이 발사되는 가스권총 ⓒ pixabay나는 쇠구슬을 발사하는 가스총을 한참 구경했다. 권총 모양의 작은 총인데, 압축된 가스를 원동력으로 비비탄 총알과 똑같이 생긴 쇠구슬을 발사하는 총이다. 주인 설명으로는 살에 박힐 정도의 힘을 가졌다. 이 총 하나만 있으면 여행이 꽤 안전할 것 같다고 생각했다.체 게바라도 아버지가 챙겨준 리볼버 한 정을 갖고 여행했고, 위급한 때에 그 총으로 위험을 벗어난 적도 있었다고 하니 그 총을 더욱 사고 싶었다.하지만 10만 원 가까이 되는 가격에 결국 포기하고 내려놓았다. 가게 주인도 내심 아쉬운 눈치였다. 칼이나 다른 물품의 가격과 비교하면 굉장히 비싼 물건이었기에, 그것 하나만 팔아도 하루치 매상이 될 것 같았다.가게를 나와 깨끗한 방에 안전한 주차장까지 마련돼있는 숙소를 발견하고 그곳에서 하루 머물기로 했다. 숙소 뒤편으로는 걸어서 5분 정도 거리에 큰 마트도 있었는데, 마트에서 맛있는 것들을 잔뜩 사서 먹고 푹 쉴 생각으로 숙소를 일찍 잡았다.숙박비를 지불하고 바이크를 주차장으로 옮겨놓기 위해 숙소 앞으로 나와 일행들과 얘기하고 있는데, 자전거를 탄 동네 꼬마들이 우리가 신기한 듯 잔뜩 몰려나왔다.초등학교 저학년 쯤 돼 보이는 아이들이었는데, 처음에는 조용히 다가와 바이크를 구경하거나 우리에게 말을 걸더니, 말이 안 통한다는 것을 알았는지 그 나이 특유의 장난기를 발동해 알 수 없는 말을 하고 도망가기를 반복했다.그 말이 무슨 뜻인지 몰랐지만 욕이라는 것은 느낄 수 있었다. 꼬마들이 도망가면 '와' 하고 소리를 지르며 따라가는 식으로 한참을 놀았다. 꼬마들의 대장 격인 아이는 헤이직이라는 이름의 남자아이였는데, 자기보다 나이가 몇 살은 더 많아 보이는 여자아이를 때리고 도망가거나 우리에게 손가락 욕을 하는 등 짓궂은 장난을 치곤했다. ▲  숙소앞에서 우리에게 욕을 하고 도망가던 러시아 꼬마 '헤이직' ⓒ 김강현장난이 점점 심해져 '이놈 꿀밤이라도 한 방 먹여야겠다'라고 생각하고 있었는데, 골목길에서 아이들의 가족으로 보이는 덩치 큰 남자가 다가오는 것을 보고는 쥐었던 주먹을 슬그머니 풀었다.그 남자도 우리가 신기한지 근처에 와서 한참 말을 걸고 구경했다. 우리는 갖고 있던 사탕을 아이들에게 한 개씩 건네고 인사한 후 바이크를 창고에 넣고 마트에 장을 보러 갔다.마트 규모가 생각보다 꽤 컸다. 우리나라 대형 마트까지는 아니었지만, 코너별로 잡화나 음식, 술 등 다양한 물품이 구비돼있었다.포식? 폭식!며칠간 고생한 만큼 실컷 먹고 푹 쉬고 싶었기에 우리는 하루치 쓸 돈을 저녁식사에 다 쓰기로 했다. 러시아 전통음식인 샤슬릭과 당근김치를 사고, 컵라면ㆍ샐러드ㆍ맥주까지 잔뜩 사서 숙소로 돌아왔다. ▲  숙소 근처에 있는 마트에서 하루치 식비를 몽땅 털어 사온 저녁식사 ⓒ 김강현음식을 먹으며 이십대 청년이라면 누구나 할 법한 고민부터, 이 여행을 오지 않았다면 결코 느끼지 못했을 감정들을 얘기했다. 이곳 비로비잔이라는 도시도 여행을 오지 않았다면 결코 알 수 없었을 것이다.'내가 달리고 있는 길을 달리는 사람이 몇 명이나 될까' 하는 생각을 해보면, 이 여행이 더 특별해진다. 그리고 함께 달리고 있는 친구들이 더 소중해진다.하지만 언젠가는 이 친구들과 떨어져 혼자만의 여행을 하게 된다. 함께하는 여행은 물론 즐겁지만 내심 얼른 혼자가 됐으면 하는 생각도 했다. 처음 마음먹었던 것처럼 혼자만의 시간을 온전히 보내고 싶다는 생각이 커졌다.처음에는 혼자인 게 두렵기만 했는데, 혼자가 되고 싶다는 생각을 하는 걸 보니 이 여행도 조금은 익숙해진 듯하다. 걱정과 두려움이 컸지만, 막상 부딪쳐보니 오히려 여행은 즐거움으로 가득했다. 모든 순간을 여행으로 여기니 부족하면 부족한대로, 불편하면 불편한대로 즐거웠다.기분 좋은 저녁, 취기가 조금 오른 상태에서 부른 배를 두드리며 깊은 잠에 빠져 들었다. (다음호에 계속)자투리 여행정보 - 05 : 비로비잔 ▲  비로비잔의 도시 입구를 표시하는 탑 ⓒ 유대인 자치주청비로비잔의 지명은 하바롭스크에 있는 아무르 강의 지류(支流)인 비라 강과 비잔 강에서 따왔다. 하바롭스크에서 약 180km 떨어진 이 도시는 1930년대 초까지는 시베리아 횡단철도의 작은 역이 있는 마을이었는데, 1930년대에 소련 정부가 유대인 정착지를 설립하며 도시 규모가 커졌다. 유대인 자치주의 주청(州廳) 소재지지만 현재는 대부분 러시아인이 거주하고 있고, 유대인은 극소수에 불과하다.2014년 기준으로 인구는 약 7만 5000명, 면적은 약 200k㎡이다. 2010년부터 대한민국 의정부시와 우호협력관계를 맺고 있다.저작권자(c) 오마이뉴스(시민기자), 무단 전재 및 재배포 금지덧붙이는 글 | 이 기사는 <시사인천>에도 게시 되었습니다.☞ 오연호의 <우리도 사랑할 수 있을까> [바로가기]☞ 오마이뉴스 자발적 유료 구독! [10만인클럽]		"
28,2018.04.11. 오후 5:03,[매경TEST] 실질GDP와 명목GDP의 관계,"치킨수요 증가시키는 원인은▶ 문제 : 다음 중 치킨 수요를 증가시키는 원인으로 가장 거리가 먼 것은? (단, 치킨은 정상재이며, 삼겹살과는 대체재 그리고 맥주와는 보완재 관계다.)  ▷ 해설삼겹살 가격 상승은 대체재인 치킨 수요를 증가시키며, 치킨과 함께 소비되는 맥주 가격 하락 또한 치킨 수요를 증가시킨다. 한편 정상재는 소득이 증가할 때 수요가 증가하는 재화를 의미하므로 처분가능소득이 증가하면 정상재인 치킨 수요가 증가하며, 치킨에 대한 마케팅 활동 강화는 치킨에 대한 선호도 증가에 기여하므로 치킨 수요를 증가시킨다. 그러나 닭의 대량 살처분은 치킨 원재료인 닭고기 공급을 감소시키므로 치킨 수요 증가의 주 요인으로 보기 어렵다. 정답은 ⑤. ▶ 문제 : 아래 표는 A국과 B국의 GDP 관련 자료다. 이를 올바로 분석한 것은?(단, 물가상승률은 GDP 디플레이터로 측정한다.)  ▷ 해설① B국이 A국보다 실질GDP가 언제나 크므로 B국의 경제 규모가 A국보다 크다. ② 경제성장 속도는 경제성장률 정도로 나타난다. 표에 따르면 Y7년부터 Y9년까지 실질GDP 증가분은 20억달러로 일정하나 분모의 크기가 커지므로 경제성장률은 감소한다. ③ Y6년부터 Y9년까지 B국의 GDP 증가분은 30억달러로 일정한데, 분모는 언제나 400억달러 이상이다. 따라서 경제성장률이 10%를 넘은 적이 없다. ④ 물가수준은 GDP 디플레이터로 나타낼 수 있으며, GDP 디플레이터는 명목GDP에서 실질GDP를 나눠 구할 수 있다. Y8·Y9년 A국의 GDP 디플레이터는 112.5(=270/240×100)와 115.4(=300/260×100), Y8·Y9년 B국의 GDP 디플레이터는 104.3(=480/460×100)과 102.0(=500/490×100)이다. A국이 Y8·Y9년 모두 크다. ⑤ 한 나라에 거주하는 사람들의 생활수준은 1인당 GDP로 알 수 있다. 서로 인구가 같기 때문에 GDP가 큰 B국의 1인당 GDP가 A국보다 크다. 정답은 ⑤. [최병일·최봉제 경제경영연구소 연구원]▶뉴스 이상의 무궁무진한 프리미엄 읽을거리 ▶아나운서가 직접 읽어주는 오늘의 주요 뉴스[ⓒ 매일경제 & mk.co.kr, 무단전재 및 재배포 금지]		"
29,2018.04.06. 오후 3:34,"삼겹살, 자판기 속으로…","축산 영업장 밖 무인점포 허용사물인터넷 활용 신선도 관리지난해 11월 서울 중구 농협중앙회 본관에 설치된 사물인터넷 포장육 자동판매기. 농협 제공앞으로 정육점이나 대형마트 같은 축산물 판매 영업장이 아닌 곳에서도 자동판매기로 손쉽게 포장육을 구매할 수 있게 된다.식품의약품안전처는 영업장 이외의 장소에서 사물인터넷 자동판매기를 설치ㆍ운영하여 포장육을 판매할 수 있도록 규제를 개선하는 것을 주요 내용으로 하는 ‘축산물 위생관리법 시행규칙’ 개정안을 입법예고한다고 6일 밝혔다.개정안에 따르면 식육판매업 영업자는 실시간으로 온도ㆍ유통기한을 관리할 수 있는 사물인터넷을 이용한 자동판매기로 밀봉한 포장육을 판매하는 경우, 축산물판매 영업장이 아닌 곳에서도 자동판매기를 설치ㆍ운영할 수 있다. 이미 농협이 1인가구 등을 겨냥해 지난해 말 사물인터넷 자동판매기를 출시하고 2개 매장에 시범 설치, 한우와 한돈, 닭고기 등을 판매하고 있으나 현행법 상 영업장 밖에서 자동판매기만으로 무인 점포를 운영하는 것은 불가능했다.개정 규칙이 시행되면 축산물 판매업자는 중간 유통마진을 줄여 저렴하게 판매할 수 있을 것으로 보인다. 정육코너가 없는 중소 마트나 슈퍼마켓, 편의점 등에서도 공간만 확보하면 자동판매기로 포장육을 판매할 수 있어 1인가구 등 소비자들이 편리하게 구매할 수 있게 된다. 농협 등은 가격 인하 효과로 수입산에 비해 가격 경쟁력이 낮은 한우 소비가 활발해질 수 있다는 기대를 하고 있다. 그러나 동네 정육점 등 영세 축산물 판매 영업장은 타격을 받을 수 있다는 우려도 나온다.최진주기자 pariscom@hankookilbo.com▶한국일보 [페이스북] [카카오 친구맺기]▶네이버 채널에서 한국일보를 구독하세요![ⓒ 한국일보(hankookilbo.com), 무단 전재 및 재배포 금지]		"
