,날짜,기사제목,기사내용
15,2018.06.01. 오전 11:22,농산물 가격 9%↑…체감물가의 습격,"			최악의 ‘고용절벽’ 속에 소득양극화가 심화되고 경기지표도 불안한 모습을 보이는 가운데 체감물가까지 급등하면서 서민들의 경제고통이 갈수록 심화하고 있다. 서민 체감도가 높은 배추ㆍ무 등 채소류가 13.5% 급등해 ‘밥상물가’에 비상이 걸렸고, 쌀을 비롯해 빵ㆍ스낵 등 가공식품류, 외식비 등 서비스료, 휘발류ㆍ경유 등 기름값도 줄줄이 오르고 있다.정부가 농수산물 비축물량의 탄력방출과 계약재배물량 조기출하 등 수급관리와 외식물가 감시강화 등 대책을 추진하고 있지만, 효과는 미약한 상태다. 외식ㆍ서비스는 경기가 부진함에도 최저임금 상승을 이유로 줄줄이 올라 소비자 부담이 가중되고 있다.통계청이 1일 발표한 ‘5월 소비자물가 동향’을 보면 전체 물가는 1년전에 비해 1.5% 올라 8개월째 1%대를 유지하면서 안정세를 보였다. 하지만 국민 체감도에 큰 영향을 미치는 농수산물과 석유류, 외식 등 서비스료는 이를 크게 웃돌며 급등세를 보였다.가장 크게 오른 것은 채소류로 1년 전에 비해 13.5% 올랐다. 이를 포함한 농산물 가격이 9.0% 올라 전체 물가상승률을 6배 웃돌며 소비자물가를 0.38%포인트 끌어올리는 역할을 했다. 오징어 등 수산물도 4.5% 올라 전체 물가상승률보다 3배 높았다.국제유가 급등으로 국내 석유류 가격도 6.0% 올라 전체물가를 0.27%포인트 끌어올렸고, 외식비도 평균 2.7% 올라 전체 물가를 0.35%포인트 끌어올렸다. 외식을 포함한 개인서비스 물가는 2.6% 올라 전체 물가를 0.84%포인트 끌어올리는 역할을 했다. 품목별로 보면 농수산물 가운데 감자가 59.1%나 폭등한 것을 비롯해 무(45.4%), 고춧가루(43.6%), 고구마(31.3%), 배추(30.2%) 등이 30% 이상 급등했고, 쌀값도 29.5%나 올랐다. 특히 감자와 쌀, 무 등은 최근 3~4개월 연속 고공행진을 지속하고 있다.수산물 가운데선 오징어가 21.8% 급등해 전월(29.1%)보다는 다소 낮지만 정부 대책에도 여전히 높은 상승률을 기록했다. 농수산물 가격이 오르면서 빵이 6.3%, 스낵과자가 5.5% 급등하는 등 가공식품 가격이 줄줄이 올랐고, 생선회 외식비도 4.8% 올랐다.공업제품 가운데선 경유(8.1%)와 휘발류(6.3%)의 가격상승폭이 확대됐고, 휴대전화기도 4.8% 올랐다. 서비스 부문에선 최저임금 인상 영향을 많이 받는 가사도우미료(10.7%)와 요양시설이용료(9.2%), 공동주택관리비(5.5%) 등이 크게 올라 주목됐다.반면에 농축수산물 가운데 달걀(-38.9%)과 파(-22.2%), 갈치(-15.4%), 양파(-14.0%), 닭고기(-12.3%), 돼지고기(-9.2%) 등이 비교적 큰폭으로 내렸고, 공업제품 중에선 TV(-15.1%), 샴푸(-9.6%), 식용유(-8.7%) 등이 크게 내렸다. 서비스 부문에서도 정부가 적극적으로 관리하고 있는 학교급식비(-13.0%)와 대입전형료(-13.0%), 병원검사료(-9.5%)등이 비교적 크게 내렸다.정부는 전체 물가가 전월(1.6%)보다 0.1%포인트 낮아졌다며 기존 농수산물 대책에 이어 유가 안정대책을 추진할 방침이다. 기획재정부는 “향후 물가는 유가상승 등으로 석유류 가격 오름세가 확대되겠으나 채소류 가격 안정 등으로 1%대 중반을 지속할 전망”이라며 “유가안정을 위해 알뜰주유소 활성화와 가격정보 공개 확대 등 석유시장의 경쟁을 촉진토록 할 것”이라고 밝혔다.이해준 기자/hjlee@heraldcorp.com▶쇼핑의 모든 혜택, 리얼라이프▶헤럴드경제 채널 구독하기 ▶한입뉴스 ‘타파스’ 페이스북 친구맺기 - Copyrights ⓒ 헤럴드경제 & heraldbiz.com, 무단 전재 및 재배포 금지 -		"
16,2018.06.14. 오전 3:03,[상장기업&CEO]“병아리 품질이 육계사업 승부처” 사육시설에 800억 투자,"			[동아일보]육계 점유율 3위 체리부로 김인식 회장체리부로 김인식 회장은 국내에서 가장 먼저 육계사업 수직 계열화에 눈을 뜬 축산 경영인이다. 11일 만난 그는 “닭은 곡물을 적게  먹고도 단기간에 단백질을 생산해 낸다는 점에서 육계 계열화 사업은 국민소득이 낮은 북한 진출에도 유리하다”고 강조했다. 체리부로 제공11일 서울시내의 한 호텔에서 만난 닭고기 전문업체 ㈜체리부로 김인식 회장(76)은 자리에 앉자마자 휴대전화의 문자메시지부터 보여줬다. 전날 거래된 생닭 가격이 kg당 900원이라는 내용이었다. 김 회장은 “회사에서 생산하는 생닭 원가가 1400원 수준이다”라며 “팔수록 손해 보는 구조”라며 혀를 찼다.  가격이 폭락한 이유는 지난해 하반기부터 계속된 공급 과잉 탓이다. 닭값 폭락으로 실적도 나빠졌다. 지난해 206억 원에 달했던 순이익이 올 1분기(1∼3월)엔 24억 원 적자로 돌아섰다. 지난해 12월 코스닥에 상장한 뒤 받아든 첫 성적표여서 더욱 실망스럽다.  실적 부진이 우려할 상황은 아니다. 그동안 시설투자 등을 많이 했고, 이에 대한 감가상각비를 많이 반영하면서 발생한 회계상 적자이기 때문이다. 영업이익에 감가상각비를 더해 구하는 에비타(EBITDA·이자, 세금, 감가상각비, 무형자산상각비 차감 전 이익) 기준으로는 17억 원 이익으로 업계 최고 수준이다.  현재 국내 육계시장은 40여 업체가 치열한 각축을 벌이는 완전 경쟁시장이다. 체리부로를 비롯한 상위권 업체 6개가 시장 지배력을 점점 키우는 가운데 소규모 업체들이 난립하고 있다. 지난해 도축 실적 기준 체리부로의 육계 시장점유율은 8.8%로 하림(19.4%) 마니커(9.9%)에 이어 3위에 랭크돼 있다.  체리부로는 과일인 체리(Cherry)와 육용 닭을 의미하는 브로일러(broiler)의 합성어이다. 우수한 품질의 닭고기 전문 기업을 향한 김 회장의 의지를 담고 있다. 이를 위해 체리부로는 육계 수직 계열화를 완성했다. 육계의 종자라 할 수 있는 원종계부터 부화, 사료, 가공, 유통, 프랜차이즈(처갓집 양념통닭)까지 직접 한다. 김 회장은 육계 사업의 성패는 품질이 뛰어난 병아리 생산에서 결정된다고 보고 있다. 지난 5년간 첨단 종계 사육시설과 운영시스템 구축에 800억 원을 투자한 것도 이 때문이다. 이런 시설에 최적의 사육 환경을 유지한 결과 최근 몇 년간 겨울마다 창궐했던 조류인플루엔자(AI)도 피할 수 있었다. 전북 익산과 충북 옥천의 사료공장에서 생산하는 우수한 품질의 사료 역시 체리부로의 핵심 경쟁력이다. 체리부로의 사료요구율(육계 체중 1kg을 늘리는 데 필요한 사료의 양)은 1.45로 업계 최고 수준이다. 반면 업계 평균 사료요구율은 1.55 수준으로 알려졌다.  이런 자신감을 바탕으로 2002년 업계 최초로 닭고기 등급제 시범 사업에 참여해 등급 판정제 대중화에 기여했다.  김 회장은 육가공 사업을 신성장동력으로 키우려고 지난해 말 동양종합식품(현 체리푸드)을 인수했다. 육계 계열화 사업의 마지막 퍼즐을 푼다는 심정으로 내린 결정이었다. 김 회장은 “체리부로에서 당일 도계한 신선육만을 사용해 기존 가공 제품과는 차별화된 맛과 품질의 제품을 생산할 계획”이라고 말했다.  어려서부터 병아리 등을 키우는 것을 좋아했던 김 회장은 1968년 서울대 축산학과를 졸업한 이후 축산 외길을 걸어왔다. 특히 1977년 양계용 배합사료 생산 회사였던 퓨리나코리아(현 카길애그리퓨리나)에 입사해서 육계 수직 계열화 개념을 접한 게 그의 경영철학에 큰 영향을 미쳤다.  그가 49세의 나이에 체리부로를 창업한 것도 육계 수직 계열화라는 꿈을 실현하기 위해서였다. 퓨리나코리아, 미원사료사업본부, 미원농장(현 팜스코) 대표이사를 거치면서 육계와 돈육, 사료 사업까지 두루 경험한 후였기에 자신감도 넘쳤다. 김 회장은 “그동안 고비도 있었지만 지난해 말 동양종합식품 인수를 통해 이 꿈을 완성했고, 드디어 소비자의 식탁까지 진출했으니 이제야 회사 비전을 얘기할 수 있게 됐다”면서 환하게 웃었다.윤영호 기자 yyoungho@donga.com ▶ 동아일보 단독 / 동아일보 공식 페이스북▶ 핫한 경제 이슈와 재테크 방법 총집결(클릭!)ⓒ 동아일보 & donga.com, 무단 전재 및 재배포 금지		"
17,2018.06.14. 오후 6:45,100% 국내산 닭가슴살로 건강한 다이어트 시작해볼까요?,"			닭고기 전문기업 ㈜하림의 친환경 프리미엄 닭고기 브랜드 자연실록이 '더 건강한 가슴살 훈제'를 출시했다.하림 자연실록 '더 건강한 가슴살 훈제'는 100% 국내산 닭가슴살로 만들어 믿고 먹을 수 있다. 100g에 115kcal의 저지방 고단백 제품인데다 다이어트 식품으로도 제격이다. 전자레인지에 1분만 조리하면 바로 먹을 수 있어 다이어트 건강식뿐 아니라, 바쁜 직장인을 위한 간편한 식사, 아이들 간식, 어른들 술안주 등으로 다양하게 활용 가능하다.▲ 하림 제공 @머니S MNB, 식품 외식 유통 · 프랜차이즈 가맹 & 유망 창업 아이템의 모든 것특히, 하림의 프리미엄 닭고기 브랜드 자연실록은 친환경 인증을 받은 100여 개 농가로부터 건강한 병아리를 선별해 마늘 등의 기능성 사료를 먹여 면역력이 강하고 육질이 크게 개선됐다.하림 ‘더 건강한 가슴살 훈제’는 G마켓 등 주요 온라인 쇼핑몰을 통해 판매를 시작하며, 추후 오프라인 매장까지 유통채널을 확장할 계획이다. 가격은 2천원 대.㈜하림 마케팅팀 관계자는 “여름에 대비해 다이어트에 돌입하는 분들이 있어 저지방 고단백 식품에 대한 관심도 높아지고 있다""며 ""100% 국내산 닭가슴살로 만들어 간식이나 식사 대용, 다이어트 식으로 좋은 '더 건강한 가슴살 훈제'가 소비자들의 호응을 얻길 기대한다""고 말했다.강동완 기자 <저작권자 ⓒ '성공을 꿈꾸는 사람들의 경제 뉴스' 머니S, 무단전재 및 재배포 금지>▶ 머니S 페이스북 ▶ 머니S 인스타그램 ▶ 최신 웹툰이 매일 공짜"
18,2018.06.07. 오전 11:23,"하림, 자연실록 '더 건강한 가슴살 훈제' 출시","닭고기 전문기업 하림의 친환경 프리미엄 닭고기 브랜드 자연실록이 '더 건강한 가슴살 훈제'를 출시한다고 7일 밝혔다.하림 자연실록 '더 건강한 가슴살 훈제'는 100% 국내산 닭가슴살로 만들어 믿고 먹을 수 있다. 100g에 115kcal의 저지방 고단백 제품인데다 다이어트 식품으로도 제격이다. 전자레인지에 1분만 조리하면 바로 먹을 수 있어 다이어트 건강식뿐 아니라, 바쁜 직장인을 위한 간편한 식사, 아이들 간식, 어른들 술안주 등으로 다양하게 활용 가능하다.특히 하림의 프리미엄 닭고기 브랜드 자연실록은 친환경 인증을 받은 100여 개 농가로부터 건강한 병아리를 선별해 마늘 등의 기능성 사료를 먹여 면역력이 강하고 육질이 크게 개선됐다.하림 '더 건강한 가슴살 훈제'는 G마켓 등 주요 온라인 쇼핑몰을 통해 판매를 시작하며 추후 오프라인 매장까지 유통채널을 확장할 계획이다. 가격은 2000원 대.차정운 하림 마케팅팀 과장은 “여름에 대비해 다이어트에 돌입하는 분들이 있어 저지방 고단백 식품에 대한 관심도 높아지고 있다”며 “100% 국내산 닭가슴살로 만들어 간식이나 식사 대용, 다이어트 식으로 좋은 '더 건강한 가슴살 훈제'가 소비자들의 호응을 얻길 기대한다”고 말했다.이주현 유통 전문기자 jhjh13@etnews.com▶ 전자신문 바로가기 [Copyright ⓒ 전자신문 & 전자신문인터넷, 무단전재 및 재배포 금지]"
19,2018.06.20. 오전 9:38,"맘스터치, 패스트푸드 업계 최초 간편식 시장 출격","			<아이뉴스24>[아이뉴스24 장유미 기자] 패스트푸드 브랜드인 '맘스터치'가 업계 최초로 삼계탕으로 4조원 규모의 가정간편식(HMR) 시장 출격에 나선다.20일 '맘스터치'를 운영하는 해마로푸드서비스는 21일 첫 가정간편식 제품인 '맘스터치 삼계탕'을 선보인다고 발표했다.'맘스터치 삼계탕'은 오랜 기간 닭고기 활용 메뉴를 개발하며 축적해 온 노하우를 바탕으로 개발한 제품이다. 100% 국내산 닭에 찹쌀·인삼·대추를 넣고 긴 시간 우려내 깔끔하면서도 깊은 맛을 선사한다. 상온보관 후 간단히 데우기만 하면 조리가 끝나, 집에서 편하게 외식을 즐기려는1인 가구와 혼밥족 등에게 큰 호응을 얻을 것으로 회사 측은 기대했다. 또 갓 요리한 삼계탕처럼 닭고기의 살결과 식감이 그대로 살아있어 손님 대접용으로도 좋다.제품은 크기에 따라 대중삼계탕(800g), 소중삼계탕(600g) 2종으로 나뉘며 가격은 각각 6천900원, 4천900원으로 가성비가 좋다. 이 제품은 특수 매장 등 일부 매장을 제외한 맘스터치 전 매장에서 구입할 수 있다. 맘스터치 관계자는 ""'맘스터치 삼계탕'은 최근 가정간편식 수요가 급증함에 따라 맘스터치 고객들이 집에서도 간편하게 여름철 대표 보양식인 삼계탕을 즐길 수 있도록 기획된 제품""이라며 ""이번 삼계탕을 시작으로 맘스터치만의 철학을 담은 가정간편식 제품을 지속적으로 선보여 포트폴리오를 강화해 나갈 계획""이라고 말했다./장유미기자 sweet@inews24.com▶네이버 채널에서 '아이뉴스24'를 구독해주세요.▶아이뉴스TV에서 부동산 고수를 만나보세요.[ⓒ 아이뉴스24 무단전재 및 재배포 금지]"
20,2018.06.05. 오후 7:31,가장 비싼 개 사료는 '하림펫푸드 더리얼'..100g당 2600원,"사진 이미지투데이. © News1(서울=뉴스1) 최서윤 기자 = 국내에서 판매하는 가장 비싼 강아지 사료는 생닭고기가 원료인 '하림 펫푸드 더리얼'인 것으로 조사됐다. 5일 한국소비자연맹에 따르면 대형수입업체 제품 7개와 국산품 9개 건식사료 제품 가격을 조사한 결과, 하림 펫푸드가 판매하는 '더리얼 크런치 닭고기 어덜트'가 100g당 2600원으로 가장 비쌌다. 이어 CJ '오프레시 어덜트' 1884원, '시리우스윌 어덜트' 1884원, '지니펫 더홀리스틱 홍삼&국내산오리' 1750원, '더독 닥터소프트 그레인프리 치킨' 1404원, '아미오 홀리스틱 어덜트' 1286원, '나우 그레인프리 스몰브리드 어덜트' 1250원, '퓨리나 프로플랜 스몰앤미니' 1151원, '토탈 이퀼리브리오 독 어덜트' 1050원, '네츄럴코어 유기농 에코 오리고기' 1050원 순이었다. 100g 기준으로 1000원 이하 제품은 '시저 연어맛이 곁들어진 프리미엄 쇠고기' 990원, '로얄캐닌 미니 인도어 어덜트' 953원, '내추럴발란스 울트라 프리미엄 포뮬라' 875원, '뉴트리나 건강백서 건강한 피부' 800원, '이즈칸 퍼포먼스' 742원 순으로 조사됐다. 'ANF홀리스틱 램&라이스'는 662원으로 조사 제품 가운데 가장 저렴했다. 반려견 사룟값이 제품에 따라 최대 4배가량 차이가 났다. 소비자연맹은 ""사료에 표시된 영양성분 만으로 신선하고 품질이 좋은 원료를 사용했는지 알기 어려웠다""고 밝혔다.이번 가격 조사에서 국산 사료는 더리얼 크런치 닭고기 어덜트, 오프레시 어덜트, 시리우스윌 어덜트 등 9종이다. 멜라민과 카드뮴, 납 등 중금속이 검출된 제품은 없었다.[해피펫] 반려동물 건강, 교육, 입양 등 궁금한 점은 해피펫 홈페이지나 페이스북, 인스타그램, 유튜브에 남겨주세요. 반려동물 사진과 사연을 올리면 선물도 드립니다.news1-1004@news1.kr▶ [뉴스1] 채널설정하기 ▶ 제보하기▶ ‘6·13지방선거’ 뉴스보기[© 뉴스1코리아(news1.kr), 무단 전재 및 재배포 금지]"
21,2018.06.07. 오후 1:41,"햄버거, 칵테일, 타코…북미정상회담 메뉴 속속 등장","			[머니투데이 정한결 기자] ['로켓맨 타코' '트럼프 칵테일'…양국정상 소재로 다양한 메뉴 선보여  ]싱가포르 식당 '하모니 나시르막'이 도널드 트럼프 미국 대통령과 김정은 북한 국무위원장을 소재로 만든 북미정상회담 기념 메뉴 포스터. /사진=페이스북6월 12일 북미정상회담을 앞두고 회담 개최지인 싱가포르에 도널드 트럼프 미국 대통령과 김정은 북한 국무위원장을 주제로 한 음식메뉴가 등장하고 있다. 6일(현지시간) 사우스차이나모닝포스트(SCMP) 등에 따르면 싱가포르 레스토랑들은 북미정상회담 평화 기원을 소재로 나시르막, 햄버거, 타코, 칵테일 등의 음식메뉴를 개발했다.  말레이시아 음식 레스토랑 '하모니(화합) 나시르막'은 지난 3일부터 북미정상회담을 기념하는 나시르막 메뉴를 공개했다. 나시르막(nasi lemak)은 코코넛 밀크, 판단 잎을 넣고 지은 쌀밥에 반찬을 곁들인 말레이시아 요리다.  식당 측은 이번 특선 메뉴에서 미국산 말린 소고기와 김치를 사용한다고 밝혔다. 트럼프 대통령의 ""다시 미국을 위대하게 만들자""는 슬로건을 패러디 한 ""다시 화합을 위대하게 만들자(#Make Harmony Great Again)""라는 문구도 홍보 포스터에 적어놓기도 했다.  로열 플라자 호텔의 주방장은 '트럼프-김정은 햄버거' 및 정상회담 아이스티를 개발해 8일부터 판매에 들어간다고 밝혔다. 이 햄버거는 미국과 한국의 요소를 적절히 결합했다. 닭고기 패티 위에 김치를 얹고 햄버거를 미국의 성조기와 북한의 인공기로 장식했다. 부식으로 감자튀김과 김밥이 제공된다. 미국에서 발명된 것으로 알려진 아이스티에는 한국의 유자가 첨가됐다. 가격은 정상회담이 열리는 6월 12일을 기념해 12싱가포르달러(9621원)로 책정했으며 아이스티는 6싱가로프달러(4810원)다. 멕시코 음식점인 '루차 로코'는 '엘 트럼포(트럼프)'와 '로켓맨' 타코를 선보였다. 엘 트럼포 타코는 미국식 치즈버거 재료인 햄버거 패티와 치즈 등이 사용됐고, 로켓맨 타코는 닭고기에 깨를 뿌려 한국식으로 맵게 조리됐다. 로켓맨은 북한이 탄도미사일을 발사하자 트럼프 대통령이 김 위원장을 비난하며 사용한 표현이다.  이외에도 트럼프 대통령과 김정은 위원장을 소재로 한 칵테일도 등장했다. '에스코바르'라는 술집은 위스키로 만든 파란색 칵테일 '트럼프'와 소주로 만든 붉은 칵테일 '김'을 북미정상회담을 기념해 공개했다. 파란색은 미국 성조기, 붉은색은 북한 인공기를 가리키는 것으로 보인다. 가격은 정상회담 날짜를 기념한 12.6싱가포르달러(약 1만원)이다. '엠파이어 스카이라운지' 술집도 '트럼프'와 '로켓' 칵테일을 선보였다. '트럼프'는 위스키를 기반으로 한 오렌지색 칵테일, '로켓'은 캄파리를 기반으로 한 붉은색 칵테일이다. 가격은 역시 12싱가포르달러다.▶빵~ 뜨는 따끈한 기사▶2018 지방선거 미리보기 ▶MT리포트 정한결 기자 hanj@mt.co.kr<저작권자 ⓒ '돈이 보이는 리얼타임 뉴스' 머니투데이, 무단전재 및 재배포 금지> "
22,2018.06.12. 오후 5:39,주목받는 이지바이오,"정부 '북방정책' 수혜주로 부각자회사 마니커, CJ서 투자유치[ 김동현 기자  ] 러시아에서 농장사업을 하고 있는 사료업체 이지바이오가 정부의 북방정책 수혜주로 거론되며 상승세를 타고 있다. 자회사인 닭고기 전문업체 마니커가 최근 CJ제일제당 투자를 받아 CJ와의 협력관계가 강화된 점도 시장의 주목을 받는 이유다.이지바이오는 12일 코스닥시장에서 190원(2.03%) 떨어진 9150원에 마감했다. 이날 조정받았지만 지난 4월 이후 30.53%(12일 기준) 오르며 상승세를 타고 있다. 전날(11일)엔 장중 1만원까지 뛰며 1년 내 최고가를 기록했다.사료업종이 남북한 경제협력 관련주로 부각되고 있는 게 주가 강세의 일차적 원인으로 꼽힌다. 이지바이오는 자체적으로 배합사료, 사료첨가제를 제조하면서 별도 자회사를 통해 육가공 및 닭·오리고기 제품 판매 등의 사업을 하고 있다. 대북지원이 현실화되면 사료 수요가 급증할 것이라는 기대가 반영됐다는 게 증권업계 분석이다. 이지바이오는 지난해 정부가 발표한 ‘신(新)북방정책’의 수혜주로 거론된다. 이지바이오 자회사인 서울사료는 2008년 러시아 연해주에 설립한 농업법인 에꼬호즈를 통해 현지에 1억2000만㎡ 면적의 농지를 확보하고 있다. 옥수수, 밀 등을 생산해 사료에 들어가는 곡물을 공급하기 위한 것이다. 신북방정책은 러시아 등 북방 유라시아 국가들과 경제협력 체계를 구축하는 게 골자다. 그동안 북한이 빠진 북방정책이라는 논란 속에 과소평가됐지만, 남북관계 개선에 따라 신북방정책도 남북 경협의 일환으로 재평가받고 있다는 분석이다. 정다이 메리츠종금증권 연구원은 “신북방정책과 관련해 농업 부문에서 이지바이오가 러시아 등과 협력해나갈 여지가 있다”고 말했다.실적이 꾸준히 좋아지는 점도 높은 평가를 받고 있다. 지난 1분기 이지바이오는 작년 동기보다 19.4% 늘어난 341억원의 영업이익을 냈다. 심은주 하나금융투자 연구원은 “돼지고기와 닭고기 시세가 오르면서 생물자산 평가이익이 늘고 있다”며 “2분기에도 530억원 규모의 영업이익을 낼 것”이라고 분석했다.자회사인 마니커가 최근 CJ제일제당의 대규모 투자를 받은 점도 호재다. 지난 8일 마니커는 CJ제일제당을 대상으로 140억원 규모의 유상증자를 한다고 공시했다. 내달 신주가 상장되면 CJ제일제당은 이지바이오(마니커 지분율 22.81%)에 이어 마니커 2대 주주(지분율 12.28%)가 된다. 마니커 주가는 11일과 12일 2거래일 연속 가격제한폭까지 올랐다. 조미진 케이프투자증권 연구원은 “이번 증자는 CJ와 이지바이오 협력의 시작점”이라며 “CJ는 사료와 닭고기 등의 제조 노하우를 이전받을 수 있고, 이지바이오는 CJ와 함께 해외로 진출하거나 유통망을 공유하는 게 가능할 것”이라고 평가했다.김동현 기자 3code@hankyung.com[한경닷컴 바로가기] [글방] [모바일한경 구독신청] ⓒ 한국경제 & hankyung.com, 무단전재 및 재배포 금지		"
23,2018.06.28. 오전 9:45,"맘스터치, 여름 보양식 ‘삼계탕’ 선보여","			버거&치킨 브랜드 '맘스터치'가 가정간편식 제품 ‘맘스터치 삼계탕’을 출시했다. ‘맘스터치 삼계탕’은 오랜 기간 닭고기 활용 메뉴를 개발하며 축적해 온 노하우를 바탕으로 개발한 제품으로, 100% 국내산 닭에 찹쌀, 인삼, 대추를 넣고 긴 시간 우려내 깔끔하면서도 깊은 맛을 선사한다.상온보관 후 간단히 데우기만 하면 조리가 끝나, 집에서 편하게 외식을 즐기려는 1인 가구와 혼밥족 등에게 큰 호응을 얻을 것으로 기대된다. 또한, 갓 요리한 삼계탕처럼 닭고기의 살결과 식감이 그대로 살아있어 손님 대접용으로도 손색 없다./ 맘스터치 제공 @머니S MNB, 식품 외식 유통 · 프랜차이즈 가맹 & 유망 창업 아이템의 모든 것제품은 크기에 따라 대중삼계탕(800g), 소중삼계탕(600g) 2종으로 나뉘며 가격은 각각 6,900원, 4,900원으로 맘스터치답게 뛰어난 가성비를 자랑한다. 특수 매장 등 일부 매장을 제외한 맘스터치 전 매장에서 구입할 수 있다.맘스터치 관계자는 “’맘스터치 삼계탕'은 최근 가정간편식 수요가 급증함에 따라 맘스터치 고객들이 집에서도 간편하게 여름철 대표 보양식인 삼계탕을 즐길 수 있도록 기획된 제품""이라며 “이번 삼계탕을 시작으로 맘스터치만의 철학을 담은 가정간편식 제품을 지속적으로 선보여 포트폴리오를 강화해 나갈 계획”이라고 말했다. 강동완 기자 <저작권자 ⓒ '성공을 꿈꾸는 사람들의 경제 뉴스' 머니S, 무단전재 및 재배포 금지>▶ 머니S 페이스북 ▶ 머니S 인스타그램 ▶ 최신 웹툰이 매일 공짜"
