,날짜,기사제목,기사내용
166,2018.09.14. 오전 9:06,[성공창업]지갑여는 영포티(Young Forty) 세대 공략하는 창업 아이템 인기,"젊은 중년 이른바 ‘영포티(Young Forty)’세대가 소비 시장을 주도하고 있다. 과거에는 마흔 살이라면 수염이 덥수룩한 중년 남성, 육아에 치인 여성의 모습을 연상했다. 하지만 평균 수명이 늘어나고 사회가 변화하며 나이에 대한 정의도 바뀌고 있다. 젊은 중년이라 불리는 영포티 세대는 더 이상 아저씨, 아줌마가 아니다. 나이보다 젊게 사는 이들은 소비 시장을 주도하고 있다.사회적 지위로는 리더 자리에 있으며 아날로그와 디지털을 모두 접한 세대이다. 해외여행이 활짝 열린 시대에 전성기를 보냈던 세대라 국내와 글로벌 감각을 고루 갖춘 사람들이 많다.영포티 세대들은 기성 세대의 가치관에 얽매이지 않는다. 트렌드에 민감하며 실용성을 중시한다. 무엇보다 구매력을 바탕으로 자신에 대한 투자를 아끼지 않는다. 외식 메뉴를 선택함에 있어서도 가성비와 가치소비를 중요시한다.◆친환경 식재료로 ‘영포티 세대’ 발길 잡는 식당영포티 세대는 건강한 삶을 지향하기 때문에 친환경, 유기농 식자재 사용 여부를 꼼꼼히 따진다. 같은 음식을 파는 식당이라도 친환경 재료나 건강에 좋은 식재료를 사용했다면 이들의 발길을 잡을 수 있다. 국내 대표 샤브샤브전문점 ‘채선당’은 친환경 채소를 활용한 한식 브랜드로 젊은 중년에게 인기가 좋다.샤브샤브전문점 채선당은 친환경, 유기농 제품만 사용하고 있다. /한국창업전략연구소 제공현재 채선당은 샤브샤브와 샐러드 바를 함께 즐기는 ‘채선당 PLUS’, ‘자연한그릇’, 1인 샤브샤브전문점 ‘샤브보트’, 1인 가마솥밥 전문점 ‘행복 가마솥밥’ 등 브랜드를 보유했다. 채선당은 재배된 신선한 식재료를 산지에서 물류센터의 콜드체인 시스템을 통해 직배송한다.음식에 들어간 성분을 분석하는 체크슈머 성향이 강한 만큼 친환경 음식을 저렴하게 제공하는 채선당에 대한 만족도가 높다. 채선당 ‘샤브보트’의 기본 가격은 9900원이며, 1000~2000원을 추가 시 다양한 사리를 함께 즐길 수 있다.클렌즈 쥬스와 샐러드 전문카페인 주스브로스는 슈퍼푸드가 가득한 샐러드메뉴로 영포티를 사로잡고 있다. 영포티들이 밀집된 서울 종로와 역삼동 매장에는 건강을 챙기는 고객들로 가득하다. 덕분에 초미니 매장에서 놀라온 매출을 올리고 있다.합리적인 가성비를 내세우는 ‘미쿡식당’과 ‘뚜띠쿠치나’도 영포티 세대들에게 인기를 얻는 브랜드. 양식은 젊은층의 전유물이라는 인식을 깨고 프리미엄급 원재료로 영포티들의 가족 외식 장소로 인기다. ‘미쿡식당’ 송도점은 주말이면 영포티 가족 고객들로 만원이다. ‘뚜띠쿠치나’ 고양시 화정본점은 한적한 입지 조건에도 불구하고 인근 아파트에 거주하는 영포티 가족들이 자녀과 부모님까지 동반하는 지역 맛집으로 자리 잡았다.◆주방에서 벗어나게 해준 HMR영포티들은 요리, 장보기와 같은 주방 일에 시간을 쏟는 대신 여가생활에 더 많은 시간을 투자하는 경향을 보인다. 음식은 가정간편식 브랜드를 즐겨 찾는다. 대표 브랜드로는 CJ 제일제당 ‘비비고’, ‘햇반’, ‘고메’ 가 있고 롯데푸드 ‘쉐푸드’, 한국 야쿠르트 ‘잇츠온’ 등을 꼽을 수 있다. 최근 인기를 얻는 가정간편식은 찹스테이크부터 파스타, 그라탕까지 갈수록 다양해지고 있다.국, 찌개, 반찬 등은 퇴근길에 반찬 요리 전문점을 이용한다. 대표 브랜드로는 국선생, 오레시피, 진이찬방 등이 있다. 국선생의 경우 한우육개장, 궁중갈비탕, 콩비지찌개 등 가정에서는 쉽게 조리할 수 없는 일품요리인 국, 찌개 요리 구성으로 인기가 높다.반찬전문점 국선생은 바찬 외에도 궁중갈비탕, 한우육개장 등 가정에서 쉽게 요리할 수 없는 일품요리들이 많다. /한국창업전략연구소 제공건강한 찬류를 만들고자 국내산 한우, 제주산 무항생제 돼지고기, 제철 농산물등 프리미엄급 식재료를 사용하는 것도 영포티들에게 인기를 얻는 이유다. 영포티들은 대부분 청소년이나 어린 자녀들이 있어 자녀를 위해 안전한 식품에 대한 욕구가 크다. 영포티 고객을 공략하는 국선생의 경우 쇠고기국을 위해 한우를 직접 키우고 천연 조미료와 국내산 천일염만 사용한다.◆고급스런 한상 차림, 가성비 있게 즐기는 곳영포티 세대는 과거의 중년들과 달리 실속 있는 소비를 중시한다. 비싼 한정식이나 중식 일식 보다는 캐쥬얼한 음식점을 선호하는 경향이 강하다.사회 생활을 왕성하게 하기 때문에 시간을 아끼면서도 만족도가 높은 가성비있는 외식 메뉴를 선호한다. 선호하는 음식도 한식은 물론 양식 에스닉푸드 등 다양한 장르를 골고루 즐기는 것이 특징이다.(주)풀잎채가 운영하는 ‘사월에 보리밥과 쭈꾸미’의 경우 합리적인 가격과 스피드한 식사 제공으로 영포티 세대를 공략한 사례이다.사월에 보리밥과 쭈꾸미의 대표 메뉴인 쭈꾸미 한상은 보리밥 정식을 고등어구이, 보쌈, 쭈꾸미 볶음 등과 함께 즐길 수 있다./한국창업전략연구소 제공대표 메뉴인 쭈꾸미 한상은 보리밥 정식을 고등어구이, 보쌈, 쭈꾸미 볶음 등과 함께 즐길 수 있다.캐쥬얼한 한식 구성으로 점심식사 장소는 물론 모임 장소로도 인기다. 인천 송도 현대아울렛몰에 있는 ‘사월에 보리밥과 쭈꾸미’ 매장의 경우 점심시간 모임 예약을 하는 40~50대 중년 여성의 비율이 높다. 17개 테이블 외에 8개 룸을 별도로 갖추고 있어 편안히 식사를 할 수 있어 고객의 만족도가 높다. 매출의 70~80%가 영포티 세대 단골에서 발생한다.‘사월에’는 주문 후 7분 이내 전 메뉴를 제공해 고객의 대기 시간을 최소화 했다. 비결은 명확한 주방업무 분담과 원팩(One-pack)에 있다. 본사에서 보내준 레시피와 원팩으로 제공된 재료를 계량만 맞추면 누구든 손쉽게 조리할 수 있다. 빠른 준비시간으로 손님이 몰리는 점심시간에도 테이블이 3회전을 돌 정도로 스피드한 경쟁력을 갖추고 있어 성격급한 영포티 직장인들에게 인기다.후쿠오카함바그의 경우 원래 젊으 트렌드 리더들사이에 맛집으로 입소문난 맛집이다. 하지만 맛집으로 대형 몰에 입점하게되면서 청소년 자녀들이 영포티 세대인 부모들의 손을 잡고 찾는 가족외식 장소로도 인기를 모으고 있다.한식처럼 구워먹는 함바그는 영포티와 젊은층에게 모두 인기다. 함바그는 10대 20대는 물론 ‘응답하라’ 세대인 영포티들의 경양식집에 대한 추억을 상기시켜주는 준다. 영포티 가족 외식 손님이 늘면서 이들을 위한 한식을 세트에 포함시켜 좋은 반응을 얻고 있다.◆동물복지 인증 브랜드 강세기존 세대에 비해 라이프스타일이 더욱 선명한 영포티 세대는 가치 소비를 중요하게 여긴다. 소비행위를 통해 자신만의 정치적, 사회적 신념을 표현하기도 한다. 화장품을 구매할 때 동물실험 여부를 보고, 옷을 구매할 때 동물 털이나 가죽을 원료로 하지 않는 브랜드를 선택한다. 최근에는 육류를 섭치할 때 ‘동물 복지 인증’까지 챙기는 경향이다.자담치킨은 동물복지 인증 닭을 사용하고 있다. /한국창업전략연구소 제공풀무원은 지난달 동물복지연대와 MOU체결하고 식용란 생산과정에서 모든 종류 케이지를 퇴출하기로 했다. 하림은 동물 스트레스를 최소화한 농장에서 키운 브랜드 ‘그리너스’ 출시했다. 치킨 브랜드 중에서는 자담치킨이 동물복지에 앞장서고 있다. 2011년 세계최초로 국내산 무항생제 닭고기만을 사용했다.육계농장, 이동운반, 도계장 등 2개 분야에서 모두 동물복지 인증을 받은 원료육을 사용한다. 뿐만 아니라 빙초산을 사용하지 않고 천연재료로 만든 치킨무를 고객에게 제공하고 있다. 자담치킨은 2013년 먹거리X파일 빙초산편에서 ‘착한가게’로 선정되기도 했다.◆ 영포티 세대 공략 방법시니어들은 소비를 하지 않는다는 선입관이 있다. 하지만 지적 수준이 높고 공동체와 개인주의가 적절하게 혼합된 영포티들의 경우 시니어가 되어서도 합리적이고 실용적인 소비를 할 걸로 전망되고 있다.바로 이 점이 영포티 세대를 주목하게 되는 이유다. 일반적으로 50대 중반이 넘어서면 소비가 위축되는 기성세대와 다른 점이다.영포티 세대들은 현재 사회적으로도 의사결정권의 위치로 나아가고 있다. 또 밀레니엄 세대들의 부모로서 자녀들의 소비 성향도 적극적으로 받아들이는 경향을 갖고 있다.‘가치’와 ‘취향’을 중요하개 여기는 ‘라이프 스타일’세대적 특성을 갖추고 있기도 하다. 육아와 가정생활, 사회활동이 모두 활발한 영포티 세대들은 변덕이 심한 젊은 세대들과 달리 충성도가 높은 안정적인 고객들이다.창업에서 영포티 세대들의 취향을 적극적으로 연구해야 하는 이유이다.[이경희 한국창업전략연구소장]chosunbiz.com"
167,2018.09.14. 오전 9:43,경기사이버장터 추석맞이 할인행사…최대 52% 할인,"			농특산물, 선물세트…18일까지 그림 1경기도 우수 농특산물 전문 쇼핑몰인 경기사이버장터(kgfarm.gg.go.kr)가 추석을 맞아 18일까지 배 한과 유정란 닭고기 돼지찜갈비 잡곡선물세트 등 인기상품 20개 품목을 최대 52%까지 할인 판매한다. 알찬유정란농장의 친환경 무항생제 유정란(30알)은 기존 1만4,900원에서 200개 한정 54% 할인된 6,900원에, 가평마루의 명품잣 오동1호는 6만5,000원에서 100개 한정 40% 할인된 3만9,000원에 구매할 수 있다.또 춘향과 이몽룡의 이별주로 알려진 감홍로주 700㎖l를 7만5,000원에, 조선시대 특권층이 보양주로 즐겼던 봉밀주를 재현한 허니비와인 500㎖를 29% 할인된 3만원에 구매할 수 있다.가격대별 추천 상품에는 3만원 미만 실속선물로 떡 장인 황대규옹의 영양찰떡 3종세트(1만5,900원) 5만원 미만 추천 상품으로 가나안농장 새싹인삼100뿌리 선물세트(3만9,800원) 10만원 미만 대표 상품은 길경농원 도라지차&청 선물세트(5만5,000원), 10만원 이상 고급선물로 안양축협의 프리미엄 구이세트3호(12만원)를 포함한 다양한 가격대의 선물세트를 판매한다. 이범구 기자 ebk@hankookilbo.com▶한국일보 [페이스북] [카카오 친구맺기]▶네이버 채널에서 한국일보를 구독하세요![ⓒ 한국일보(hankookilbo.com), 무단 전재 및 재배포 금지]		"
168,2018.09.05. 오후 5:36,美 제재에 이란 리알화 끝 모를 추락…한달 새 58%↓,"			물가 급등에 민생고 심화…물자부족 우려도이란 리알화와 미국 달러화[AP=연합뉴스자료사진](테헤란=연합뉴스) 강훈상 특파원 = 미국이 이란 핵합의(JCPOA·포괄적공동행동계획)를 탈퇴하고 지난달 7일 대이란 제재를 복원한 여파로 이란 화폐의 가치가 폭락세를 면치 못하고 있다.    5일(현지시간) 정오를 기준으로 이란 리알화의 시장 매매 환율은 미국 달러당 1만4천650 리알까지 치솟았다.    미국이 제재를 재개한 지난달 7일(9천250 리알)과 비교하면 무려 한 달 새 58.4%나 리알화의 가치가 추락한 셈이다.    달러화 대비 리알화의 환율은 연일 사상 최고치를 경신하면서 이달 들어서만 닷새 만에 32% 올랐다.    특히 이란 중앙은행 총재가 1일 물가 급등을 우려해 시장에 보유 외화를 되도록 풀지 않겠다는 뜻을 내비치면서 리알화 가치 하락이 가속하는 흐름이다.    이란 정부는 시장에서 사설 환전소 등에서 비공식으로 매매되는 달러화가 전체의 3%에 불과하고 나머지는 수출입 업자가 직접 교환하는 방식으로 이뤄진다며 시중 환율 급등의 영향이 무시할 만하다는 입장이다.    이란 중앙은행이 고시하는 공식환율은 달러당 4만2천 리알로 격차가 크다.     그러나 시중에서 이란 리알화의 가치가 떨어지면서 물가 상승이 이어져 서민층의 민생고가 심각해지고 있다.    이란 통계청에 따르면 7월 23일부터 한 달간 사과 가격이 39% 오른 것을 비롯해 오렌지 30%, 닭고기가 29% 상승했다. 지난해 같은 달과 비교하면 모두 85% 안팎의 상승률을 기록했다.       통계청은 지난 한 달간 가격이 내린 식품과 생활필수품이 하나도 없다고 발표했다.    환율이 오르면서 수입도 부진한 데다 이란 정부가 수입을 엄격히 규제하는 바람에 물자가 부족해질 것이라는 우려도 커지고 있다. hskang@yna.co.kr▶뭐하고 놀까? '#흥'   ▶뉴스가 보여요 - 연합뉴스 유튜브 ▶네이버 홈에서 [연합뉴스] 채널 구독하기"
172,2018.09.02. 오후 1:11,"추석 농산물값 ‘비상’…농식품부, 성수품 공급 확대추진"," 농림축산식품부는 추석을 앞두고 주요 농축산물의 공급량을 늘리는 등 '추석 성수품 수급안정대책'을 추진한다고 밝혔습니다. 특히 올해는 봄철 이상저온, 여름철 폭염, 태풍 솔릭 이후 집중호우 등으로 인해 농산물 수급에 대한 우려가 큰 만큼 특별대책 추진 기간을 예년의 추석 전 2주간에서 1주일 앞당겨 추석 전 3주간으로 확대 운영한다고 설명했습니다. 추석 수요가 많은 배추, 무, 사과, 배, 소고기, 돼지고기, 닭고기, 계란, 밤, 대추 등 10대 성수품은 평상시 하루 5천369t보다 1.4배 많은 하루 7천252t을 공급하기로 했습니다. 대책 기간 전체 공급물량은 12만t 수준으로, 대책 기간이 지난해보다 늘어나면서 공급량은 지난해(8만t)보다 51% 증가합니다. 농협과 대형마트 등 온라인·직거래 매장과 연계한 다양한 할인 행사를 통해 소비자 부담도 덜어줍니다. 수요가 몰리는 과일과 축산물은 선물세트 공급을 확대하고 직거래 장터, 로컬푸드 직매장 등 오프라인 장터는 지난해 2천544곳에서 올해 2천686곳으로 늘립니다. 우리 농산물 소비 확대를 위한 캠페인과 홍보도 적극 추진하는 한편 공영 홈쇼핑을 통해서는 추석 성수품 판매 방송을 전체의 50% 이상 집중 편성합니다. 농업인 지원 대책으로는 통상 11월에 지급하던 농업직불금을 추석 전인 9월에 조기 지급하며, 자연재해로 피해를 입은 농가에는 재해보험금과 재해복구비를 조기 지급하기 위한 절차를 신속히 진행합니다. 아울러 주요 농축산물에 대해 원산지·축산물이력관리 준수 여부를 일제 단속하는 등 500개 반 4천100명을 동원해 부정 유통행위 근절에 나섭니다. 한편 농식품부는 추석 성수품 가격 동향과 관련, 포기당 배춧값은 8월 상순 3천593원에서 하순에는 5천861원까지 올라 평년보다 51% 높았다고 밝혔습니다. 개당 뭇값은 8월 상순 2천397원에서 8월 하순에는 2천782원까지 올라 평년보다 91% 높았습니다. 사과는 아오리 10㎏ 기준으로 8월 하순 가격이 4만 2천 원 대로 평년보다 66% 비쌌고, 배는 원황 15㎏ 기준으로 4만 2천 원 대로 평년보다 39% 올랐습니다. [사진출처 : 연합뉴스]박일중기자 (baikal@kbs.co.kr)[저작권자ⓒ KBS 무단복제-재배포 금지]▶ 네이버 채널 KBS뉴스 구독! 시원하게 털어드립니다▶ ‘TV보다 리얼’한 색다른 뉴스!"
173,2018.09.25. 오전 11:26,"추석 집밥, 미안하고 지겹다면 호텔 외식 어때요?","그랜드 인터컨티넨탈 서울 파르나스 '그랜드 키친'의 스페인 요리 프로모션' 【서울=뉴시스】김정환 기자 = 추석을 맞아 온 가족이 화목을 다지고, 명절 준비로 고생한 어머니, 아내에게 보답하는 데 맛있고 분위기 좋은 외식만큼 좋은 것은 없을 것이다. 마침 서울과 부산의 특급호텔이 추석 미식 프로모션을 다채롭게 연다. 이틀 남은 연휴 기간 한 번 고려해보자. 한식부터 스페인 요리까지 선택 폭도 넓어 더욱 좋다.○···강남구 삼성동 그랜드 인터컨티넨탈 서울 파르나스는 호텔 내 여러 레스토랑에서 다양한 추석 프로모션을 연다. 뷔페 레스토랑 '그랜드 키친'은 30일까지 런치와 디너에 '스페인 요리 프로모션'을 펼친다.스페인 인터컨티넨탈 마드리드에서 미구엘 데 라 푸엔테 사즈 수석 셰프 팀을 초청해 10여 가지 특별 메뉴를 차린다. 명절 시즌 한식이 아닌 이색 메뉴를 맛볼 기회다. 스페인 셰프 3인은 라이브 스테이션에서 발렌시아의 '닭고기 새우 빠에야', 라만차의 '피스토 만체고', 알리칸테의 '아이올리 소스를 곁들인 스페니시 오믈렛', 안달루시아의 '가스파초', 마드리드의 '마늘 소스 새우 파스타' 등 스페인 각 지역 대표 메뉴 10여 종을 만든다 더 리버사이드 호텔 '따뚱'의 '페킹 덕'스페인을 대표하는 칵테일인 샹그리아(별도 판매), 대표 디저트 츄러스도 준비한다. 3대 가족 중 4인 이상 방문 시 1인 식사를 무료로 제공하는 '3대 프로모션'을 진행한다.  프렌치 레스토랑 ‘테이블 34’는 '추석 브런치 고메'를 내놓는다. 이탈리안 레스토랑 '스카이 라운지'는 웰컴 디시와 수프를 추가로 제공한다. 모던 차이니즈 레스토랑 '웨이루'는 대표 메뉴 29가지 중 원하는 6가지를 자유롭게 선택해 맛볼 수 있게 한 '추석 패밀리 초이스 프로모션'을 연다. ○···서초구 잠원동 더 리버사이드 호텔은 26일까지 레스토랑 두 곳에서 한가위 프로모션을 펼친다. 오크우드 프리미어 코엑스 센터 '오크 레스토랑'의 '빠네 파스타''더 가든 키친'은 뷔페 런치와 디너를 추석 특가로 성인 1인 기준 5만6100원(정상가 6만6000원) 판매한다.  가격은 낮아졌어도 음식은 더욱 풍요롭다. 3색 전·3종 나물과 송편 등 한국 전통 추석 음식을 비롯해 중국 마라룡하, 일본 우마니 론끼·곤약구, 싱가포르 라이브 생선요리, 태국 똠얌꿍 등 아시아 각국 명절 요리를 추가한다. 최고급 통참치(마구로) 무제한 페스티벌도 함께 진행한다. 중식당 '따뚱'은 한가위 특별 보양 코스를 선보인다.인기 메뉴인 정통 '페킹 덕'(북경식 오리구이)를 중심으로 활전복 분사찜, 메로 생선찜, 중새우 메이지 소스, 들깨 게살 건강 수프, 식사, 시미로와 계절과일 등으로 짠다. 스페셜 디저트로 중국에서 중추절(추석)에 행복을 빌며 나눠 먹는 명과인 월병을 낸다. 1인 6만5000원.○···강남구 삼성동 오크우드 프리미어 코엑스 센터는 '오크 레스토랑'에서 10월31일까지 시그니처 디시 프로모션 '산진해찬'을 선보인다.  '뚝배기 육개장' '낙지 해물 순두부찌개 ' '전복과 곤드레 돌솥비빔밥' '능이버섯 낙지 왕 갈비탕' 등 한식은 물론 '빠네 파스타' '뚝배기 해물 토마토 파스타' 등 파스타도 준비돼 남녀노소 온 가족이 즐길 만하다. 포포인츠 바이 쉐라톤 서울 강남 '에볼루션'의 '백련 막걸리'단품 3만원부터, 식전 샐러드·커피 등이 추가된 세트 메뉴 4만5000원부터.○···강남구 신사동 포포인츠 바이 쉐라톤 서울 강남은 26일까지 올 데이 다이닝 레스토랑 '에볼루션'에서 한식 뷔페 메뉴와 함께 전통주 명가 신평양조장의 '백련 막걸리'를 즐길 자리를 마련한다. 신평양조장은 1933년 충남 당진시 신평면에 문을 열어 3대째 이어지고 있다. 백련 생막걸리는 2009년 청와대 건배주로 선정된 유서 깊은 술이다.   요리로 전, 갈비찜 등 추석에 어울리는 한식 메뉴를 추가로 선보인다.  성인 1인 기준 4만9000원. 파크 하얏트 부산 '다이닝룸'의 '추석 디너 뷔페'○···해운대구 우동 파크 하얏트 부산은 29일까지 프리미엄 그릴 & 스시 레스토랑 '다이닝룸;에서 '추석 디너 뷔페'를 운영한다. 명절 분위기를 물씬 풍기는 다채로운 한식 요리는 물론 최상급 육류를 셰프가 직접 참숯에 구워 제공하는 그릴 요리, 신선한 해산물 요리, 각종 디저트 등을 차린다. 테이블로 서빙되는 메인 메뉴는 추석을 맞아 다이닝룸 스타일로 모던하게 재해석한 한식 4종(택1)을 준비한다. 프리미엄 커피 또는 차를 제공한다. 성인 1인 7만5000원.ace@newsis.com▶ 뉴시스 빅데이터 MSI 주가시세표 바로가기 ▶ 뉴시스 SNS [페이스북] [트위터]<저작권자ⓒ 공감언론 뉴시스통신사. 무단전재-재배포 금지.>"
