,날짜,기사제목,기사내용
37,2018.09.23. 오전 7:15,'사료론 부족해' 반려동물 영양·보양 제품 불티,"			피부·관절 건강식류나 비타민 등 최대 수백% 급성장반려견[연합뉴스 자료 사진]    (서울=연합뉴스) 이태수 기자 = 개나 고양이 등 반려동물을 기르는 가구가 급증하면서 동물에게 주는 먹이도 단순 사료를 넘어 영양제나 보양 제품 등으로 저변이 넓어지고 있다. 23일 인터넷 쇼핑 사이트 지마켓에 따르면 올해 1∼8월 강아지를 위한 피부·관절 개선 건강개선식류는 지난해 같은 기간보다 51% 판매량이 늘었다.    전년 대비 판매량 증가 폭은 2016년이 109%로 2배 가까이 껑충 뛰었고, 지난해 역시 45%나 성장하는 등 꾸준히 시장이 커졌다.    강아지를 위한 기타 영양제 역시 2016년(이하 전년 대비) 141%, 지난해 31% 각각 성장했다. 올해 1∼8월에는 지난해 같은 기간보다 판매량이 49% 늘었다.    이 같은 '반려동물 사랑'은 개뿐 아니라 고양이에게도 마찬가지로 나타났다.    고양이용 비타민·칼슘 건강개선식류 판매량은 올해 1∼8월 118%나 증가했다. 지난해에는 전년보다 73% 올라갔고, 특히 2016년은 무려 610%나 급증해 눈길을 끌었다.    고양이용 피부·관절 건강개선식류 역시 2016년 778%, 지난해 163%, 올해 1∼8월 262%나 각각 급성장했다. 기타 영양제는 2016년 80%, 지난해 103%, 올해 1∼8월 41%가 각각 신장했다.반려묘[연합뉴스 자료 사진]    지마켓은 상설관 '더 펫숍'(The Pet Shop)을 차려 사료는 물론, 건강에 도움이 되는 각종 간식과 위생용품 등을 할인해 팔고 있다.    '펫천국의 치킨져키'는 단백질 함량이 높은 닭고기의 여러 부위를 사용해 만든 간식으로, 저지방 무염분이 특징이다. '한입뚝딱 수제간식 소간육포'는 소의 간을 말려 만든 수제 간식으로, 비타민 A가 풍부하고 시금치의 5배에 달하는 철분과 아연을 자랑한다.    이 같은 트렌드에 따라 업계는 사료를 넘어 넓어진 소비자의 수요에 맞는 다양한 제품을 속속 출시하고 있다.뉴트리플랜 모이스트루 영양스프[동원F&B 제공=연합뉴스]    동원F&B는 최근 애견·애묘용 보양식인 습식파우치 '뉴트리플랜 모이스트루 영양스프' 4종을 출시했다.    제품은 반려동물의 영양보충과 보양 식단을 위해 참치·연어·닭고기·황태를 주재료로 각각 담고, 기능성 영양성분인 타우린·이눌린·글루코사민 등을 담아 영양 밸런스를 높인 것이 특징이다.    특히 홍삼 전문 브랜드 '동원 천지인 홍삼'의 홍삼 농축액까지 넣어 소비자의 눈높이에 맞췄다.    동원F&B는 ""반려견은 산책이나 운동 후에 먹이면 좋고, 반려묘는 입맛이 없을 때 간식으로 주면 좋다""고 소개했다.    네슬레 퓨리나는 고급 레스토랑 셰프에서 영감을 받아 이탈리아 본통의 풍미를 재현한 캣푸드 '팬시피스트 메들리 라인'을 판매 중이다.    이 제품은 부드러운 델리켓 소스, 담백한 클래식 소스, 향긋한 허브 소스 등 이탈리안 조리법의 세 가지 특제 소스를 활용했다. 고급 황다랑어, 부드러운 칠면조, 순살 닭고기, 자연산 연어 등 고품질 단백질 원료를 넣었다.    메들리 라인은 투스카니 요리법으로 만든 '투스카니 참치'·'투스카니 칠면조', 시금치를 활용한 프로방시식 조리법의 '플로렌틴 참치'·'플로렌틴 치킨', 채소를 곁들인 프리마베라 조리법을 적용한 '프리마베라 연어'·'프리마베라 치킨' 등 총 10종으로 구성됐다.캣푸드 팬시피스트 메들리 라인[네슬레 퓨리나 제공=연합뉴스]    지마켓 관계자는 ""반려동물을 가족의 일원으로 여기는 인식이 보편화하면서 이들의 건강을 생각하는 간식이나 영양제 관련 품목의 판매량도 꾸준히 증가하고 있다""며 ""상품 다양성은 물론, 가격대의 폭도 넓어지는 추세""라고 말했다. tsl@yna.co.kr▶놓치면 아쉬운 '핫뉴스'   ▶뉴스가 보여요 - 연합뉴스 유튜브 ▶네이버 홈에서 [연합뉴스] 채널 구독하기"
38,2018.09.20. 오후 12:00,'양계 농가 불리하게 닭 가격 책정' 하림에 7억9천만원 과징금,"			공정위, AI 창궐때 제기된 '병아리 소유권 갑질'은 무혐의(세종=연합뉴스) 이대희 기자 = 닭고기 업계 1위 하림이 계약과는 다른 방식으로 닭 가격을 정해 사육 농가의 뒤통수를 쳤다가 과징금을 물게 됐다.    하지만 조류 인플루엔자(AI)에 따른 대량 살처분 때 하림이 벌였던 병아리 외상 가격 인상은 불공정행위가 아니라는 판단이 나왔다.하림[연합뉴스TV 제공]    공정거래위원회는 공정거래법 위반 혐의로 하림에 시정명령과 함께 과징금 7억9천800만원을 부과하기로 했다고 20일 밝혔다.    하림은 2015∼2017년 550여개 농가와 생닭을 거래하면서 전체 거래의 32.3%인 2천914건을 계약서와 달리 농가에 불리하게 닭 가격을 산정한 혐의를 받는다.    하림과 농가의 닭 가격 산정 방식은 몹시 복잡하다.    하림은 병아리와 사료를 농가에 외상으로 팔고, 병아리가 닭으로 자라면 이를 전량 매입하면서 닭 가격에 외상값을 뺀 나머지를 농가에 준다.    닭 가격은 일정 기간 출하한 모든 농가의 평균치를 근거로 하림이 사후 산정하는 구조다. 약품비와 사료 원가, 병아리 원가, 사육 수수료 등을 더해서 산정한다.    문제는 닭을 다 키우고 출하 직전 정전이나 폭염과 같은 사고나 재해로 폐사할 때 발생한다.    계산식에 따르면 이런 경우 출하하는 닭의 마릿수가 줄어들고 닭 한 마리에게 필요한 사료의 양이 증가하는 효과가 나타난다. 이 때문에 전체적인 닭 가격이 올라가는 효과가 나타나며 매입자인 하림에게는 불리해진다.    하림은 이를 막으려고 닭이 폐사한 농가 93곳의 데이터를 계산할 때 제외했다. 결국 닭 가격은 낮은 수준에서 결정되고 농가가 손해를 보게 된 것이다.    다시 말해 사육 과정에서 생기는 위험성은 농가가 전적으로 부담하는 셈이지만 이러한 계산 방식을 하림은 계약서에 넣지 않았다.    공정위는 이런 행위가 거래상 지위를 남용해 거래 과정에서 불이익을 준 것으로, 공정거래법을 어겼다고 판단했다.닭오리 살처분연합뉴스TV 캡처. 작성 이충원(미디어랩)다만 공정위는 작년 국정감사 등에서 지적된 하림의 '병아리 갑질'과 관련해서는 공정거래법 위반이 아니라고 판단했다.    당시 농가는 살처분에 따른 마리당 보상금을 정부로부터 받았는데, 하림은 이 보상금과 관련해 병아리 외상값을 올리면서 논란이 일었다.    거래 구조상 농가가 닭을 납품하지 못하게 되면 병아리 외상값은 그대로 빚이 되는데, 이를 더 올리면서 사실상 살처분 보상금을 하림이 가져가게 됐다는 것이다.    공정위 사무처는 이러한 행위가 역시 공정거래법 위반이라고 판단했지만, 위원회는 혐의가 없다고 봤다.    계약서에 닭이 살처분됐을 때 닭 가격 산정방법이 없었던 점, 정부가 지급한 살처분 보상액이 하림 측이 인상한 병아리 가격보다 더 높아 농가에게 불이익이 아니었다는 점 등을 무혐의의 근거로 밝혔다.    공정위 관계자는 ""사업자가 거래상 열등한 지위에 있는 농가에 대금을 낮게 지급하는 행위를 최초로 적발해 제재했다""며 ""사업자와 농가 사이 불신의 주요 원인인 사육 경비 지급과 관련한 불공정거래행위를 집중 점검하겠다""고 말했다. 2vs2@yna.co.kr▶한눈에 보는 남북정상회담 실시간 뉴스   ▶뉴스가 보여요 - 연합뉴스 유튜브 ▶네이버 홈에서 [연합뉴스] 채널 구독하기"
39,2018.09.21. 오전 6:00,추석물가 비상..8월 농산물가격 8년만에 최대폭 상승,"			[머니투데이 구경민 기자] [한은, 8월 생산자물가지수 발표..시금치 222.9%·배추 91.0% 폭등] 지난달 생산자물가지수가 4년만에 가장 높은 수준을 기록했다. 폭염으로 농산물 가격이 급등한 영향이다. 한국은행이 21일 발표한 '8월 생산자물가지수'에 따르면 지난달 생산자물가지수는 105.43(2010=100 기준)으로 전달보다 0.5% 상승했다. 이는 2014년 8월 105.57을 기록한 이후 최고치다. 지난해 같은 달과 비교해서는 3.0% 오르며 2016년 11월 이후 22개월 상승세를 이어갔다. 생산자 물가는 국내 생산자가 시장에 상품과 서비스를 공급할 때 매긴 값으로 소비자 물가의 선행 지표다. 생산자 물가와 소비자 물가와의 차이는 유통단계에서 붙는 비용 때문에 발생한다.생산자 물가를 끌어올린 것은 농산물이다. 7월에 이어 8월에도 폭염이 지속되면서 농산물은 전달보다 18.3% 상승했다. 2010년 곤파스 태풍으로 농산물이 18.8% 오른 이후 8년만에 가장 큰 폭의 상승세다. 한은 관계자는 ""8월 생산자물가지수가 전월대비 0.5% 상승했는데 농림수산품의 영향이 70% 이상을 차지했다""면서 ""폭염이 지속돼 물가가 오르면서 추석물가에 영향을 미칠 수도 있다""고 말했다. 품목별로는 시금치 가격이 한달 전보다 222.9% 급등했다. 배추(91.0%)와 수박(50.4%), 무(29.1%) 등의 값도 크게 올랐다. 무더위가 지속되면서 폐사되는 가축이 늘자 축산물도 7월보다 3.5% 상승했다. 달걀과 닭고기, 쇠고기가 각각 전월 대비 35.7%, 15.4%, 4.7% 올랐다. 수산물은 수확량에 비해 수요가 둔화되면서 전달에 비해 3.7%가 줄었다. 휴가철 영향으로 서비스 물가도 들썩였다.   휴양콘도(18.5%), 국제항공여객(5.6%), 호텔(3.3%) 가격이 오르며 음식점 및 숙박과 운수 업종의 물가가 전달보다 각각 0.3%, 0.1% 올랐다. 국제 유가 상승의 영향으로 공산품 물가도 전달보다 0.1% 올랐지만 상승폭은 둔화됐다. 화학제품(0.6%)과 석탄 및 석유제품(0.4%)이 상승했다. 한편 국내출하에 수입까지 포함해 상품과 서비스 가격 변동을 측정한 국내공급물가지수는 102.16으로 전월대비 0.1% 올랐다. 국내출하에 수출까지 포함한 총산출물가지수는 101.53으로 0.3%상승했다.▶더 많은 머니투데이 기사보기▶실시간 급상승 ▶머니투데이가 묻습니다!  구경민 기자 kmkoo@mt.co.kr<저작권자 ⓒ '돈이 보이는 리얼타임 뉴스' 머니투데이, 무단전재 및 재배포 금지> "
45,2018.09.21. 오후 12:01,8월 생산자물가지수 4년來 최고… 농산물 가격뛰며 22개월째 상승,"105.43으로 7월比 0.5% 상승 18% 넘게 오른 농산물 등 영향지난 8월 폭염으로 농산물 가격이 껑충 뛰면서 생산자물가지수가 4년 만에 최고 수준으로 치솟았다. 9월까지 고온 현상이 이어진 점을 고려할 때 추석(24일) 연휴를 앞둔 시점에서 9월 생산자물가도 상당폭 뛰었을 것으로 보인다.한국은행이 21일 발표한 ‘2018년 8월 생산자물가지수’를 보면 올 8월 생산자물가지수는 105.43으로 직전 달보다 0.5% 올랐다. 2014년 8월(105.57) 이후 최고로, 전월 대비 증가 폭은 1월과 7월에 이어 올 들어 최대 수준이다.농림수산품, 특히 농산물이 생산자물가 상승세를 이끌었다. 농림수산품은 한 달 전보다 8.7% 뛰었다. 그중에서도 농산물은 무려 18.3%나 올랐다. 폭염에 약한 잎채소를 중심으로 작황이 부진해지며 가격이 뛴 것이다.지난달 농산물 물가 상승률은 2010년 9월(18.8%) 이후 약 8년 만에 최대였다.시금치는 한 달 사이 배 이상(222.9%) 올랐고, 배추는 91.0% 상승했다. 수박(50.4%), 무( 29.1%) 등도 상승 폭이 두드러졌다.축산물은 3.5% 올랐다. 닭고기가 15.4% 상승했고 계란은 35.7% 뛰었다. 공산품은 화학제품을 중심으로 0.1% 상승했다. 전력, 가스 및 수도도 0.1% 올랐다. 서비스물가는 음식점 및 숙박 등의 상승세로 0.1% 올랐다.지난해 같은 달과 견주면 생산자물가는 3.0% 상승했다. 2016년 11월 이후 22개월 연속 오름세다.수입품까지 포함해 상품, 서비스 가격 변동을 측정한 국내공급물가지수는 102.16으로 한 달 전보다 0.1% 올랐다. 국내 출하에 수출품까지 더해 측정한 총산출물 물가지수는 101.53으로 0.3% 상승했다. 김만용 기자 mykim@munhwa.com[ 문화닷컴 바로가기 | 문화일보가 직접 편집한 뉴스 채널 | 모바일 웹 ][Copyrightⓒmunhwa.com '대한민국 오후를 여는 유일석간 문화일보' 무단 전재 및 재배포 금지(구독신청:02)3701-5555)]		"
50,2018.09.04. 오전 7:51,축산물 온라인 가격비교 사이트 선보인다…올해 말 구축," ［사진=헤럴드 DB］자율경쟁ㆍ직거래 촉진해 소비자 선택권 확대［헤럴드경제=배문숙 기자］정부가 올해안으로 축산물 온라인 가격비교 사이트를 선보일 예정이다. 이에 따라 소비자들은 온라인으로 가격을 비교해서 더 저렴한 축산물을 구매할 수 있게 된다.4일 축산물품질평가원에 따르면 소고기와 돼지고기 등 축산물 가격을 손쉽게 온라인으로 비교 확인할 수 있는 가격비교 사이트 구축 작업이 올 연말을 목표로 진행되고 있다.이는 2016년 11월 농림축산식품부가 발표한 ‘축산물 유통구조 개선방안’에 따른 조치로, 소비자에게 유통 실태 정보를 투명하게 공개해 가격 경쟁을 유도하기 위한 것이다. 지금까지 축산물 중에서는 닭고기와 계란 등 일부 제품만 가격공시제를 시행하고 있었을 뿐 가장 많이 소비되는 소고기와 돼지고기는 온라인으로 가격을 공시하거나 비교할 방법이 없었다. 이에 따라 한우 1++등급 구매 시 유통 경로별로 최대 100ｇ당 8000원 이상 가격차가 생겼다.아울러 축산물의 온라인 거래액은 5200억 원으로, 국내 축산업 전체 생산액 19조9000억 원의 2.63%에 불과할 정도로 다른 제품에 비해 온라인 거래 비중이 낮았다. 새로 구축되는 사이트는 이용자가 접속한 지역 또는 설정한 지역을 중심으로 주변의 산지·도매·소매 가격정보를 비교해 제공한다.검색을 통해서는 전국 지역별 최저·최고·평균 가격도 보여주며, 특정 판매점의 세부정보와 이용자 후기도 확인할 수 있다.축산물품질평가원은 내년까지 가격조사 대상 업체 4000여 곳을 확보하고, 2022년까지 조사 대상 업체를 7000여 곳으로 늘리고 정보 수집 주기도 단축해 더욱 자세한 정보를 제공하는 것을 목표로 하고 있다.이번 사이트에는 산지·유통·판매 단계에 대한 조사결과를 분석할 수 있는 유통조사분석 시스템도 포함해 향후 유통구조 선진화를 위한 자료 수집에 활용할 계획이다.축산물품질평가원은 ”축산물 가격 차이를 최소화해 생산자는 제값을 받고 소비자는 저렴한 가격에 축산물을 구입할 수 있을 것“이라며 ”자율경쟁 촉진과 직거래 활성화를 통해 소비자 선택권 확대와 소상공인의 소득 증대가 기대된다“고 밝혔다.oskymoon@heraldcorp.com▶어서와~ 이런 상품은 처음이지? 헤럴드 리얼라이프▶리얼라이프 카카오플러스 친구맺기 ▶한입뉴스 ‘타파스’ 페이스북 친구맺기 - Copyrights ⓒ 헤럴드경제 & heraldbiz.com, 무단 전재 및 재배포 금지 -		"
51,2018.09.19. 오후 6:24,"인천지역, 추석 대목 앞두고 성수품 가격 오름세","추석연휴를 사흘 앞둔 19일 세종시 조치원읍 세종전통시장을 찾은 많은 시민들이 장을 보고 있다. 2018.9.19/뉴스1 © News1 장수영 기자(인천=뉴스1) 강남주 기자 = 추석 대목을 앞둔 인천지역의 성수품 가격이 닷새 사이 전반적인 오름세를 보이고 있다.인천시는 지난 13일과 18일 8개 구 전통시장, 대형마트 등을 대상으로 추석 성수품 물가조사를 실시한 결과 19개 품목의 가격이 상승한 것으로 집계됐다고 19일 밝혔다.13일 1마리 1667원이었던 조기는 18일 2000원으로 20%P(333원) 올랐으며 수입산 소고기(등심, 500g)는 1만2475원에서 1만3275원으로 800원이 뛰었다. 이밖에 Δ양파 4.7% Δ건대추 2.2% Δ갈치 6.9% Δ동태포 4.2% Δ닭고기 3.4% Δ사과선물세트(약 15개) 3.6% Δ배선물세트(8~10개) 6.6% 등이 오름세를 보였다.반면 무, 배추, 고등어, 국산 소고기(등심) 등은 5.3~8.6%P 가격이 떨어진 것으로 조사됐다.inamju@news1.kr▶ 진짜 블록체인을 만나는 곳 '크립토허브' 오픈!  ▶ 제보하기▶ 네이버 메인에서 [뉴스1]을 구독해주세요[© 뉴스1코리아(news1.kr), 무단 전재 및 재배포 금지]"
54,2018.09.21. 오전 8:31,닭가격 낮춰 농가에 지급한 하림 과징금 8억,"			닭가격 낮춰 농가에 지급한 하림 과징금 8억닭고기회사 하림이 농가에 생닭 가격을 과도하게 낮춰 정한 뒤 지급해 과징금을 물게 됐습니다. 공정거래위원회는 공정거래법 위반 혐의로 하림에 시정명령과 함께 과징금 7억9,800만 원을 부과했다고 밝혔습니다.하림은 지난 2015년부터 2년 동안 농가에 지급해야하는 대금을 정하는 과정에서 생닭가격을 높이는 재해농가 93곳을 빠뜨린 혐의를 받고 있습니다.하림은 생계대금을 전체 농가의 평균치로 산정하는데, 공정위는 하림이 이를 고의로 낮게 정했다고 봤습니다.연합뉴스TV : 02-398-4441(기사문의ㆍ제보) 카톡/라인 jebo23 ▶ 연합뉴스TV 네이버 채널 구독   ▶ 생방송 시청 ▶ 대한민국 뉴스의 시작, 연합뉴스TV 앱 다운받기"
57,2018.09.10. 오전 9:41,"하림, 가성비 최고 ‘2018 추석 선물세트’ 출시","2만~4만원 대 추석 선물세트 선봬(사진=하림)[이데일리 강신우 기자] 닭고기 전문기업 하림이 추석을 앞두고 소중한 분들에게 고마운 마음을 담아 선물하기 좋은 ‘2018 추석 선물세트’를 선보였다고 10일 밝혔다. 소비자들에게 많은 사랑을 받고 있는 하림의 베스트셀러 제품들로 구성한 것이 특징이다. △하림이 엄선한 국내산 닭고기를 부위별로 개별 냉동한 ‘친환경 닭고기 세트’ △가정이나 야외에서 간편하게 즐길 수 있는 ‘양념육 세트’와 ‘홈메이드 세트’ △맛과 영양을 동시에 챙길 수 있는 ‘삼계탕 세트’와 ‘수비드 닭가슴살 세트’ 등을 다양하게 준비했다. 소비자들이 선호하는, 활용도 높은 닭고기 선물세트를 5만원 미만의 합리적인 가격으로 선물할 수 있다.‘양념육 세트’는 인기 외식 메뉴를 가정이나 여행지에서 간편하게 즐길 수 있게 만든 ‘춘천식 순살닭갈비’와 ‘토종닭 매실숙성 순살닭갈비’, ‘안동식 순살찜닭’에 ‘포장마차식 양념근위’와 ‘포장마차식 뼈없는양념닭발’ 등으로 구성됐다. 모두 프라이팬에 덜어 익히기만 하면 요리가 완성되는 제품들이고, 총 14봉이나 돼 대가족이 함께 즐기거나 냉동고에 넣어두고 먹어도 될 만큼 푸짐하다. 명절 연휴 동안 특별 메뉴나 술안주로 즐기기에 손색 없다. ‘양념육 세트’ 가격은 4만5000원. 매콤한 맛이 일품인 ‘뼈없는 양념닭발’과 ‘근위 볶음’만으로 구성된 ‘뼈없는 양념닭발 세트’도 있다. 4만7900원.칼로리에 민감하고 깔끔한 맛을 선호하는 소비자를 위한 ‘수비드 닭가슴살 세트’도 있다. 친환경 닭고기를 가볍게 양념해 낮은 온도에서 천천히 조리한 ‘촉촉한 수비드 닭가슴살’과 100% 국내산 닭가슴살로 만든 ‘더 건강한 가슴살 훈제’ 총 19봉이 3만6000원.실속 있는 2만원대 제품도 눈에 띈다. 닭발을 우려낸 진한 육수에 국내산 신선한 닭과 우수한 부재료를 넣고 끓인 ‘하림 신선 삼계탕’ 3봉으로 구성된 ‘하림 삼계탕 세트’가 2만8000원. 닭가슴살과 북채, 봉 등을 개별 급속동결 처리한 IFF 가슴살, IFF 봉, IFF 북채가 모두 들어 있는 ‘알뜰 기획 세트’도 2만8000원이다. 소포장된 ‘마늘훈제치킨’과 ‘더 건강한 자숙안심’으로 구성된 ‘하림 슬림(Slim) 훈제 세트’는 2만5500원.이밖에 집에서 튀겨 먹을 수 있게 만든 ‘홈메이드 치킨(오리지널)’이 포함된 ‘간편한 홈메이드 세트’(3만9600원)와 ‘토종닭 훈제 세트’(4만5000원), ‘토종닭 볶음탕 세트’(3만4900원) 등이 있으며 하림이 준비한 추석 선물세트는 하림 온라인 공식쇼핑몰인 하림몰에서 만나볼 수 있다.하림 마케팅팀 관계자는 “추석을 앞두고 소비자들이 좀 더 실속 있고 활용도 높은 선물을 준비할 수 있도록 다양한 구성과 가격대의 선물세트를 선보이게 됐다”며 “주는 사람의 감각과 정성을 돋보이게 할 하림 선물세트로 풍족하고 즐거운 명절 보내시길 바란다”고 말했다.강신우 (yeswhy@edaily.co.kr)네이버에서 ‘이데일리’ 구독하면 '공기청정기' 드려요~ [구독하기▶]20~30 세대를 위한 꿀팁! 정보 [스냅타임▶]꿀잼 '웹툰'이 매일 매일 공짜...[웹툰보기▶]＜ⓒ종합 경제정보 미디어 이데일리 - 무단전재 & 재배포 금지＞"
68,2018.09.02. 오후 7:09,무 91% 사과 66% 급등… 추석 물가 ‘비상’,"봄 이상저온에 폭염·폭우 덮쳐/ 10대 성수품 중 7개 품목 값 올라/ 폐사 여파 닭고기 값도 심상찮아/ 정부, 수급 안정 대책반 조기가동/“비축물량 집중 출하 물가 잡는다”이번 추석 차례상 물가도 만만치 않을 것으로 전망된다. 올해 봄철 이상저온을 시작으로 기록적인 여름 폭염과 최근 전국을 강타한 폭우 등의 영향으로 성수품의 가격이 일제히 오르고 있다. 정부는 일찌감치 물가 잡기에 나섰다.2일 농림축산식품부에 따르면 지난달 31일 기준 10대 성수품 중 7개 품목의 가격이 평년보다 올랐다. 무의 경우 개당 가격이 2782원(도매가 기준)으로 평년 대비 91%나 상승했다. 올해 폭염과 폭우 등의 이상 기후로 무름병이 확산해 공급량이 부족해진 탓이다. 배추는 가격이 점차 내려가는 추세지만 여전히 평년 대비 51%나 비싸다.사과와 배도 지난봄 이상저온으로 착과율이 감소한 데다 폭염으로 햇볕 데임까지 일어나 생산량이 줄었다. 특히 선물세트 등에 주로 쓰이는 상품과(上品果) 비중이 줄었다고 농식품부는 설명했다. 사과(아오리)는 평년 대비 가격이 66%나 높고, 배(원황)도 39% 상승했다.닭고기도 폭염에 따른 폐사가 늘고, 증체율이 줄면서 평년보다 다소 높은 가격이 형성되고 있다.상황이 이러자 농식품부는 농산물 수급 특별대책 추진 기간을 추석 전 3주간으로 예년보다 1주일 더 앞당겨 시행한다고 밝혔다. 농식품부 차관을 반장으로 하는 ‘추석 성수품 수급 안정 대책반’을 가동해 성수품의 수급 및 가격 동향을 특별 관리하기로 했다.대책반은 10대 성수품에 대해 농협의 비축·계약재배 물량 등을 활용해 평상시 하루 공급량인 5369t보다 1.4배 많은 7252t을 공급하기로 했다. 축산물과 임산물의 경우에도 관련 단체나 조합 등의 보유량을 집중적으로 출하할 계획이다.농식품부는 또 농업인의 소득 안정을 위해 통상 11월 지급하던 농업직불금을 추석 전 조기 지급할 계획이다. 폭염·태풍·호우 등 자연재해로 피해를 본 농가에는 재해보험금과 재해복구비 지급도 신속히 진행한다. 농협은 낙과 및 햇볕 데임 과수 등 폭염 피해 농산물 팔아주기 특판행사 등도 연다. 이와 함께 과일 및 축산물에 대해서는 선물세트 공급을 지난해보다 40% 늘린다. 소비자 부담을 줄이기 위해 성수품 직거래 장터, 로컬푸드 직매장 등의 오프라인 장터 개설도 전년보다 150여곳 늘어난 2686개소로 확대 운영한다.이정우 기자 woolee@segye.com ▶ [이벤트] 세계일보 채널 설정하면 경품이~!!ⓒ 세상을 보는 눈, 글로벌 미디어 세계일보"
