,날짜,기사제목,기사내용
0,2018.09.29. 오전 8:19,"""추석도 지났는데 내릴 생각을 안하네""…한우·한돈 가격 '고공행진'(종합)","한국농촌경제연구원 농업관측본부 10월 한우·돼지고기 가격 전년 대비 상승 전망[아시아경제 심나영 기자]지난주 추석 차례상을 차리러  마트에서 한우 국거리를 사려다 가격을 보고 다시 제품 매대에 내려놓았던 주부들이 앞으로도 소고기 사기는 힘들 것으로 예상된다. 추석 이후에도 고기값은 계속 고공행진 할 전망이기 때문이다. 한우와 돼지고기의 10~11월 도매 가격은 모두 전년 대비 오를 것으로 추정된다. 닭고기만 지난해 가격에 머무를 것으로 보인다.29일 한국농촌경제연구원 농업관측본부가 발표한 한육우 관측월보에 따르면 10∼11월 한우 1등급 도매가격은 10월 이후 도축 마릿수 감소가 예상되어 전년 동기보다 올라갈 전망이다. 보고서는 ""추석 성수기(추석 2주전) 추석 주 한우 도매가격은 도축 마릿수 감소로 전년 동기보다 3.4% 상승했다""며 ""9월(1~20일)한우 1등급(지육 기준) 도매가격은 지난해보다 4.0% 올라간 1만8796원을 기록했다""고 밝혔다.2~3등급 도매가격도 지난해보다 올랐다. 9월(1~20일) 지육 kg 당 한우 2~3등급 도매가격은 각각 1만5448원, 1만1956원으로 작년 같은 기간보다 5~6% 상승했다. 한우 도매가격 강세로 전년보다 쇠고기 수입량은 증가했다. 1~8월 쇠고기 수입량은 전년 같은 기간보다 20.9% 증가한 27만2000t으로 집계됐다.10월 돼지 가격도 전년보다 상승할 전망이다. 10월 돼지 도매가격은 돼지고기 생산량이 전년보다 다소 증가함에도 kg당 전년대비 상승한 4000원∼4300원으로 전망된다. 보고서는 가격 상승 원인에 대해 ""육가공업체들이 9월에 폭염으로 인한 증체 지연으로 충분한 물량을 확보하지 못했기 때문에 원료육 구매를 확대하려 하기 때문""이라고 분석했다.다만 9월 돼지 총 사육 마릿수는 모돈 수가 전년(105만 마리)보다 1.3∼3.3% 많을 것으로 예상된다. 이에 따라 자돈 생산도 늘어 전년 동월보다 0.1∼1.9% 증가한 1150만∼1170만 마리 추정된다. 10월 일평균 등급판정 마릿수는 돼지 사육 마릿수 증가로 전년 동기간보다 조금 많은 7만 6500∼7만 7500마리로  전망된다. 육계 가격은 전년과 비슷한 kg당 1400~1500원으로 전망된다. 10월 전체 도계 마릿수는 추석으로 작업일수가 줄었던 전년보다 증가했다. 일평균 도계 마릿수는 폭염 여파로 생산성 저하되어 전년 수준으로 전망된다. 보고서는 ""도계 마릿수가 전년과 비슷할 것으로 예상돼 10월 육계 산지가격 전년 수준인 kg당 1400∼1500원 수준일 것""이라며 ""4분기 병아리 생산량 작년보다 증가하고 이에 따라 도계가 증가할 것으로 예상돼 11~12월 육계 산지가격 전년보다 낮을 것""이라고 예상했다.심나영 기자 sny@asiae.co.kr▶ 네이버 홈에서 '아시아경제' 뉴스 확인하기▶ 재미와 신기 '과학을읽다' ▶ 놀라운 '군사이야기'<ⓒ세계를 보는 창 경제를 보는 눈, 아시아경제 무단전재 배포금지>		"
1,2018.09.05. 오전 3:10,"BHC 점주들 ""닭고기 값·광고비 공개하라"" 집회","			치킨 프랜차이즈 BHC 점주들이 닭고기 가격과 광고비 등을 투명하게 공개할 것을 본사에 촉구하는 집회를 열었다. 지난 5월 국회 앞에서 공정거래위원회의 재조사를 요구한 것을 시작으로 4번째 집회다. BHC 점주들로 이뤄진 '전국 BHC 가맹점 협의회'(이하 협의회) 회원 300여 명은 이날 서울 송파구 BHC 본사 앞에 모여 ""광고비 명목으로 닭 한 마리당 걷어간 400원, 해바라기 오일 공급 가격의 진실 등 가맹점주들이 피땀 흘려 번 돈으로 구입하는 본사 상품 가격에 대해 풀리지 않는 의문이 너무나 많다""고 주장했다.본사가 2015년 10월부터 2016년 12월까지 신선육 한 마리당 광고비 명목으로 400원씩 가맹점주로부터 가져갔고, 지난해 1월부터는 신선육 가격에 포함하는 방법으로 광고비 400원을 받아갔다는 것이다. 이들은 ""광고비가 아니라 '가공비'였다면 원가 인상 내역에 대해 정상적으로 설명하고 받아가면 되는데, 복잡한 과정을 거쳐 광고비로 받아간 이유가 이해되지 않는다""며 광고비로 가져간 금액의 사용 내역과 잔액 명세를 공개하라고 요구했다. 또 본사가 공급하는 '고올레산 해바라기 오일' 마진도 공개할 것을 요청했다. 협의회는 앞서 지난달 28일 광고비 횡령과 해바라기 오일 납품가 일부 편취 등을 이유로 검찰에 본사를 고발했다.BHC 본사는 ""지난해 공정위 조사를 통해 문제가 없다고 확인된 사항""이라며 ""소통을 활성화해 상생할 수 있도록 노력하겠다""고 밝혔다.[채성진 기자 dudmie@chosun.com] 	[조선닷컴 바로가기][조선일보 구독신청하기] - Copyrights ⓒ 조선일보 & chosun.com, 무단 전재 및 재배포 금지 -		"
2,2018.09.02. 오후 6:14,추석 성수품 10개 중 7개 가격 급등,"무, 사과, 소고기... 정부 ""공급 늘려 수급 안정""폭염, 집중 호우 등으로 추석 먹거리 물가가 크게 오른 것으로 나타났다. 정부는 무, 사과 등 가격이 급등한 품목의 시중 공급 물량을 늘려 수급 안정을 도모하기로 했다. 농림축산식품부는 2일 이 같은 내용이 담긴 ‘추석 성수품 수급안정대책’을 발표했다. 당국은 올해 봄철 이상저온, 폭염 장기화, 태풍과 집중호우 등 기상 여건 악화로 인해 농산물 수급이 불안정한 점을 감안, 추석 2주 전부터 실시하던 대책을 1주일 앞당겨 3일부터 시행하기로 했다. 농식품부에 따르면 추석을 앞두고 수요가 급증하는 성수품 10개 품목 중 7개 품목(배추 무 사과 배 소고기 닭고기 밤)의 8월 하순 기준 가격이 평년보다 상승한 것으로 나타났다. 농산물 중에서는 무 도매가격이 개당 2,782원으로 평년보다 91% 올랐다. 사과(아오리)는 10㎏당 4만2,123원으로 66% 상승했다. 무는 7~8월 폭염과 집중 호우로 뿌리가 썩는 무름병 증상이 확산돼 공급량이 부족할 전망이다. 사과 역시 수확기를 앞두고 과일 표면이 햇볕에 데는 현상이 발생해 상품성이 좋은 물건이 예년에 비해 모자란 상황이다.축산물은 돼지고기, 계란 등은 안정세지만 소고기와 닭고기 가격은 강세를 보이고 있다. 소고기 도매가격은 ㎏당 1만8,087원으로 평년 대비 8% 상승했다. 닭고기는 ㎏당 3,342원으로 10% 올랐다. 폭염 영향으로 폐사가 속출한 영향이다. 밤 산지가격도 ㎏당 3,450원으로 39% 올랐다. 밤, 대추 등 임산물은 2017년산 저장 물량이 출하되고 있는데 지난해 가뭄으로 밤 생산량이 많지 않았다. 햇밤과 햇대추 역시 봄철 이상저온과 폭염으로 공급이 부족할 것으로 보여 임산물 가격은 계속 강세를 보일 전망이다.정부는 수급 안정을 위해 3일부터 21일까지 총 17일 간 정부 및 농협의 비축 물량이나 계약재배 물량을 활용해 시장 공급 물량을 크게 늘릴 계획이다. 지난해 추석 당시 공급한 물량보다 51% 많은 12만3,279톤을 방출한다. 특히 무, 사과는 평상시 하루 공급량보다 각각 2배가량 많은 물량을 풀어 가격을 안정시키기로 했다. 세종=이현주 기자 memory@hankookilbo.com▶한국일보 [페이스북] [카카오 친구맺기]▶네이버 채널에서 한국일보를 구독하세요![ⓒ 한국일보(hankookilbo.com), 무단 전재 및 재배포 금지]		"
3,2018.09.04. 오후 12:44,"[사진in세상] BHC 가맹점주 ""악마 같은 외국자본 끝까지 밝힌다""","전국BHC가맹점협의회 점주들이 4일 오전 서울 송파구 BHC 본사 앞에서 집회를 갖고 닭고기 가격과 광고비 등을 투명하게 공개하라고 본사 측에 촉구하고 있다.치킨 프랜차이즈 BHC의 점주들은 4일 오전 서울 송파구 BHC 본사 앞에 모여 닭고기 가격과 광고비 등을 투명하게 공개하라고 본사 측에 촉구했다.점주들로 이뤄진 전국 BHC 가맹점 협의회(이하 협의회)는 ""우리 가맹점주들은 광고비 명목으로 걷어간 400만원이나 해바라기 오일 공급 가격의 진실 등 우리가 피땀 흘려 번 돈으로 구입하는 본사 상품들의 가격에 대해 풀리지 않는 의문이 너무나 많다""며 ""이제라도 가맹점 사장들의 목소리에 관심을 가져 달라""고 목소리를 높였다.전국BHC가맹점협의회 점주들이 4일 오전 서울 송파구 BHC 본사 앞에서 집회를 열고 있다.전국BHC가맹점협의회 점주들이 4일 오전 서울 송파구 BHC 본사 앞에서 집회를 갖고 닭고기 가격과 광고비 등을 투명하게 공개하라고 촉구하고 있다. 협의회는 또 ""본사는 2015년 10월부터 2016년 12월까지 신선육 1마리당 광고비 명목의 400원을 가맹점주로부터 가져갔고, 지난해 1월부터는 신선육 가격에 포함하는 방법으로 광고비 400원을 가져갔다""며 ""광고비가 아니라 '가공비'였다면 정상적으로 신선육 원가 인상 내용에 대해 정확히 설명하고 받아가면 될 것인데, 복잡한 과정을 거쳐 광고비로 받아간 이유가 이해가 가지 않는다""고 지적했다. 이어 ""언제 전체 가맹점이 확인할 수 없는 400원을 받아가는 데 대해 동의했는지도 모르겠다""고 사측을 압박했다.전국BHC가맹점협의회 점주들이 4일 오전 서울 송파구 BHC 본사 앞에서 피켓을 든 채 집회에 참여하고 있다.전국BHC가맹점협의회 점주들이 4일 오전 서울 송파구 BHC 본사 앞에 집회를 갖고 닭고기 가격과 광고비 등을 투명하게 공개하라고 본사 측에 촉구했다. 한 참가자가 '악마 같은 외국자본! BHC 각성해라!'고 적힌 피켓을 들고 있다.  전국BHC가맹점협의회 점주들이 4일 오전 서울 송파구 BHC 본사 앞에서 집회를 갖고 닭고기 가격과 광고비 등을 투명하게 공개하라고 본사 측에 촉구했다. 한 참가자가 '광고비 착취 그만. 오일 폭리 그만!'이라고 적힌 피켓을 들고 있다. 협의회 측은 광고비로 가져간 금액의 사용 내역과 남은 잔액 명세를 공개하라고 요구했다. 그러면서 ""고올레산 해바라기 오일의 마진이 얼마인지 공개하라""며 ""수익성 악화에 시달리는 가맹점이 공급 원가 인하를 요청할 때 아무것도 본사가 양보하지 못할 만큼 본사 측의 마진이 적은 것이냐""라고 반문했다.전국BHC가맹점협의회 점주들이 4일 오전 서울 송파구 BHC 본사 앞에서 집회를 갖고 닭고기 가격과 광고비 등을 투명하게 공개하라고 본사 측에 촉구했다. 한 참가자가 '사모펀드 폭리금지! 인간답게 살아보자!'라고 적힌 피켓을 들고 있다. 전국BHC가맹점협의회 점주들이 4일 오전 서울 송파구 BHC 본사 앞에서 집회를 갖고 닭고기 가격과 광고비 등을 투명하게 공개하라고 본사 측에 촉구했다. 한 참가자가 '언론에선 기부왕! 가맹점에겐 착취왕!'이라고 적힌 피켓을 들고 있다. 전국BHC가맹점협의회 점주들이 4일 오전 서울 송파구 BHC 본사 앞에서 집회를 갖고 닭고기 가격과 광고비 등을 투명하게 공개해야 한다고 강하게 요구하고 있다. 협의회는 이 밖에도 본사와 가맹점의 협의를 거쳐 마케팅위원회를 구성할 것, 본사 측과 지속해서 대화를 이어나갈 장치를 마련해달라고 요구했다.본사는 이에 대해 ""지난해 공정거래위원회의 조사를 통해 문제가 없음이 확인된 사항""이라는 입장인 것으로 전해졌다.김경호 기자 stillcut@segye.com ▶ [이벤트] 세계일보 채널 설정하면 경품이~!!ⓒ 세상을 보는 눈, 글로벌 미디어 세계일보"
4,2018.09.21. 오후 9:31,8월 농축산물 가격급등…추석앞두고 안정세 전환,"			8월 농축산물 가격급등…추석앞두고 안정세 전환[뉴스리뷰][앵커]이상 고온현상과 태풍 등으로 지난달 농축산물 작황이 크게 악화했는데요. 정부의 수급대책도 8월 생산자물가는 농축산물을 중심으로 크게 올랐습니다. 다만 작황 개선으로 추석 직전인 9월 중순부터 물가가 안정세를 보이고 있습니다. 소재형 기자입니다. [기자]한국은행이 발표한 지난달 생산자물가지수는 105.43. 2014년 8월 이후 가장 높은 수준입니다.유례없는 폭염과 태풍으로 급등한 농수산물 가격이 생산자물가지수 상승을 이끌었습니다.특히 농산물은 7월보다 18.3% 상승했는데 시금치는 222.9%, 배추는 91%나 오르며 물가를 위협했습니다.축산물도 달걀가격이 35.7% 뛰었고 닭고기도 15% 넘게 올랐습니다.정부가 8월 한달간 배추 비축물량 3,488톤을 내놓고 무 3,400여톤을 조기 출하했지만 뛰는 농산물 가격을 잡기에는 역부족이었습니다.다만 9월달 농수산물 물가는 8월보다는 떨어진 것으로 나타났습니다. 정부는 8월말 농산물 수급 대책에 더해 추석을 대비해 농축산물 비축물량을 품목별로 평소보다 최대 193% 더 공급했습니다.실제로 사과 등 10대 성수품의 가격을 조사한 결과 지난 9월 18일을 기준으로 3주 전에 비해 평균가격이 7% 떨어졌습니다.<농림축산식품부 관계자> ""(8월 생산자물가가) 8월 데이터를 바탕으로 했기 때문에 9월의 추세는 반영되지 않은 것으로 보여지고 9월에는 8월 대비해서 추석 직전에 농산물 가격이 하락해서…""정부는 추석 이후에는 작황이 더 좋아지고 수급대책의 효과가 본격적으로 나타나면서 9월 생산자물가가 안정세를 보일 것으로 전망했습니다.연합뉴스TV 소재형입니다. 연합뉴스TV 기사문의 및 제보 : 카톡/라인 jebo23 ▶ 연합뉴스TV 네이버 채널 구독   ▶ 생방송 시청 ▶ 대한민국 뉴스의 시작, 연합뉴스TV 앱 다운받기"
5,2018.09.04. 오후 1:48,"BHC 점주들, 광고비·오일 가격 공개 요구","			치킨 프랜차이즈 BHC 점주들이 본사를 향해 원재료 가격과 광고비를 공개하라고 요구했습니다.'전국 BHC 가맹점 협의회'는 서울 송파구 BHC 본사 앞에서 기자회견을 열어 본사가 제대로 된 설명도 없이 닭고기 가격에 광고비를 포함해 돈을 받아가고는 집행 내역도 공개하지 않는다며 이같이 촉구했습니다.협의회는 이어, 필수 구매품인 해바라기 오일 가격 역시 지나치게 높다면서, 가맹점과 본사가 함께 마케팅 위원회를 구성하자고 제안했습니다.BHC는 이에 대해 공정거래위원회 조사를 통해 문제가 없다고 확인된 사항이라며, 점주들과 좀 더 소통하겠다고 밝혔습니다.▶ 24시간 실시간 뉴스 생방송 보기   ▶ 네이버 메인에서 YTN을 구독해주세요[저작권자(c) YTN & YTN PLUS 무단전재 및 재배포 금지]		"
6,2018.09.21. 오전 8:15,시금치 가격 223% 급등…생산자물가 4년 만에 최고,"			폭염에 농산물 가격이 뛰면서 지난달 생산자물가지수가 4년 만에 최고 수준으로 치솟았다. 생산자물가는 시차를 두고 소비자물가에 반영된다.한국은행이 21일 발표한 ‘2018년 8월 생산자물가지수’에 따르면 지난달 생산자물가지수는 105.43으로 전월대비 0.5% 올랐다. 이는 2014년 8월(105.57) 이후 4년 만에 최고다.이례적인 폭염에 작황이 좋지 않아 농산물 가격이 큰 폭으로 올랐다. 농림수산품 생산자물가는 전달보다 8.7% 뛰었다. 농산물 가격 상승폭이 18.3%로 컸는데, 이는 2010년 9월(18.8%) 이후 상승폭이 가장 큰 것이었다.시금치 가격이 222.9% 치솟았고, 배추 91.0%, 수박 50.4%, 무 29.1% 가격도 큰 폭으로 올랐다. 축산물 생산자물가는 3.5% 올랐다. 여름철 수요가 많은 닭고기 가격이 15.4% 상승했고 달걀 역시 35.7% 올랐다.공산품은 화학제품을 중심으로 0.1% 상승했고 전력·가스·수도도 0.1% 올랐다. 서비스물가는 음식점 및 숙박 등의 상승세로 0.1% 올랐다.수입품까지 포함해 상품, 서비스 가격 변동을 측정한 국내공급물가지수는 102.16으로 0.1% 올랐다. 국내 생산품의 전반적인 가격을 볼 수 있는 총산출물물가지수(출하에 수출품을 더한 것)는 101.53으로 0.3% 상승했다.[연선옥 기자 actor@chosunbiz.com]chosunbiz.com"
7,2018.09.06. 오전 11:51," [단독] 공정위, ‘가맹점에 광고비 전가 혐의’ BHC 현장조사  ","			 [한겨레] 5일부터 이틀째…가맹점에 광고비 부당전가 혐의2015년 이후 마리당 400원씩 광고비 받으면서정보공개서에는 “본사가 전액 부담” 거짓 등록 가맹점협의회 “집행내역 통보 등 의무도 법위반” 치킨 가맹본부인 비에이치씨(BHC)의 가맹점주 모임인 가맹점협의회가 지난 8월28일 서울 서초동 검찰청사 앞에서 본사의 광고비 부당전가 혐의 등을 규탄하는 기자회견을 갖고 있다. 신소영 기자  공정거래위원회(위원장 김상조)가 광고비를 가맹점에 부당하게 전가한 혐의를 받는 치킨 가맹본부인 비에이치씨(BHC)에 대해 현장조사에 착수했다.  6일 공정위와 BHC을 말을 종합하면, 공정위는 지난 5일부터 서울 송파구 신천동 BHC 본사에 본부 가맹거래과 조사관들을 투입해 직권조사를 벌이고 있다. 공정위는 6일에도 조사를 계속 진행 중이다. BHC 본사는 2015년 10월부터 2016년 12월까지 가맹점주들에게 광고비를 닭고기 마리당 400원씩 별도로 받고, 2017년 1월부터 현재까지는 닭고기 가격에 합산에서 받고 있으면서, 공정위에 등록한 ‘정보공개서’에서는 “상품광고비는 모두 본사가 부담하고, 가맹점 부담은 없다”며 거짓 기재한 혐의를 받고 있다. BHC는 언론과 인터뷰에서도 “텔레비전·신문 등의 광고비용을 전액 본사가 부담한다”고 밝혀왔다.   가맹사업법은 가맹점주 보호를 위해 가맹본부로 하여금 매출·이익 등 경영실적, 가맹점주 부담 등이 담긴 정보공개서를 공정위에 등록하고, 공정위는 이를 투명하게 공개하도록 의무화하고 있다. 또 정보공개서에 거짓이 있으면 공정위가 등록을 거부·취소하거나 관련 매출액의 최대 2%까지 과징금을 부과할 수 있다.   공정위 관계자는 “BHC 본사가 2017년부터 가맹점주들에게 형식상 광고비를 받지 않는 것처럼 하면서, 실제로는 신선육 가격에 포함해 받았는지 여부와 공정위에 등록한 정보공개서에서 본사가 전액 부담하고 있다고 밝힌 게 사실인지 여부 등을 중점 조사하는 것으로 안다”고 말했다. BHC 본사는 “공정위가 요청한 광고비 관련자료를 제출했고, 조사가 끝날 때까지 최대한 성실하게 협조할 것”이라고 밝혔다.  가맹점주들이 권익보호를 위해 설립한 BHC 가맹점협의회는 그동안 공정위에 본사의 광고비 부당전가 혐의를 조사해달라고 수차례 요청하고 증거자료까지 제시했으나 공정위가 뒷짐만 지고 있다고 주장해왔다. 협의회의 진정호 회장(울산 옥동점 대표)은 “본사가 2016년 12월29일 가맹점주에게 공지사항을 보내 ‘그동안 신선육 가격은 ‘신선육(시세적용)+광고비(400원)’로 (분리) 산정해서 계산했는데, 2017년부터는 신선육 가격으로 일원화하기로 했다. 형식상 광고비 항목이 빠지지만 광고비를 줄이는 것은 아니고 예전과 동일하게 시행한다’고 밝힌 증거까지 확보돼 있다”고 밝혔다. 협의회는 BHC 본사가 가맹점주에 전가한 광고비 규모를 204억원으로 제시하고 있다.  또 BHC 본사는 가맹점주가 부담하는 광고비는 가맹점주에 집행내역을 통보하고, 요청이 있으면 열람할 수 있도록 돼있는 가맹거래법도 위반한 혐의를 받고 있다. 협의회는 “본사가 광고비 지출내역 공개를 거부하는 것을 보면 광고비를 제대로 안쓰고 횡령한 혐의도 제기된다”고 주장했다. 협의회는 최근 BHC를 광고비 횡령 혐의로 검찰에 고발했다. 곽정수 선임기자 jskwak@hani.co.kr◎ Weconomy 홈페이지 바로가기: http://www.hani.co.kr/arti/economy◎ Weconomy 페이스북 바로가기: https://www.facebook.com/econohani  ▶ 한겨레 절친이 되어 주세요! [오늘의 추천 뉴스] [▶ 블록체인 미디어 : 코인데스크] [신문구독][ⓒ한겨레신문 : 무단전재 및 재배포 금지]"
