,날짜,기사제목,기사내용
121,2018.09.18. 오후 3:52,추석 차례상 준비 전통시장이 대형마트보다 7만원 저렴,"			소상공인시장진흥공단이 지난달 28일부터 6일까지 전국 전통시장(37곳)과 대형마트(37)를 대상으로 추석 제수용품 27개 품목에 대한 가격비교조사를 벌인 결과 전통시장이 대형마트보다 약 7만원 저렴했다고 18일 밝혔다.올해 추석 차례상을 차리는 데 드는 비용(4인 기준)은 전통시장이 평균 23만3164원이었고 대형마트는 31만252원이었다. 전통시장이 6만6638원(21.5%) 저렴한 셈이다.닭고기·고사리 등 전체 27개 조사품목 중 23개 품목에서 전통시장이 대형마트보다 가격 우위를 보였다. 특히 채소(43.8%)와 육류(23.0%), 수산물(20.7%) 등의 가격차이가 컸다.추석 제수용품 중 가격비중이 높은 쇠고기와 돼지고기도 전통시장이 대형마트보다 저렴했다. 전통시장의 쇠고기 평균 가격은 탕국용(600g) 2만5803원, 산적용(1kg) 4만1773원 등으로 대형마트 3만7304원, 5만2103원보다 각각 30.8%, 19.8% 가격이 낮았다. 돼지고기 평균 가격도 다짐육(600g) 6993원, 수육용(1kg) 2만771원 등으로 대형마트 9448원, 2만5842원에 비해 각각 26%, 19.6% 저렴했다.한편 지난해 추석 제수용품 가격과 비교해 전통시장(7.2%)과 대형마트(4.6%) 모두 가격이 오른 것으로 조사됐다. 공단은 “봄철 이상저온 현상과 여름철 폭염과 국지성 폭우가 영향을 준 것은 물론 지난해보다 10일 이른 추석으로 채소와 과일 생산·출하량이 감소했기 때문”이라고 설명했다.공단은 서민물가 안정을 위해 전통시장온누리상품권의 개인할인(5%) 금액을 늘리고 다음 달 31일까지 월 구매한도를 30만원에서 50만원으로 확대했다.손재호 기자 sayho@kmib.co.kr[네이버 메인에서 채널 구독하기] [페이스북][취재대행소 왱!(클릭)]GoodNews paper ⓒ 국민일보(www.kmib.co.kr), 무단전재 및 재배포금지		"
122,2018.09.18. 오후 3:19,"""한우 바이어도 한우 못 산 적 처음""…혀 내두른 추석 한우값(종합)","대형마트 한우 바이어, 비싼 한우 가격에 축산물 공판장에서 빈 손으로 돌아와""요즘 같은 도매 시세로 한우 사면 남는 것이 팔아야""일부 제품은 소비자 가격 상승…대형마트 일반 한우 판매 20% 급감[아시아경제 심나영 기자] 한 대형마트 한우 바이어 이 모씨는 지난주 충청북도 음성축산물 공판장에서 추석 판매 물량 경매에 참여했다가 너무 비싼 가격에 혀를 내두르며 결국 빈손으로 돌아섰다. 2012년 직접 경매로 한우 매입해 온 이래 처음 벌어진 일이었다. 이 바이어는 ""요즘 같은 도매 시세대로 한우를 사면 남는 것 없이 팔수 밖에 없다""며 ""작년 추석 까지만 해도 공판장에서 거래되는 소 한마리 가격이 평균 730만~740만원선이었는데 올해 추석 때에는 800만원 이상으로 훌쩍 뛰었다""고 털어놨다.추석을 앞두고 한우 가격이 사상 최고 수준까지 치솟았다. 한우 도매 가격도 천정부지로 뛰며 이번주 부터 제수 음식 재료 판매를 본격적으로 시작한 대형마트의 한우 물량 수급에도 비상등이 켜졌다. 한우 도매가격 상승 여파가 소비자 가격에도 영향을 미치자 이달 들어 한우 판매량도 급감하는 분위기다.18일 한국농촌경제연구원에 따르면 추석 2주전 한우 도축 마릿수는 전년보다 4.4% 감소한 4만7000마리로 전망된다. 도축 마릿수 감소로 공급량이 줄어들면서 수요가 많은 추석 대목을 앞두고 한우 가격도 덩달아 급등했다. 축산물품질평가원이 발표한 한우 유통가격동향에 따르면 추석 당일 2주전 1등급 지육(도살 후 머리ㆍ내장ㆍ족을 잘라 내고 각을 뜨기 전 상태의 고기) 1kg 당 평균 가격은 1만19109원이다. 지난해 추석 전 같은 기간 (1만8152원) 대비 5.2% 올랐다. 지난해 설 전(1만5145원)에 비해선 26% 급등했다. 17일 한우 등심 도매 가격도 kg당 5만8740원으로 이달 3일 5만5469원에 거래가 시작된 이후 하루가 다르게 오르는 추세다.대형마트에서 판매하는 일부 한우 제품 소비자 가격도 상승했다. 한 대형마트에서 판매하는 한우 국거리 1등급 100g 가격은 지난해 추석 연휴 1주전 4590원이었지만, 올해 추석을 앞둔 현재 5000원으로 올랐다. 도매 가격이 올랐음에도 횡성한우 1++갈비 세트와 명품 한우 냉장세트 가격 등 대다수 선물세트 가격은 판매 유지를 위해 동결했지만, 한우 갈비 1+ 등급세트와 한우 1호세트 가격 같이  8~12% 올린 품목도 있다.대형마트 관계자는 ""도매 가격 상승 부담을 마트가 마진을 줄여가며 떠안고 있는 처지""라며 ""그런데도 한우는 돼지고기나 닭고기보다 워낙 단가가 높아 조금만 올라도 소비자들은 급격히 오른 것처럼 느낀다""고 설명했다. 선물 세트 외에 소비자들의 한우 소비는 급격히 줄어드는 분위기다. 추석 연휴 2주전 한우 매출액은 지난해 추석 2주전 대비 20% 이상 감소했다. 반면 농ㆍ축ㆍ 수산물의 선물 한도를 10만원으로 높인  '부정청탁 및 금품 등 수수의 금지에 관한 법'(청탁금지법) 개정 이후 선물세트 판매량은 훌쩍 뛰면서 한우 소비에도 양극화가 나타났다. 지난달 2일부터 이달 12일까지 이어진 이마트 추석 한우 선물세트 사전예약판매 매출신장률은 지난해 사전예약판매 기간 대비 18.4% 늘어났다. 롯데마트의 한우 선물세트도 추석 선물세트 본판매 기간인 이달 13일부터 17일까지 전년 본판매 기간 대비 40.7% 신장했다.심나영 기자 sny@asiae.co.kr▶ 네이버 홈에서 '아시아경제' 뉴스 확인하기▶ 재미와 신기 '과학을읽다' ▶ 놀라운 '군사이야기'<ⓒ세계를 보는 창 경제를 보는 눈, 아시아경제 무단전재 배포금지>		"
124,2018.09.18. 오전 11:53,이머커스vs대형마트vs전통시장 차례 상차림 얼마들까? ,"추석 차례 상차림 31개 품목 비교대형마트 19만6218원-전통시장 17만1569원이커머스, 14만2307원 '가장 저렴'【파주=뉴시스】박주성 기자 = 추석을 앞둔 16일 오후 경기도 파주시 금촌통일시장에 시민들이 제수음식 재료를 구입하고 있다. 2018.09.16. park7691@newsis.com【서울=뉴시스】표주연 기자 = 추석 차례 상차림 준비가 가까워지고 있다. 올해 추석 상차림 비용은 20만원 내외가 들어갈 것으로 보이는 가운데, 이커머스, 전통시장, 대형마트 순으로 상차림 비용이 저렴한 것으로 조사됐다. 18일 업계와 서울시농수산식품공사에 따르면 제수용품 31개 기준 올해 상차림 비용은 대형마트가 19만6218원으로 집계됐다. 전년보다 -2.7%하락한 가격이다.  전통시장의 경우 17만1569원으로 조사됐다.  지난해와 비교해보면 대형마트의 경우 17개 품목이 평균 19% 인상됐고, 19개 품목이 평균 20% 인하되면서 지난해(22만9479원보다 2.7% 내려갔다. 대형마트에서 전년 대비 가장 많이 인상된 품목은 최근 가격이 크게 오른 시금치 47%, 두부 41%, 대파 31%, 배와 곶감, 북어포가 각각 28% 등이다. 가장 많이 내린 품목은 달걀 -65%, 송편 -43%, 밤(생율) -40%, 애호박 -32%, 소고기(산적용) -26% 등으로 조사됐다. 전통시장의 경우 19개 품목이 평균 17%인상됐지만 대형마트보다는 저렴했다.  전통시장에서 가장 많이 오른 품목도 시금치(63%)였으며, 가장 많이 내린 품목은 애호박(-49%)이었다. 이커머스 업체 중 슈퍼마트를 운영하는 티몬의 경우 14만2307원으로 조사됐다. 슈퍼마트에서 판매하지 않는 청주, 삶은 고사리, 깐 도라지, 부세조기, 동태(탕용) 등 5개 상품을 제외한 31개 품목 기준 가격이다. 이는 동일 품목 기준 대형마트 19만6218원보다 -27% 저렴했고, 전통시장 17만1569원보다는 -17% 더 싼 가격이다. 가격 비교 대상이 된 품목은 사과, 배, 곶감, 대추, 밤(생율), 삶은고사리, 깐도라지, 시금치, 부세조기(수입산), 동태(탕용), 동태살(전용), 오징어, 다시마, 북어포, 쇠고기국내(국거리), 쇠고기국내 산적용, 돼지고기국내(전용), 닭고기 육계, 달걀, 가래떡, 쌀, (깐)녹두, 무, 알배기배추, 대파, 애호박, 밀가루, 두부, 소면,부침가루, 맛살(꼬치용), 다식, 약과, 청주, 식혜, 찹쌀산자다. 서울시농수산식품공사 12일 발표자료를 기준으로 각 품목별로 용량과 단위를 같은 조건에서 비교했다. 차례 상에 많이 쓰이는 청주, 삶은 고사리, 깐 도라지, 부세조기, 동태(탕용)은 슈퍼마트에서 판매하지 않아 비교 대상에서 제외했다. pyo000@newsis.com▶ 뉴시스 빅데이터 MSI 주가시세표 바로가기 ▶ 뉴시스 SNS [페이스북] [트위터]<저작권자ⓒ 공감언론 뉴시스통신사. 무단전재-재배포 금지.>"
127,2018.09.15. 오전 11:46,"물가는 오르고 소득은 줄고…""추석, 부담스러워""","			[아시아경제 김민영 기자] 폭염, 집중호우 등의 영향으로 밥상물가가 치솟으면서 저소득층의 추석 준비가 한층 부담스러워질 전망이다. 소득은 줄고 있는데 야속한 물가만 고공행진 하고 있어서다. 정부는 추석을 앞두고 수급대책을 통해 물가 잡기에 나섰다. 15일 한국농수산식품유통공사(aT)에 따르면 전주대비 차례상 차림비용은 전통시장은 0.4% 하락한 23만1000원, 대형유통업체는 1.6% 하락한 32만4000원으로 나타났다.(12일기준.) 전국 19개 지역의 18개 전통시장과 27개 대형유통업체를 대상으로 추석 성수품 28개 품목을 조사한 결과다. 앞서 aT는 지난 5일 1차 조사 결과를 발표했었다.aT는 이달부터 배추, 무, 시금치 등 채소류 작황이 다소 호전돼 출하량이 늘었고 특히 배추, 무 등은 정부의 비출물량 공급 확대와 할인판매로 인해 가격이 내려갔다고 설명했다. 품목별로는 나물 재료인 시금치는 400g에 전통시장 6048원, 대형마트 1만656원으로 일주일 전보다 각각 9.5%, 30.9% 내렸다. 대형마트의 밤 가격도 7137원으로 일주일 전 9376원에서 23.9% 내렸다.하지만 aT가 발표한 차례상 차림비용과 실제 체감 비용과는 차이가 있다고 소비자들은 지적한다. 고공행진을 보이던 채소, 과일 등 일부 품목의 가격이 안정세를 보이고 있지만, 대부분의 추석 성수품 가격은 여전히 높은 가격대를 유지하고 있어서다.농촌경제연구원에 따르면 사과는 5kg짜리 상품 1상자당 3만5000∼3만8000원선으로 지난해에 비해 33% 높은 가격대를 유지할 것으로 전망된다. 배 가격은 7.5kg 짜리 상품 1상자당 2만7000∼3만원선에 이르는 등 전년보다 58% 높을 전망이다. 추석에 수요가 많은 단감 가격은 전년보다 무려 112% 상승할 것으로 예상됐다.채소의 경우 무 가격이 출하량 감소로 지난해보다 높은 20㎏당 2만4000원 안팎이 될 것으로 보인다. 반면 배추는 고랭지배추 출하량 증가에 힘입어 지난해보다 낮은 10㎏당 1만2000원에 거래될 것으로 연구원은 전망했다.햅쌀은 조생종 출하량 감소로 지난해보다 25% 높은 4만8000원선을 유지하고, 밤은 생산물 감소에 따른 재고물량 조기 소진으로 5~9% 상승한 1㎏당 7200~7600원선을 유지할 것으로 보인다.한우와 계란은 가격이 오를 것으로 전망된다. 한우 1등급(지육 1㎏)의 평균 도매 가격은 도축 마릿수 감소로 1만8500∼1만9500원, 계란(특란 10개)의 평균 산지 가격은 1350~1450원으로 예상된다. 이처럼 물가 상승으로 인해 추석 상차림 비용 부담은 커졌는데 저소득층의 주머니는 갈수록 얇아지고 있다. 올해 2분기 소득 1분위(소득 하위 20%) 가구 월평균 소득은 전년 동기 대비 7.6% 줄어든 것을 비롯해 2분위(하위 20~40%) 2.1%, 3분위(상위 40~60%)는 0.1% 감소했다.농림축산식품부는 추석 성수품 가격을 안정화하기 위해 지난 3일부터 추석 연휴가 시작하는 21일까지를 추석 성수품 수급 안정 대책기간으로 정하고 배추, 무, 사과, 배, 소고기, 돼지고기, 닭고기, 계란, 밤, 대추 10개 품목의 공급량을 평소보다 1.4배 늘리고 있다. 과일·축산물 선물세트도 특별 공급한다.김민영 기자 argus@asiae.co.kr▶ 네이버 홈에서 '아시아경제' 뉴스 확인하기▶ 재미와 신기 '과학을읽다' ▶ 놀라운 '군사이야기'<ⓒ세계를 보는 창 경제를 보는 눈, 아시아경제 무단전재 배포금지>		"
128,2018.09.17. 오전 11:20,올해 추석물가 너무 걱정하지 마세요!,"4인 기준 추석상 가격 작년보다 5천원 낮은 233,800원 수준 [광주CBS 임영호 기자]광주양동시장사상최악의 폭염과 늦은태풍, 예상치 못한 집중호우등으로 과일과 채소류 등의 가격이 급등하면서 올해 추석상 비용이 크게 늘어날 것으로 예상됐지만 실제 조사 결과는 작년추석보다 오히려 약 보합세를 보이고 있다.(사)한국물가정보(대표 노승권)에 따르면 재래시장과 대형마트의 차례상 품목 가격을 조사한 결과, 4인 가족 기준 차례 상 비용은 작년보다 5천원이 적은 233,800원이 될 것으로 나타났다.폭염과 가뭄에 이어 폭우까지 겹치면서 채소 류 생산이 감소하고 육류의 집단 폐사로 이들 품목의 가격이 큰 폭으로 올랐으나, 정부가 올 여름 기상 여건을 감안해 추석 성수품 출하량을 늘리고 농가의 출하량이 증가하면서 농축산물 수급은 안정될 것으로 예상되기 때문이다.올 추석에 가격이 가장 크게 오른 품목은 햅쌀과 시금치로 2㎏ 기준 햅쌀은 6000천원 시금치는 9,000원에 지난해보다 2,000원이 올랐다.쌀값 상승은 쌀을 원료로 하는 떡값 등에도 크게 영향을 미쳐 재래시장에서 판 매되는 송편과 시루떡은 작년보다 각각 3,000원, 2,000원 씩 오른 10,000원(1㎏ 기준)에 거래되고 있다. 채소류의 경우 올해 최악의 폭염으로 작황 상태가 좋지 못해 8월 중순까지는 지난해보다50%이상 가격이 올랐으나 9월로 접어들며 안정됐다. 사과와 배는 뒤늦은 태풍과 폭우로 인해 낙과율이 높아 가격이 폭등할 것으로 예상됐으나, 출하량에는 큰 차이가 없어 평년보다 소폭 상승한 선이 될 전망이다.수산물의 경우 국내산 참조기 어획량이 감소하고 해수 온도가 올라가면서 크기가 상품 기준에 못 미치는 작은 참 조기만 잡혀 올 추석상에 올릴만한 조기는 시장에서 찾아보기 힘든 실정이다. 그러나 중국산 부세조기가 그 틈새를 비집고 들어와 상품기준 상품기준(25㎝) 3마리 10,000원으로 지난해와 비슷한 가격에 판매되면서 부세조기의 판매가 급증했다.육류는 폭염으로 인한 닭 폐사로 닭고기 값은 올랐으나 소와 돼지는 사육두수가 증가한 때문에 전체적으로는 지난해보다 하락된 가격을 형성하고 있다.  이들 가격을 토대로 한국물가정보는 올해 추석상 비용을 재래시장의 경우 234,000원 정도로 예상하고 있다.대형마트는  재래시장보다 21% 많은 296,000원선이 될 것으로 보인다.한국물가정보는 나물류나 수산물, 육류 등 농수산물은 재래시장에서, 청주들을 비롯한 공산품은 할인마트에서 구매하는 것이 주부들의 알뜰한 상차림 팁이 될 것이라고 밝혔다.▶ 이시각 주요뉴스▶ 기자와 카톡 채팅하기▶ 노컷뉴스 영상 구독하기imboss@cbs.co.kr저작권자 © CBS 노컷뉴스 무단전재 및 재배포 금지		"
130,2018.09.10. 오전 11:11,[매경 100대 프랜차이즈 CEO 열전] (6) 권지훈 유가네닭갈비 대표 | 7초에 1인분씩…허기진 청춘들의 聖地,"			‘유가네닭갈비’로 유명한 바이올푸드글로벌의 역사는 지금으로부터 40년 가까이 거슬러 올라간다. 창업주인 권순용 회장이 1981년 경기 안양 1번가에서 대학생이 즐겨 찾는 닭갈비집 ‘보통집’을 운영한 게 시초다. 주머니가 가벼운 대학생들이 저렴하게 닭갈비에 소주 한잔을 곁들일 수 있는 가게로 입소문을 탔다. 인기에 힘입어 권순용 회장은 30대 후반에 고향(경남 산청) 인근이자 대학을 나온 부산에 다시 내려와 1995년 프랜차이즈 ‘유가네’를 선보였다. 서울에서는 닭갈비 전문점으로 유명하지만 사실 부산에서는 ‘밥집’으로 더 잘 알려졌다. 학생들이 점심 메뉴로 닭갈비 대신 닭고기를 다져 만든 철판볶음밥을 많이 찾는다. 닭야채철판볶음밥 2인분에 음료수 1병까지 해서 ‘만원의 행복’을 즐길 수 있어 가성비가 뛰어나다. 지난해 동안 전국 매장에서 팔린 철판볶음밥만 405만인분. 7초에 1인분씩 팔린 셈이다. 지금도 부산 지역에서는 전체 매출 30% 이상이 점심 메뉴인 철판볶음밥에서 나온다고. ‘가성비 좋은 밥집’ 전략 덕분에 주류 매출은 다소 부진하지만 경기에 상관없이 20년 이상 롱런해온 원동력이 됐다. 국내에서 가장 오래된 프랜차이즈 중 하나지만 업력에 비해 매장 수는 그리 많지 않다. 회장이 직접 가서 매장 입지와 상권을 보고 가맹점을 내줄 만큼 철저하고 신중한 출점전략 때문이다. 욕심내지 않는 탄탄한 성장을 인정받아 2015년부터 4년 연속 매경 100대 프랜차이즈에 선정됐다. 권순용 회장의 조카이자 6년째 바이올푸드글로벌을 이끌고 있는 권지훈 대표에게 성공 비결과 경영 계획을 물었다.  1973년생/ 한양대 광고홍보학과/ 중앙대 경영전문대학원 외식산업경영과정 수료/ 민족음악원 사무총장/ 2012년 바이올푸드글로벌 대표(현)/ 중소기업청 선정 우수 프랜차이즈/ 중소벤처기업부장관 표창  Q 오래도록 가성비 전략을 고수해왔는데 이유가 무엇인가요. A 회장님께서 처음 장사를 시작한 곳이 대학가 앞이에요. 주머니 사정이 뻔한 학생에게 양 많고 저렴한 메뉴를 제공하겠다고 결심하셨다네요. 배고프면 언제라도 더 밥을 줬고, 그런 서비스를 아까워하지 않았습니다. 때로는 지켜보던 사람들이 남는 게 없겠다며 장사 허투루 한다는 말까지 할 정도였죠. 고객이 배부르고 맛있고 ‘가성비 좋게’ 먹는다면 재방문 안 할 이유가 없다고 봅니다. 돈을 써서 홍보하는 것보다 입소문을 통해 알려지는 게 가장 좋은 홍보 방법이라 생각해요. 비싸고 맛있는 메뉴는 많아야 한 달에 한 번 먹지만, 맛있고 양 많고 저렴하면 매일도 먹으니까요. 장사는 서비스업이고 서비스는 고객을 편안하게 해주는 거예요. 가격이 비싸면 그만큼 기대치도 높아지지만 가격이 저렴하면 조금만 잘해줘도 기대 이상이 돼 만족도가 올라갑니다. Q 유가네닭갈비를 하면서 과거와 달라진 소비 트렌드가 있습니까.  A 유가네닭갈비는 10대 후반부터 20~30대 주머니 가벼운 젊은 고객층이 타깃이에요. 그동안은 고객 눈앞에서 직접 철판요리를 하는 모습을 보여주는 생동감 넘치는 쇼잉(showing)이 차별화 요소였어요. 대형 철판 위 주걱으로 닭갈비와 볶음밥을 볶는 모습에 고객이 열광했죠. 닭갈비를 현란하게 잘 볶는 알바가 TV ‘생활의 달인’ 프로그램에 소개되기도 했어요. 하지만 요즘 젊은 고객은 테이블에 앉아 조리하는 모습을 보지 않고 각자 스마트폰만 들여다봐요. 옷에 음식이 튀거나 냄새가 배는 것도 걱정하고요. 이 때문에 유가네닭갈비 신규 매장은 조리대를 잘 보이는 매장 입구에 설치해 철판요리하는 모습은 볼 수 있되 테이블에서는 완조리된 메뉴를 편안하게 먹을 수 있도록 인테리어를 바꾸고 있습니다. 반반닭갈비, 치즈퐁닭처럼 인스타그램 등 SNS에 사진을 올렸을 때 즉각 반응이 올 만한 화려한 비주얼의 메뉴도 적극 개발하고 있고요. 또 집에서도 유가네의 볶음밥, 닭갈비를 먹을 수 있게 HMR(가정간편식)을 개발, 온오프라인에서 모두 구매할 수 있게 했습니다.  Q 1인 가구 증가에 따른 변화도 보입니다. A 배달과 포장 시장이 활성화되고 있어요. 배달 매출이 월 2000만원을 넘어 전체 매출의 30~40%까지 나오는 가맹점도 있죠. 반면 매장 홀 규모는 줄이려 합니다. 서울 지역 신규 매장은 23~24평, 부산은 18평 규모로도 출점해보려 합니다. 출점 상권도 기존 A급 번화가 상권 위주에서 주택가 상권으로 확장 중이에요. 실제 부산에서 그렇게 출점해보니 반응이 좋더군요. B급 상권에서 배달과 포장을 병행하는 20평 안팎 소형 매장 전략을 적극 검토하고 있습니다.  Q ‘외가집(외식하기가장좋은집)’이라는 고깃집 프랜차이즈도 운영 중인데요. A 닭갈비 브랜드인 유가네 이외에 늘 새로운 콘셉트의 외식 공간을 만들어보고 싶었어요. ‘외가집’ 전에는 비빔밥 식당 ‘비비라’를, 또 참숯 화로에 갈매기살을 구워먹는 고깃집 ‘화로갈맥’을 선보였습니다. 다양한 고객 욕구와 식재료 특성을 파악하고 경험도 쌓기 위해서였죠. 최종적으로 한식의 대표 메뉴인 돼지갈비를 선택했습니다. 맛도 맛이지만 가장 편안하게 외식할 수 있는 공간이어야겠다 판단하고 2015년 외가집을 시작했습니다. 대부분 목살을 쓰는 다른 돼지갈비집과 달리 손수 포를 뜨고 칼집을 넣은 진짜 돼지갈비를 쓰는 게 특징입니다. 테이블에 화로도 없어요. 전문 셰프가 직접 구워주죠. 손님이 구워 먹는 재미도 물론 있지만 맛있게 구워주면 더 편하고 냄새도 안 나잖아요. 외가집은 유가네닭갈비처럼 ‘착한 가격’ 전략을 채택했습니다. 돼지갈비가 보통 150g에 1만1000원인 데 비해 외가집은 260g이 1만3000원에 불과해요. 1호 매장을 2년 반 시험 운영해보니 주말에는 하루에 보통 7~8회전, 최대 10회전까지 되더군요. 유가네닭갈비 점주들이 하나 더 하겠다고 해서 올해만 10여개 가맹점을 출점합니다. 상권에 따라 키즈존을 크게 넣거나 회식, 단독 공간을 넓게 구성할 계획입니다. Q 가맹점주와 상생 노력은 어떻게 하고 있습니까. A 프랜차이즈는 당연히 매장이 살아야 본사가 운영될 수 있습니다. 무분별한 본사 강제 구매 품목을 줄이고 마케팅, 홍보비 부담을 최소화하고 있어요. 2017~2018년 전속 모델 임시완 씨의 광고비도 100% 본사가 부담했어요. 또한 분기별 정기 점주회의를 통해 점주와의 소통에도 힘쓰고 있습니다. 가맹점에 공급하는 닭갈비 원재료 가격은 10년째 동결했고요. 그 덕분에 지난해 본사는 영업손실을 기록했습니다. 가격을 올리거나 가맹점을 늘리면 쉽게 흑자전환할 수 있겠지만 상생을 위해 자제하고 있습니다. 다소 늦더라도 오래가는 브랜드를 만들고 싶습니다. Q 향후 경영 계획을 말씀해주세요. A 유가네닭갈비가 30년을 넘으면서 매장 운영이 부모 세대에서 자녀에게로, 또 손자에게로 대물림되고 있습니다. 짧게 유행하고 지나쳐가는 브랜드가 아닌, 세대를 이어 전달되는 대표 한식 프랜차이즈로 자리매김하는 것이 목표입니다. 해외 진출도 활발하게 하고 있습니다. 동남아는 닭갈비가 아직 고급 한식 메뉴로 인식되고 있어요. 고유 브랜드 가치를 지키면서 나라별 현지화에 집중하고 있죠. 가령 훠궈 등 끓여 먹는 요리를 선호하는 싱가포르에는 한국의 물닭갈비(닭갈비 전골)나 닭볶음탕을 각색해 판매하는 식입니다. 홍콩은 닭갈비 메뉴를 중심으로 한 샐러드 뷔페로 진출하려 합니다. [노승욱 기자  inyeon@mk.co.kr / 사진 : 윤관식 기자] [본 기사는 매경이코노미 제1975호 (2018.09.12~09.18일자) 기사입니다] ▶뉴스 이상의 무궁무진한 프리미엄 읽을거리 ▶아나운서가 직접 읽어주는 오늘의 주요 뉴스[ⓒ 매일경제 & mk.co.kr, 무단전재 및 재배포 금지]		"
