,날짜,기사제목,기사내용
52,2018.06.01. 오전 9:09,쌀값 37년만에 '최고'…휘발유·경유 6~8%대 급등(종합),"5월 소비자 물가동향…소비자물가 8개월째 1%대국제유가 여파로 공업제품 올라2일 오후 서울의 한 대형마트에서 시민들이 장을 보고 있다.  2018.5.2/뉴스1 © News1 이승배 기자(세종=뉴스1) 이훈철 기자,박정환 기자 = 쌀값이 37년 만에 최고치로 급등하는 등 농산물 가격상승으로 밥상물가에 비상이 걸렸다. 반면 축산물, 전기·수도·가스 등의 가격 안정세가 겹쳐 전체 소비자물가는 8개월째 1%를 기록했다. 국제유가 상승으로 공업제품 가격도 덩달아 올랐다. 1일 통계청이 발표한 '2018년 5월 소비자 물가 동향'에 따르면 소비자물가지수는 전년 동월 대비 1.5% 상승했다. 소비자물가는 지난해 초부터 9월까지 2% 내외를 기록하다 10월 1.8%로 떨어진 후 8개월 연속 1%대에 머물렀다. 8개월 연속 1%대를 유지한 것은 2013년 11월(1.2%)~2014년 11월(1.0%)에 13개월을 지속한 이후로 가장 긴 기간이다. 김윤성 통계청 물가동향과장은 ""1%를 유지하는 것으로 봐서는 물가가 안정세라고 봐도 될 것 같다""고 분석했다. 하지만 세부적으로 보면 농산물 가격은 급등했다. 농산물은 전년 동월 대비 9.0% 오르며 전체 물가를 0.38%p 끌어올렸다. 5월 기준 2012년 5월(17.1%) 이후 6년 만에 최고치다. 농산물 중 채소류의 상승폭(13.5%)이 컸다. 품목별로는 쌀(29.5%)이 1981년 5월(32.4%) 이후 37년 만에 최고치로 올랐고 감자(59.1%)는 1994년(60.4%) 이후 24년 만에 최고를 기록했다. 이밖에 고춧가루(43.6%), 감자(59.1%), 무(45.4%) 등이 크게 올랐다. 반면 축산물은 돼지고기(-9.2%), 닭고기(-12.3%), 달걀(-38.9%) 등의 가격 안정세로 전년 동월 대비 8.1% 떨어져 전체 물가를 0.22%p 끌어내렸다.전기·수도·가스도 가격 안정세로 전년 동월 대비 3.3% 떨어져 전체 물가를 0.13%p 내리는데 기여했다. © News1국제유가 상승 여파로 휘발유와 경유는 전년 동월 대비 각각 6.3%, 8.1% 상승했다. 덩달아 공업제품이 전월비 0.4% 올랐고, 전년 동월 대비로는 1.6% 올랐다. 공업제품 가격은 전체 물가를 0.52%p 견인했다. 개인서비스 중 외식비는 2.7%나 오르며 1% 초반대에 머무는 전체 물가 상승폭과 비교하면 높은 수준을 유지했다. 구내식당식사비는 3.7%, 생선회는 4.8% 올랐다. 전체 물가를 0.84%p 끌어올렸다. 서비스 물가 중 가사도우미료(10.7％), 공동주택 관리비(5.5％) 등 인건비도 상승폭이 컸다. 의류, 신발 등은 전월 대비 변동이 없었으나 교통(0.9%), 음식·숙박(0.3%) 오락·문화(0.3%) 등은 소폭 상승했다. 식료품·비주류음료(2.5%)는 전년 동월 대비 올랐다. 지역별로는 전년 동월 대비 부산 1.9%, 대구 충북 제주 1.8%, 대전 1.7% 서울, 충남 1.6% 등의 순으로 물가가 상승했다. 김윤성 통계청 물가동향과장은 ""농축산물은 축산물이 떨어지고 채소류는 강세를 보이며 쌀값이 계속 오르고 있다""며 ""4월말부터 국제유가 인상이 됐기 때문에 그 여파를 계속 지켜봐야할 것""이라고 밝혔다.kul@news1.kr▶ [뉴스1] 채널설정하기 ▶ 제보하기▶ ‘6·13지방선거’ 뉴스보기[© 뉴스1코리아(news1.kr), 무단 전재 및 재배포 금지]"
53,2018.06.06. 오후 5:13,"'로켓맨 타코', '트럼프 칵테일'…이색메뉴 눈길","북미 정상회담에 들뜬 싱가포르 음식점북미 정상회담을 앞두고 싱가포르 음식점들이 특별 메뉴를 출시하고 있다.(서울=뉴스1) 김윤정 기자 = '6·12 북·미 정상회담'이 1주일 앞으로 다가오면서 개최국인 싱가포르도 한껏 달아오르고 있다. 특히 현지에선 도널드 트럼프 미국 대통령과 김정은 북한 국무위원장을 소재로 한 이색음식들이 등장해 눈길을 끌고 있다..싱가포르 스트레이트타임스(ST)는 6일 이번 북·미 회담을 주제로 한 이색음식들을 파는 식당 6곳을 소개했다.싱가포르 음식점 '하모니 나시르막'이 북·미 정상회담을 앞두고 내놓은 '트럼프-김치 나시르막'ST에 따르면 현지 음식점 '하모니 나시르막'은 이번 회담을 앞두고 '트럼프-김치 나시르막(The Trump Kim-Chi Nasi lemak)'이란 메뉴를 출시했다.나시르막은 코코넛 밀크를 넣고 지은 쌀밥에 반찬을 곁들인 요리로서 말레이시아어로 '맛있는 밥'이란 뜻이다. 특별 메뉴엔 미국산 소고기와 김치가 반찬으로 곁들여졌다.음식점 측은 북·미 정상회담을 축하하고 화합을 바라는 마음으로 이 메뉴를 출시했다고 밝혔다. 가격은 21싱가포르달러(약 1만6000원)이다.또 로얄플라자호텔은 이번 회담과 관련해 '트럼프-김 버거 세트'를 내놨다. 잘게 썬 닭고기와 김치가 들어간 햄버거로서 버거 빵 위엔 북한 인공기와 미국 성조기가 함께 꽂혀 있다.사이드 메뉴는 한국의 김밥과 미국의 감자튀김으로 구성됐다. 함께 나오는 음료 이름도 '정상회담 아이스티'로서 미국에서 유래한 아이스티를 한국산 유자꿀로 만들었다고 한다. 햄버거 가격은 12싱가포르달러(약 9600원), 음료 가격은 6싱가포르달러(약 4800원)다.싱가포르 로얄플라자호텔의 '트럼프-김 버거 세트'와 '정상회담 아이스티'이와 함께 싱가포르의 버거 맛집으로 유명한 '울프 버거'(Wolf Burgers)는 북·미 회담을 맞아 '세계평화를 위한 버거'를 기념 메뉴로 출시했다. 불고기와 김치마요, 한국식 무절임을 곁들이고 카라멜을 입힌 양파와 체다 치즈로 미국의 향을 더했다. 식당 측은 두 정상에게도 초청장을 보내고 ""원한다면 버거를 배달해겠다""고 밝혔다.또 싱가포르의 멕시코 음식점 '루카 로코'는 김 위원장의 별명과 트럼프 대통령의 이름을 각각 따 '로켓맨 타코'와 '엘 트럼포 타코'란 신메뉴를 내놨다.로켓맨 타코는 치킨에 매콤한 소스를 곁들였고, 그 위에 무절임과 양배추를 올렸다. 엘 트럼포 타코는 미국식으로 소고기 패티에 치즈, 양상추, 캐찹, 피클 등이 들어갔다.6·12 북미정상회담을 기념해 싱가포르의 술집 '에스코바'가 6일 소개한 술 먹기 게임. 가위바위보를 해서 진 쪽이 10잔을 모두 마셔야 하는데 왼쪽은 북한(소주), 오른쪽은 미국(보드카)이다. 2018.6.6/뉴스1 © News1 성도현 기자현지 주점들도 북·미 회담 열기에 빠질 수 없다. 싱가포르 '차이나 스퀘어 센트럴'에 위치한 에스코바(escobar)는 '트럼프'와 '김'(Kim)이란 이름의 칵테일을 출시했다.트럼프 칵테일은 파란색, 킴 칵테일은 빨간색이다. 각각 미국산 버번 위스키와 한국산 소주를 칵테일 베이스로 사용했다. 각국 대표단이나 외신 기자들은 이 주점에서 할인 혜택도 받을 수 있다고 한다.엠파이어 스카이 라운지에선 '세계평화폭탄'이라고 불리는 샷과 '트럼프 위스키', '로켓'이라는 이름의 칵테일을 출시했다. 안주는 김치 닭날개, 미니 버거로 북·미 회담의 성공을 기원하는 뜻을 담았다고 한다.yjyj@news1.kr▶ [뉴스1] 채널설정하기 ▶ 제보하기▶ ‘6·13지방선거’ 뉴스보기[© 뉴스1코리아(news1.kr), 무단 전재 및 재배포 금지]"
56,2018.06.01. 오전 8:21,쌀값 37년만에 최고…소비자물가 8개월째 1%대(상보),"5월 소비자물가 동향…농산물 9%↑ 6년 만에 최고22일 서울 서초구 농협하나로마트 양재점에서 시민들이 양곡 코너를 둘러보고 있다.. 2018.3.22/뉴스1 © News1 황기선 기자(세종=뉴스1) 이훈철 기자,박정환 기자 = 소비자물가가 8개월째 1%를 기록했다. 농산물은 쌀, 채소 가격이 오르며 6년만에 최고로 뛰었다. 국제유가 상승여파로 공업제품 가격도 올랐다. 1일 통계청이 발표한 '2018년 5월 소비자 물가 동향'에 따르면 소비자물가지수는 전년 동월 대비 1.5% 상승했다. 소비자물가는 지난해 초부터 9월까지 2% 내외를 기록하다 10월 1.8%로 떨어진 후 7개월 연속 1%대다. 올해 1~3월에는 각각 1.0%, 1.4%, 1.3% 등 1% 초반대에 머물렀고, 4월 1.6%까지 상승했지만 지난달 0.1%p 떨어졌다. 농산물이 전년 동월 대비 각각 9.0% 오르며 상승폭이 컸다. 5월 기준 2012년 5월(17.1%) 이후 6년 만에 최고치다. 농산물 중 채소류의 상승폭(13.5%)이 컸다. 품목별로는 쌀(29.5%)이 1981년 5월(32.4%) 이후 37년 만에 최고치로 올랐고 감자(59.1%)는 1994년(60.4%) 이후 24년 만에 최고를 기록했다. 이밖에 고춧가루(43.6%), 감자(59.1%), 무(45.4%) 등이 크게 올랐다. 반면 축산물은 돼지고기(-9.2%), 닭고기(-12.3%), 달걀(-38.9%) 등의 가격 안정세로 전년 동월 대비 8.1% 떨어졌다. 의류, 신발, 주택, 수도 등은 전월 대비 변동이 없었으나 교통(0.9%), 음식·숙박(0.3%) 오락·문화(0.3%) 등은 소폭 상승했다. 식료품·비주류음료(2.5%)는 전년 동월 대비 상승했다. 국제유가 상승 여파로 휘발유와 경유는 전년 동월 대비 각각 6.3%, 8.1% 상승했다. 덩달아 공업제품이 전월비 0.4% 올랐고, 전년 동월 대비로는 1.6% 올랐다. 김윤성 통계청 물가동향과장은 ""농축산물은 축산물이 떨어지고 채소류는 강세를 보이며 쌀값이 계속 오르고 있다""며 ""4월말부터 국제유가 인상이 됐기 때문에 그 여파를 계속 지켜봐야할 것""이라고 밝혔다.kul@news1.kr▶ [뉴스1] 채널설정하기 ▶ 제보하기▶ ‘6·13지방선거’ 뉴스보기[© 뉴스1코리아(news1.kr), 무단 전재 및 재배포 금지]"
57,2018.06.22. 오전 8:00,[연합뉴스 이 시각 헤드라인] - 08:00,"			■ 문대통령 ""한반도 전쟁 없을것…푸틴과 평화 협력방안 집중논의""문재인 대통령은 21일(현지시각) ""한반도에 역사적인 평화의 기회가 열리고 있다""며 ""이제 한반도에 전쟁은 다시 없을 것이고, 남북협력이 러시아와의 3각 협력으로 확장될 것""이라고 말했다. 러시아를 국빈방문 중인 문 대통령은 이날 모스크바의 한 호텔에서 재외국민, 고려인 동포 및 러시아 인사 등 200여명이 참석한 '한러 우호·친선의 밤' 만찬 간담회에서 ""내일 저는 푸틴 대통령과 정상회담에서 한반도와 유라시아의 평화·번영을 위한 협력 방안을 집중적으로 논의할 것""이라며 이같이 밝혔다.전문보기: http://yna.kr/NQRVaKiDAj9■ 트럼프 ""전면적 비핵화 이미 시작…매우 빨리 움직이고 있다""도널드 트럼프 미국 대통령은 21일(현지시간) ""가장 중요한 것은 전면적 비핵화(Total denuclearization)로, 이미 일어나기 시작했다""며 ""우리는 매우 빨리 움직이고 있다""고 말했다. 트럼프 대통령은 이날 백악관에서 열린 각료회의에서 ""그들(북한)은 엔진시험장을 파괴하고 있다. 그들은 폭파하고 있다""며 이같이 밝혔다. 이어 북미 정상 간 공동성명을 언급, ""문서를 읽어본다면 '우리는 즉각적으로 북한의 전면적 비핵화를 시작할 것'이라는 게 성명의 넘버 원""이라며 ""아무도 그것이 가능할 것으로 생각하지 않았다""고 북미정상회담의 성과를 자평했다.전문보기: http://yna.kr/SQRwaKEDAjK■ [월드컵] 졸전 또 졸전…'슈팅 1개'로 고개 숙인 '황금 왼발' 메시포르투갈은 의심의 여지 없는 크리스티아누 호날두의 '원 맨' 팀이다. 그러나 아르헨티나는 리오넬 메시의 '원 맨' 팀이 아니었다. 아르헨티나가 2018 국제축구연맹(FIFA) 러시아 월드컵 축구대회에서 두 경기 연속 졸전으로 '죽음의 조'인 D조 조별리그 탈락 위기에 몰렸다. 철저한 수비로 나선 1차전에서 아이슬란드와 1-1로 비긴 것은 약과였다.전문보기: http://yna.kr/4QRRaKLDAjz■ [월드컵] 손흥민·황희찬 '로사노 퇴장' 리우 승리 재현할까?'2016년 리우데자네이루 올림픽 때 기분 좋은 승리의 기억을 되살려 멕시코를 넘어라.' 2018 러시아 월드컵 축구대회 F조 조별리그 2차전인 멕시코와 운명의 대결(24일 오전 0시·로스토프 아레나)을 앞둔 신태용호의 공격 쌍두마차 손흥민(토트넘)-황희찬(잘츠부르크) 듀오와 수비의 중심인 장현수(FC도쿄)는 멕시코에 기분 좋은 기억을 가지고 있다.전문보기: http://yna.kr/NQRsaKZDAjx■ 남북, 오늘 금강산서 적십자회담…8·15이산상봉 논의남북은 22일 오전 10시 금강산에서 적십자회담을 열고 8·15를 계기로 한 이산가족상봉행사 등 인도적 현안을 논의한다. 박경서 대한적십자사(한적) 회장을 수석대표로 하는 우리측 대표단은 이날 오전 8시 20분께 강원도 고성 남북출입사무소(CIQ)를 통과해 동해선 육로로 방북할 예정이다.전문보기: http://yna.kr/wQR0aKzDAjd■ 빈곤층, 부양가족 있어도 10월부터 주거비 받는다빈곤층이 기초생활보장 주거비를 신청했다가 아들이나 부모 등 부양가족이 있다는 이유로 탈락하는 일이 앞으로 없어진다. 정부가 저소득층의 주거안정을 도모하고자 기초생활보장 중 주거급여에 대한 부양의무자 잣대를 들이대지 않기로 했기 때문이다. 22일 보건복지부에 따르면 소득이나 재산 기준을 충족하고도 부양가족이 있다는 이유로 기초생활보장을 받지 못하는 비수급 빈곤층의 주거 안정성을 높이고자 10월부터 주거급여에 대한 부양의무자 기준을 우선 폐지하기로 했다. 이와 함께 소득대비 주거비 부담이 큰 가구를 해소하고자 주거급여 선정기준을 '기주 중위소득 43% 이하'에서 2020년까지 '기준 중위소득 45%'로 단계적으로 확대한다. 수급가구의 실제 임차료 부담과 건설공사비 상승 등을 고려해 임차가구에 대한 주거급여 지급 상한액과 자가 가구에 대한 주택 수선 지원 상한액도 올려주기로 했다.전문보기: http://yna.kr/d4RCaKVDAip■ ""20년내 최저"" 산지 닭값 '폭락', 소비자가격은 '찔끔'여름철 닭고기 성수기가 다가왔지만 육계농가와 소비자 모두 '울상'인 형편이다. 산지 닭값이 폭락했음에도 실제 소비자가격은 소폭 인하에 그치고 있기 때문이다. 공급 과잉과 유통비용 상승 등이 배경으로 분석되지만 당장 뾰족한 대책도 없는 상황이다.전문보기: http://yna.kr/M4R1aKKDAiQ■ 아동격리 철회 설득한 멜라니아, 텍사스 수용시설 깜짝방문도널드 트럼프 미국 대통령의 부인 멜라니아 여사가 21일(현지시간) 미 텍사스 주 멕시코 접경지역에 있는 이민자 아동 수용시설을 전격 방문했다. 멜라니아 여사는 텍사스 주 맥앨런에 있는 '업브링 뉴호프 칠드런센터'를 찾았다. 12∼17세 이민자 아동·청소년들의 수용 시설이다. 멜라니아 여사는 시설 관리자들에게 ""이 아이들이 그들의 가족과 가능한 한 빨리 재결합할 수 있도록 내가 도울 방법이 없겠느냐""고 물었다고 미 CBS 방송이 전했다.전문보기: http://yna.kr/SQR1aK-DAjV■ 검경 수사권 조정, 국회입법 험로…""산넘고 물건너야""정부가 21일 경찰의 수사권한을 확대하는 내용의 검찰·경찰 수사권 조정안을 내놓았지만 향후 입법과정에서 적잖은 차질과 진통이 예상된다. 여야가 6월 임시국회를 열어놓고도 지방선거 여파로 20대 국회 후반기 원 구성 협상에서 한 발짝도 내딛지 못하면서 국회가 장기간 공전하고 있어서다. 전문보기: http://yna.kr/B1RraK-DAig■ 인천공항 9천억 매출 면세점 주인 오늘 결정…신라-신세계 격돌롯데면세점이 반납한 인천공항 제1 터미널 면세매장을 운영할 새 사업자가 22일 정해진다. 관세청은 이날 천안 관세국경관리연수원에서 인천공항 제1 터미널 면세점 재입찰 특허심사위원회를 열고 ㈜호텔신라와 신세계디에프의 사업 계획 프레젠테이션을 받은 뒤 사업자를 결정, 발표한다. 이날 특허심사위원회 면접에서 한인규 신라면세점 대표와 손영식 신세계디에프 대표가 직접 프레젠테이션에 나서 자사의 장점을 설명한다.전문보기: http://yna.kr/-3RbaK7DAi0▶기사제보 및 문의▶뉴스가 보여요 - 연합뉴스 유튜브  ▶2018 러시아 월드컵의 모든 것"
58,2018.06.20. 오후 5:17,[휴] 日 고급 소고기 '와규' 무한리필...해변 경치 즐기며 뷔페 식사도,"■일본 미야자키 맛집고기를 무제한으로 즐길 수 있는 ‘아파스’.해변을 바라보며 뷔페를 즐기는 ‘데몬 데 마루셰’.[서울경제] 일본의 모든 지역이 그렇듯 미야자키에도 황홀한 맛으로 여행객에게 행복감을 선사하는 식당이 많다.먼저 미야자키는 일본 현지의 마블링이 우수한 고급 소고기를 일컫는 ‘와규’로 특히 유명하다. 미야자키 지역의 소고기를 뜻하는 ‘미야자키규’는 5년마다 개최되는 전국 규모의 ‘와규올림픽’에서 세 번 연속 우승(품질 부문)을 차지했다고 한다. 미야자키의 대표적인 와규 맛집으로 손꼽히는 곳은 시내 중심가인 미야자키현청에서 도보로 10분 정도 걸리는 ‘아파스’라는 식당이다. 아파스는 매우 저렴하고 합리적인 가격으로 소고기를 비롯한 다양한 종류의 육류를 맛볼 수 있어 젊은 여행객들도 부담 없이 이용할 수 있는 곳이다. 이 식당에서 특히 높은 인기를 자랑하는 것은 무제한으로 고기를 먹을 수 있는 메뉴다.남자는 6,000엔, 여자는 5,500엔만 내면 와규와 돼지고기·닭고기·소시지는 물론 맥주까지 마음껏 먹고 마실 수 있다. 우리 입맛에 딱 맞는 미역국과 함께 하얀 쌀밥도 공짜로 나온다. 다만 식당 이용은 2시간만 가능하며 테이블 착석 후 1시간30분이 지난 다음에는 주문할 수 없다.아오시마 해변 인근에는 바다 경치를 즐기며 여유롭게 식사를 즐기기 좋은 뷔페 레스토랑인 ‘데몬 데 마루셰’가 있다. 싱싱한 해산물과 초밥, 바삭바삭한 닭튀김과 오징어 파스타 등 음식 종류가 호텔 못지않게 다양하며 따뜻한 날에는 야외에서 해변을 바라보며 식사할 수도 있다. 성인 기준 가격은 1,620엔인데 음료를 무제한으로 이용하려면 200엔을 추가로 내면 된다. 런치 뷔페를 전문으로 하기 때문에 영업시간은 평일은 오전11시부터 오후3시30분까지, 주말과 공휴일은 오전11시부터 오후4시30분까지다. 레스토랑 바로 옆에는 예쁜 액세서리와 기념품을 파는 가게도 있다. /글·사진(일본 미야자키)=나윤석기자 nagija@sedaily.com [서울경제 바로가기]이제 주식시세도 서울경제에서 확인하세요 [바로가기▶]블록체인의 모든 것, 서울경제 Decenter [바로가기▶]저작권자 ⓒ 서울경제, 무단 전재 및 재배포 금지		"
