,날짜,기사제목,기사내용
25,2019.03.17. 오후 6:12,中 보잉 때리자 돼지고기 들고나온 美…무역담판 기싸움 치열,"中서 이미 작년 8월 ASF 확진뒤늦은 美 압수조치 배경 관심작년 中정부 수입 즉각 늘려돈육가격 급등 초기에 진화무역담판 물밑협상중 돌발 변수트럼프-習 회담 6월로 연기될듯◆ 美·中 무역분쟁 1년 ◆  미국이 중국에서 발생한 아프리카돼지열병(ASF)에 대한 우려로 중국산 돼지고기 100만파운드(약 454t)를 압수하면서 양국 간 무역전쟁에 새로운 이슈로 부각되는 것이 아니냐는 전망이 제기되고 있다. 1년 동안 진행해온 무역전쟁을 해결하기 위해 양국이 물밑 접촉을 계속하고 있는 가운데 또 다른 갈등 요소가 발생했다는 분석이다. 중국은 세계 최대 돼지고기 생산국이자 소비국이다. 중국산업정보에 따르면 지난해 기준 중국의 돼지고기 생산량은 5469만t으로 전 세계 돼지고기 생산 비중의 약 49%를 차지했다.같은 해 중국 내 돼지 소비량은 5624만t에 달했다. 중국인의 돼지고기 사랑은 교역 규모에서도 확인할 수 있다. 지난해 중국의 돼지고기 수입 규모는 160만t으로, 수출 규모인 5만t보다 무려 32배나 많았다. 국제 원자재 전문기관 코리아PDS에 따르면 1인당 중국인의 돼지고기 소비량은 74파운드로, 이는 닭고기 소비량인 18파운드의 4배를 넘어설 정도다.미국의 이번 압수 조치가 갑자기 나왔다는 점에서 그 배경에 관심이 쏠리고 있다. 중국에서 ASF 확진이 나온 시기는 지난해 8월이기 때문이다. 이와 관련해 중국이 주도하고 있는 보잉 '737맥스' 보이콧에 대한 미국의 불만에서 기인한 것이 아니냐는 해석도 나온다.지난 10일 에티오피아항공 여객기가 추락해 탑승자 전원이 사망하자 중국이 신속하게 사고 기종인 보잉 '737맥스 8'의 운항을 잠정 중단했다. 중국을 시작으로 미국 회사인 보잉이 제조하는 737맥스 운항 중단 조치가 전 세계로 확산됐다. '미국 우선주의(아메리카 퍼스트)'를 내세우는 도널드 트럼프 대통령에게 이러한 중국의 비판이 타격을 입혔을 수 있다는 분석이다.  양국이 무역협상 조건을 놓고 신경전을 벌이고 있는 가운데 이들 사건을 명분으로 요구 수준을 더욱 높일 수 있기 때문이다. 미국은 '식품 안전', 중국은 '항공 안전' 이슈를 들고나올 수 있는 셈이다.하지만 미국의 이번 역공이 효과를 발휘할지에 대해서는 의문이다. 당초 작년 8월 ASF 발생 초기에는 중국 내에서 2007년과 2010년 돼지 전염병에 따른 가격 폭등 사태가 반복될지 모른다는 우려가 퍼졌다. 중국 정부는 즉각적으로 돼지고기 수입을 크게 늘려 중국 내 돼지고기 가격 급등을 완화하는 데 성공했다. 작년 7월 88t이던 돼지고기 수입량을 작년 말 95t까지 늘렸다.  돼지 사료인 대두 가격이 폭등할 경우 중국 정부의 돼지고기 가격 안정 노력도 물거품이 될 뻔했다. 그러나 도널드 트럼프 대통령이 주도한 무역전쟁이 행운으로 작용했다. 중국이 미국산 대두에 보복 관세를 부과했던 시점에서 중국은 이미 2017~2018년 미국산 대두 수입을 마친 상황이었다. 또 시장 상황을 미리 반영하는 곡물 선물시장에서는 무역전쟁으로 중국의 미국산 대두 수요가 줄어들 것이 예상돼 t당 380달러 선인던 대두 가격이 가파르게 하락하기 시작해 작년 말 330달러 선까지 내려왔다. 양국 무역갈등이 장기화하면서 농가 분야에 피해가 두드러지게 나타난 곳은 중국이 아닌 미국이었다. 대중국 수출 비중이 75%에 달하는 미국의 대두 농가 피해가 속속 드러났다. 중국은 미국산 농산물 수입을 대거 늘리겠다고 밝히면서 미국과의 무역협상에 우호적인 제스처를 취하는 효과를 줬다. 지난해 말 90일간의 유예 기간을 둔 양국 간 무역전쟁 휴전 기간 내 중국은 미국산 대두 수입을 재개하기로 발표했다.중국 감염당국은 ASF를 '국가 1급 전염병'으로 분류하고 역학조사와 확산 방지에 총력을 기울이고 있다. 지난해 8월 중국 랴오닝성에서 첫 ASF 감염 사례가 적발된 이후 2월 말 현재까지 28개 성(省)·시(市)에서 112건의 감염 사례가 보고됐다. 중국 당국은 대부분 농장에서 감염 사례가 나온 것으로 파악하고, 감염 확산을 방지하기 위해 최근 7개월 동안 약 100만마리의 돼지를 도살했다. 더 나아가 중국에서 ASF 공포가 확산되면서 직접적 관계가 아니더라도 다른 목적을 이유로 도살된 돼지는 같은 기간 460만마리나 증가했다.다만 중국 돼지 농가와 사육업체들은 직격탄을 맞았다. 사우스차이나모닝포스트(SCMP)에 따르면 일부 농가에서는 돼지고기 가격 하락으로 수익이 나지 않는 상황에서 사료 비용을 충당하지 못해 돼지 사육을 포기하는 곳이 빠르게 늘어나고 있는 실정이다. 한편 SCMP는 소식통을 인용해 ""무역전쟁을 끝내기 위한 트럼프 대통령과 시진핑 중국 국가주석의 회담이 6월로 연기될 수도 있다""고 16일 보도했다.이미 중국산 돼지 및 돼지고기 수입이 금지된 한국은 농림축산식품부를 중심으로 아프리카돼지열병 예방을 위해 해외로부터 유입 가능한 모든 경로를 차단하는 데 주력하고 있다. 이달부터 농식품부는 중국 여행객이 많은 제주공항의 여행객 기탁·휴대 수하물에 대해 검역 전용 X선 모니터를 설치·운영하고, 검역탐지견을 확대 운영할 계획이다. [뉴욕 = 장용승 기자 / 베이징 = 김대기 특파원 / 서울 = 이유섭 기자 / 김덕식 기자]▶매경 뉴스레터 '매콤달콤'을 지금 구독하세요▶뉴스 이상의 무궁무진한 프리미엄 읽을거리[ⓒ 매일경제 & mk.co.kr, 무단전재 및 재배포 금지]		"
26,2019.03.25. 오후 7:29,[포토뉴스] 고기 사면 와인값 깎아 드려요,"이마트는 와인과 고기를 함께 구매하면 와인 가격을 5% 할인해 주는 행사를 2019년 연중 진행한다고 밝혔다. 소고기, 돼지고기, 닭고기 등 육류 제품의 경우 모두 해당된다. 이마트 제공"
27,2019.03.02. 오전 6:15,"'사면초가' 한식 뷔페, 점포 줄이고 고급화 전략 승부수","			""경기불황·간편식 트렌드에 설 곳 잃어"" (서울=연합뉴스) 이태수 기자 = 한때 외식업계를 주름잡던 한식 뷔페가 경기불황과 트렌드 변화 등으로 침체 일로를 겪자, 업계가 고급화 전략으로 승부수를 던졌다.    2일 외식업계에 따르면 CJ푸드빌이 운영하는 한식 뷔페 '계절밥상'의 매장 수는 2016년 말 45개에서 2017년 말 54개로 늘어났지만, 지난 연말 기준 29개로 급감했다.    불과 1년 만에 전국 매장 가운데 절반 가까이 사라진 셈이다.    신세계푸드가 운영하는 '올반' 역시 2014년 2개에서 2015년 13개, 2016∼2017년 15개로 매장 수를 늘려나갔다가 현재 12개로 후퇴했다. 계절밥상[연합뉴스 자료 이미지] CJ푸드빌 관계자는 이를 두고 ""수익 구조 개선 및 내실 강화를 위한 사업 구조 개선 차원""이라며 ""'선택과 집중'을 원칙으로 삼아 매출이 부진한 매장은 영업을 종료하고, 수익이 좋은 매장은 특화 매장으로 개편했다""고 설명했다.    이는 한식 뷔페의 매출이나 수익이 예전 같지 않아 '덩치'를 줄일 수밖에 없다는 뜻으로 해석할 수 있는 부분이다.     업계 관계자는 ""한때 패밀리 레스토랑의 대안으로 주목받으며 폭발적인 인기를 끌던 한식 뷔페가 정체기를 맞은 것은 사실""이라고 토로했다.    그러면서 ""중소기업 적합업종으로 지정되면서 신규 출점이 제한된 데다, 경기불황으로 소비 심리가 위축됐고, 1인 가구가 늘어나 간정간편식 구매가 늘어난 점 등이 복합적으로 영향을 미친 것으로 보인다""고 짚었다.    외식업은 2013년 중소기업 적합업종에 지정돼 대기업은 역세권 100ｍ 안쪽이나, 연면적 2만㎡ 이상의 복합 시설에만 신규 점포를 낼 수 있는 등의 규제를 받고 있다. 또 새로 선정하는 생계형 적합업종에 포함될 가능성도 꾸준히 제기되는 등 사업 확대가 녹록지 않은 상황이다.    게다가 그간 1만∼2만 원대 가격을 내세워 상대적으로 낮은 문턱을 자랑해왔지만, 20∼40대를 중심으로 '가성비'(가격 대비 성능)를 중시하는 바람이 불면서 '뷔페'의 인기가 예전만 못하다고 업계는 보고 있다.    특히 수천원, 많아야 1만 원대로 살 수 있는 가정간편식(HMR)이 고급 레스토랑 못잖은 품질을 갖추면서 이 같은 경향이 심화했다는 시각도 있다.    이에 따라 업계에서는 가격을 올리더라도 요리의 '격'을 높여 소비자가 기꺼이 지갑을 열도록 유도하거나, 아예 한식 뷔페 브랜드로 가정간편식을 내놓는 등 저마다 대응에 나서고 있다.'올반 프리미엄' 매장[신세계푸드 제공]    '계절밥상'은 지난해 연말 여의도 IFC 점을 즉석조리를 강화한 '라이브 스튜디오 8'로 개편했다. 즉석에서 닭고기·돼지고기 메뉴를 제공하고, 새우와 가리비 등 인기 해산물을 요리하는 것이 특징이다.    이 매장은 성인 평일 점심 기준 가격이 다른 매장보다 1천원 비싸지만, 개편 뒤 매출이 지난해 같은 기간보다 30% 이상 뛰었다. CJ푸드빌은 ""식사 시간대에는 대기 고객이 끊이지 않을 정도로 여의도 IFC몰 내 인기 맛집으로 통한다""고 소개했다.    '올반'도 서울 서초구 반포동 센트럴시티 점을 지난 연말 '올반 프리미엄'으로 업그레이드했다. 이곳은 팔도 한식을 맛보는 '한옥', BBQ 코너 '붓처스', 주문 즉시 메뉴를 만들어주는 '더 라이브' 등을 갖췄다.    신세계푸드는 ""국내 최대 규모 '라이브 그릴 뷔페'라는 주제에 맞춰 매장 곳곳에 주문 즉시 만들어 제공하는 철판 함박 스테이크, 장어 솥밥, 촙스테이크, 양념목살구이, 삼겹살 등을 선보이며 맛의 수준을 끌어올렸다""고 전했다.    매장 디저트 판매대는 커피 전문점 '폴바셋'과 떡 전문점 '종로복떡방'과 제휴해 품질을 높였다고 덧붙였다.    프리미엄 매장의 가격은 성인 주말 기준 일반 매장보다 1만2천원이나 비싸다. 그러나 지난달 기준 매출이 개편 전인 지난해 같은 기간보다 22% 올랐다.신세계푸드 가정간편식 매출[신세계푸드 제공]    신세계푸드는 아예 2016년부터 생산하는 가정간편식에도 '올반' 브랜드를 사용하고 있다. 지난해에는 국, 탕, 김치, 소스, 안주 등 200여 종으로 400억 원대 매출을 올렸다.    신세계푸드는 ""'올반' 간편식 브랜드의 성장으로 식품 제조부문 매출액이 2015년 330억원에서 2016년 750억원, 2017년 1천450억원, 지난해 2천173억원 등으로 급성장했다""며 ""이는 회사 전체 매출의 15%를 넘어서는 수준""이라고 부연했다. tsl@yna.co.kr▶네이버 홈에서 [연합뉴스] 채널 구독하기▶뭐 하고 놀까? #흥  ▶쇼미더뉴스! 오늘 많이 본 뉴스영상"
28,2019.03.19. 오후 2:18,"[호텔가] JW 메리어트 서울 '더 라운지', 스페셜 딤섬 · 스몰 바이츠 메뉴 본격 출시","JW 메리어트 서울의 ‘더 라운지(The Lounge)’가 글로벌 식음 컨설턴트 알란 야우(Alan Yau)가 기획한 독창적인 딤섬들과 스몰 바이츠 메뉴, 프리미엄 티를 본격적으로 선보인다고 밝혔다. ©JW 메리어트 서울호텔 8층 리셉션 로비에 위치한 더 라운지는 동양의 미를 살린 인테리어와 높은 층고, 대형 통창을 통해 즐기는 자연 채광 등으로 여유롭고 럭셔리한 미식을 만끽할 수 있는 공간이다. 더 라운지의 분위기에 가장 잘 어울리는 음식을 선보이기 위하여 중식 딤섬을 메인 테마로 삼았고, 모던 중식 레스토랑 ‘하카산(Hakkasan)’, 중국식 딤섬과 베이커리, 칵테일 등으로 유명한 레스토랑 ‘야우아차(Yauatcha)’ 등 미쉐린 레스토랑을 다수 컨설팅한 것으로 유명한 런던 출신의 알란 야우 팀이 컨셉 기획, 메뉴 디자인 등을 총 지휘하였다. 알란 야우 팀과 수개월간의 협업을 통해 한국의 고급 식자재를 주재료로 한 원물 고유의 풍미와 식감을 살린 스페셜 딤섬과 스몰 바이츠 메뉴들이 완성됐다.가장 인기 있는 딤섬들로 가성비 높게 구성된 ‘테이스트 더 딤섬 세트(Taste The Dim Sum Set)’와 ‘올 어바웃 딤섬 세트(All About Dim Sum Set)”가 고객들의 마음을 사로잡는다.▲ 3만 9000원에 이용 가능한 ‘테이스트 더 딤섬 세트(Taste The Dim Sum Set)’는 프리미엄 티 1잔과 함께 알란 야우의 딤섬 5종과 스몰 바이츠 2종을 각각 1점씩 모두 맛볼 수 있도록 구성되어 있다. 쫀득한 만두피와 탱글탱글하게 씹히는 새우의 식감이 매력적인 ‘하가우’, 진하고 뜨끈한 육즙을 가득 품은 ‘샤오롱 바오’, 제주산 흑돼지 목살의 담백하고 쫄깃한 식감을 가진 ‘흑돼지 샤오마이’, 만두 소에 아삭한 식감의 배와 땅콩, 부추를 넣어 알록달록한 색감이 매력적인 ‘조주식 찐만두’, 새우를 넣은 만두피를 살짝 구워 알싸하게 매콤한 와사비 마요네즈에 찍어 먹는 ‘와사비 마요네즈 새우 교자’ 등의 딤섬 5종을 비롯하여 채 썬 무와 마른 새우, 타이완식 소시지 샹창을 혼합한 후 팬에 구워 겉은 노릇하고 속은 찰진 ‘순무 케이크’와 쫄깃한 찹쌀과 달콤한 팥 앙금의 감칠맛을 돋우는 ‘참깨 찹쌀볼’ 등의 스몰 바이츠 2종이 제공된다. ▲ 6만 9000원에 이용 가능한 ‘올 어바웃 딤섬 세트(All About Dim Sum Set)’는 이름 그대로 더 라운지의 딤섬 대부분을 합리적인 가격에 가장 풍성히 즐길 수 있는 특별 구성 세트이다. 프리미엄 티 1잔과 함께 ‘하가우’, ‘관자 슈마이’, ‘조주식 찐만두’, ‘부추 새우 수정 교자’, ‘새우 완톤’을 포함한 딤섬 6종과, 식사 대용으로도 훌륭한 ‘연잎밥’, ‘사슴 페스트리’, ‘순무 케이크’ 그리고 디저트로 마무리 할 수 있는 ‘참깨 찹쌀볼’ 등 4종의 스몰 바이츠 메뉴가 포함된다. 단품으로 즐길 수 있는 알란 야우의 메뉴들은 간 새우와 오징어로 속을 채운 후 도톰한 통 관자살과 날치 알을 가득 올린 시그니쳐 딤섬 ‘관자 슈마이’, 얇고 투명한 만두 피 속에 부추와 새우가 어우러져 향긋한 맛을 내는 ‘부추 새우 수정 교자’, 사천 스타일의 풍부한 양과 매콤한 소스에 탱글탱글한 새우살이 씹히는 ‘새우 완톤’ 등이 있다. 또한, 구운 야채의 단맛에 부드러운 식감의 돼지고기 육향이 가미된 ‘구운 야채 고기 만두’를 비롯해 쌀가루와 전분가루를 혼합해 만든 촉촉한 피에 통 새우나 차슈를 넣어 말아낸 ‘창펀’이 있다. 모든 딤섬 메뉴들은 매일 신선한 재료로 정성스럽게 준비되어 테이블에서 뜨겁게 먹을 수 있도록 서빙되며, 특히 ‘창펀’은 주문과 동시에 피 반죽부터 즉석에서 조리되어 신선한 재료의 맛과 부드러운 식감이 극대화된다. 또한, 딤섬 메뉴에 풍미를 더할 수 있도록 제공되는 셰프 특제 스위트 소이 소스와 라조유, 두반장 등이 별미이다.여기에 3년 이상 숙성된 공미로 온화한 차향과 부드러운 단맛이 좋은 ‘백차’, 좋은 차가 나는 해발 1000미터에서 채엽한 철관음으로 시원한 느낌과 부드러운 화향이 어우러진 중국 민남 지방의 ‘우롱차(고법 철관음)’, 유기함량이 높은 해발 2,500미터의 토양에서 자란 차청을 발효하여 시원한 맛과 고급스러운 화향, 오래 남는 회운이 일품인 ‘청경 우롱차’, 목 넘김이 부드러운 ‘보이생차(생병)’와 ‘보이숙차(숙병)’ 등 5가지 타입의 프리미엄 중국 차를 엄선하여 딤섬과 완벽한 맛의 조화를 이룰 수 있도록 섬세하게 준비했다. 딤섬 외에도 주류와 함께 즐기기 좋은 스몰 바이츠 메뉴 또한 알란 야우의 컨설팅으로 탄생하였다. 태국 커리 소스를 사용해 매콤하게 조리된 ‘갑오징어와 타이식 커리’, 피쉬 소스에 재운 국내산 닭 날개를 바싹 구워낸 ‘치킨 윙’ 등을 만나볼 수 있다. 또한, 감칠 맛을 돋구는 오리알 노른자와 함께 조리된 닭고기와 돼지고기에 연잎 향이 깊게 밴 ‘연잎 찹쌀밥’과 쟈스민 찻 잎으로 등갈비를 훈연하여 꿀의 단맛과 쟈스민 향이 아름답게 조화를 이루는 ‘쟈스민 향 훈제 돼지 등갈비’는 자연의 매력적인 향으로 후각과 미각을 감동시킨다. 육질과 식감이 부드러운 사슴 고기를 사용해 미트 파이같은 맛을 연출하는 ‘사슴 페스트리’는 얇고 바삭한 크러스트와 속을 가득 채운 매콤달콤한 소스가 완벽한 조화를 이룬다.달달함으로 입맛을 달래고 싶다면 촉촉하고 바삭한 중국식 ‘에그 타르트’와 겉은 땅콩 가루로 감싸고, 안은 걸쭉한 흑임자 페이스트로 채운 쫄깃한 식감의 ‘검은깨 땅콩 찹쌀볼’이 제격이다.알란 야우의 스페셜 메뉴는 오전 11시부터 오후 7시까지 주문 가능하다.  한편 더 라운지는 딤섬 및 스몰 바이츠 외에도 샌드위치, 버거, 파스타 등의 단품 식사 메뉴 및 애프터눈 티 세트, 디저트, 프리미엄 커피와 티, 와인 등이 제공되는 프리미엄 라운지이다. 저녁에는 바텐더가 즉석에서 만들어주는 칵테일을 라이브 피아노 연주를 감상하며 품격 있게 즐길 수 있다. 강인귀 기자 ▶ 고수들의 재테크 비법 ▶ 박학다식 '이건희칼럼' <저작권자 ⓒ '성공을 꿈꾸는 사람들의 경제 뉴스' 머니S, 무단전재 및 재배포 금지>		"
29,2019.03.14. 오전 3:13,"[IF] 실험실에서 만든 고기, 肉食의 새 길을 열다","동물 죽이지 않고 먹는 '인조 고기' '식물성 고기' 버거 국내판매 시작, 콩고기보다 더 실제 육질과 흡사국내 한 채식 전문점이 이번 주부터 채식주의자를 위한 햄버거를 판매하기 시작했다. 햄버거에는 소고기 대신 미국 바이오 기업 비욘드 미트가 개발한 식물성 고기가 들어갔다. 식물성 닭고기도 곧 출시될 예정이다. 과거 콩으로 만든 고기가 나왔지만 육질이 실제 고기와 흡사한 식물성 고기는 이번에 처음 소개됐다.가축을 희생하지 않아도 고기를 즐길 수 있는 날이 다가오고 있다. 식물성 단백질로 만든 고기는 갈수록 실제 고기와 맛이 비슷해지고 있다. 가축의 세포를 배양해 만든 고기도 올해 안으로 상용화가 가능하다는 전망도 나오고 있다. 식물성 고기와 세포 배양육은 축산업으로 인한 온실가스 배출과 환경오염을 줄이는 데 기여할 것으로 기대된다.◇소고기 맛 내는 분자를 식물에 구현가축은 전 세계에서 나오는 온실가스의 15%를 배출한다. 지금 추세라면 인류는 2050년까지 육류 소비가 70% 더 늘 전망이다. 이로 인한 온실가스 배출도 92% 증가한다는 추산이 나온다. 과학자들은 인류의 건강과 지구의 생존을 위해서라도 육류 소비를 줄여야 한다고 경고하고 있다. 가축이 필요 없는 인조(人造) 고기는 이런 문제를 해결할 대안으로 주목받고 있다.과거에도 인조 고기가 있었다. 바로 콩으로 만든 고기다. 하지만 같은 단백질이지만 맛은 소고기에 크게 못 미쳤다. 미국 스탠퍼드대 연구진이 2009년 창업한 임파서블 푸드는 혈액에서 산소를 전달하는 헤모글로빈 속 '헴' 분자가 고기 맛의 원천임을 알아냈다. 헴에는 철분이 들어 있어 선홍빛 고기 색과 금속성 풍미를 낸다.그래픽=김하경임파서블은 콩과(科) 식물의 뿌리혹에서 헴 분자를 만드는 유전자를 찾았다. 이 유전자를 맥주를 만드는 미생물인 효모에 끼워 넣어 발효 방식으로 대량생산했다. 회사는 콩·아몬드·밀을 이 헴 분자와 섞어 실제 소고기 맛을 내는 식물성 고기를 개발했다. 비욘드 미트도 같은 방식을 이용했다. 두 회사의 제품은 세계 곳곳의 채식주의자 식당과 수퍼마켓에서 팔리고 있다.◇세포 배양 방식의 고기도 상용화 임박실제 소고기 세포로 이뤄진 인조 고기도 등장했다. 네덜란드 마스트리흐트대의 마크 포스트 교수가 창업한 모사 미트는 2013년 소 줄기세포를 배양해 햄버거용 패티를 만들었다. 줄기세포를 근육세포로 자라게 해서 근육 조직을 만든 것이다. 당시 햄버거 가격은 무려 33만달러(약 3억7000만원). 구글의 공동창업자인 세르게이 브린이 돈을 냈다.모사 미트는 최근 세포 배양육으로 만든 패티 가격을 개당 11달러까지 떨어뜨렸다. 미국 MIT가 발간하는 테크놀로지 리뷰지는 지난달 전문가들은 세포 배양육이 올해 안으로 상용화가 가능하다고 전망한다고 보도했다. 실제로 미국 저스트는 올해 세포 배양 방식으로 만든 닭고기를 출시하겠다고 밝혔다. 이 회사는 일본 축산 업체와 손잡고 와규 소고기를 배양하는 연구도 하고 있다.다른 업체들의 개발 속도도 빨라지고 있다. 이스라엘 바이오 기업 알레프 팜은 지난해 세포 배양 방식으로 스테이크용 소고기를 만들었다고 발표했다. 미국 멤피스 미트는 2017년 세포 배양 방식으로 만든 닭고기와 오리고기를 선보였다.세포 배양육은 처음엔 배양 과정에 소 혈청을 사용해 생산 효율도 낮았고 윤리 논란도 있었다. 최근에는 줄기세포 배양 기술이 발전하면서 그런 문제가 사라졌다. 또 육질을 좌우하는 지방도 근육 조직과 같이 배양할 수 있게 됐다.◇온실가스 저감 효과 두고 논란도물론 인조 고기가 넘어야 할 산은 아직도 있다. 먼저 기존 업체의 반발이다. 미국 축산협회는 새로운 방식의 고기를 대놓고 '가짜 고기'라고 부르고 있다. 이들의 로비 덕택에 미주리주는 지난해 식물성이든, 세포 배양 방식이든 가축에서 나온 게 아니면 '고기(meat)'로 표시하지 못하게 하는 법률을 제정했다.인조 고기의 온실가스 저감 효과에 대한 회의론도 제기됐다. 지난달 영국 옥스퍼드대 연구진은 장기적으로 보면 가축이 배양육보다 온난화 유발 효과가 덜하다고 발표했다. 가축이 내뿜는 온실가스인 메탄은 온실효과가 이산화탄소보다 25배나 강하지만 1000년이나 지속되는 이산화탄소와 달리 12년이 지나면 자연적으로 사라진다는 것이다.하지만 업체들은 낙관적이다. 글로벌 담배 제조 업체들이 자신들의 시장을 잠식하고 있는 전자담배 업체에 투자하듯, 타이슨 푸드·카길 같은 세계적인 축산 업체들이 잇따라 인조 고기 개발 업체에 투자하고 있다는 것이다. 소비자 선호도 조사에서도 미국과 중국, 인도 모두 같은 가격이면 식물성 고기나 세포 배양육을 선택할 용의가 있다는 답이 훨씬 많았다.[이영완 과학전문기자 ywlee@chosun.com]- Copyrights ⓒ 조선일보 & chosun.com, 무단 전재 및 재배포 금지 -	 			[네이버 메인에서 조선일보 받아보기]	[조선닷컴 바로가기]	[조선일보 구독신청하기] "
