,날짜,기사제목,기사내용
15,2019.12.29. 오전 11:45,2019년 눈에띈 치킨 창업 전문 브랜드는,"			국내 치킨관련 프랜차이즈 창업이 가능한 브랜드는 450여개의 본사가 운영되는 것으로 분석되고 있다. 이런 치열한 치킨창업시장에서 나만의 트랜드를 만들고 이끌어가는 브랜드가 주목받고 있다.올 2019년도에 눈에 띄게 성장하고 2020년이 기대되는 브랜드이다./ 컬투치킨 (사진=강동완 기자)2010년부터 계육이력제를 도입하여 시행 중인 정직한 치킨 ‘컬투치킨’은 무색소, 무방부제의 건강하고 신선한 닭고기를 당일배송, 당일사용을 원칙으로 전 가맹점에 공급하고 있으며, 식재료의 철저한 유통기한 관리, 원산지 표기 등을 통해 올바른 먹거리 선도에 앞장서고 있다.또한 컬투치킨의 계육공급원인 ㈜마니커는 첨단 공기 냉각시스템을 통해 닭고기의 신선도 및 품질을 향상시키고 모든 공정을 자동으로 분류, 적재, 이송하여 이물질의 유입을 차단하는 등 계육 품질을 높이는데 주력하고 있다. 이를 입증하듯이 2019년에도 지속적인 성장을 이뤄가고 있다.굽네치킨 (사진=강동완 기자)오븐구이 치킨 프랜차이즈 '굽네치킨'은 2019년 피자를 도입함으로써 치킨과 피자의 시장에 도천했다. 새롭게 선보이는 굽네피자 3종은 굽네만의 특제 소스와 더불어 12시간 저온 숙성한 흑미도우 위에 소비자들이 가장 선호하는 고구마, 치킨, 비프 등의 신선한 토핑을 얹어 오븐에서 갓 구워 낸 피자다. 합리적인 가격인 1만5천원으로 12인치 라지 사이즈 피자를 만나 볼 수 있었다. 지속적으로 가맹점과 해외에서 활성화된 한해였다.중소벤처기업부와 소상공인시장진흥공단이 주관하는 '2019 프랜차이즈 수준평가' 우수등급으로 선정‘ 2019 우수 프랜차이즈로 지정받은 ’티바두마리치킨‘은 2001년 부산의 작은 치킨집으로 시작하여 현재는 제주도를 포함하여 전국 300여개 가맹점을 운영하며 성업중에 있다.한 마리 가격에 두 마리를 주는 파격적인 시스템을 도입하여 단순히 가격만 싸게 파는 전략이 아닌 맛과 가격, 양 3박자를 갖추고 있으며, 특히 스마트한 트렌드를 반영한 가성비, 가심비를 충족하여 본사와 가맹점 그리고 소비자의 어라운드 사이클이 유기적으로 소통과 상생하는 구조를 만들고 있다./ 멕시카나치킨 홈페이지 캡쳐30년 전통을 자랑하는 치킨 프랜차이즈계의 살아 있는 전설 ‘멕시카나 치킨’은 남다른 경력만큼 확실한 창업자 지원 시스템을 갖추고 있다. ‘찾아가는 맞춤 창업 서비스’를 통해 가맹점주는 물론 고객까지 최고의 선택이 될 수 있는 해당 시스템은 전국 어디든지 전화 한 통이면 ‘멕시카나 치킨’ 전문 창업 컨설턴트의 1대1 맞춤 창업 서비스를 받아볼 수 있다.신규는 물론 파격 지원을 통한 업종변경 창업도 가능하며 특히 치킨 사업 유경험자에게는 특별 지원 프로그램까지 운영하고 있다. 또 초보 창업자 입장에서는 상권조사 및 입지분석부터 가맹점주 입문교육과 개점 전 교육, 현장시식 홍보차량 제작을 통한 프로슈머 마케팅 실현, 대규모 판매촉진 이벤트 프로모션 진행 등 그야말로 매장 오픈 전과 후 사후관리까지 확실히 책임지고 있다는 점 역시 ‘멕시카나 치킨’ 창업 시스템이 갖춘 장점 가운데 하나다.푸라닭치킨우수프랜차이즈 1등급에 선정된 '푸라닭 치킨'은 오븐-후라이드의 새로운 조리방식, 더스트백을 활용한 포장, 요리와 같은 치킨으로 차별화를 앞세워 많은 소비자에게 사랑을 받고 있다. 특히 이번 프랜차이즈 수준평가에서는 가맹점 만족도에서 많은 점수를 받아 일반 소비자뿐 아니라 가맹점과 상생하는 모습을 보여주고 있다.푸라닭치킨은 더 건강한 맛을 위한 신제품 연구 및 개발을 지속적으로 진행하고 있으며, 특히 푸라닭치킨만의 차별화된 가맹점 관리 시스템으로 레드오션이라는 치킨 시장에서 2030 젊은 층 대상으로 가맹 문의가 점차 늘고 있다.이외에도 '교촌치킨' 'BBQ' 'BHC'등이 꾸준한 성장세를 보였다.강동완 기자 enterfn@mt.co.kr▶ 영상으로 보는  고수들의 재테크 비법 ▶ 박학다식 '이건희칼럼' <저작권자 ⓒ '성공을 꿈꾸는 사람들의 경제 뉴스' 머니S, 무단전재 및 재배포 금지>		"
16,2019.12.07. 오전 3:32,‘클린 미트’는 인간·동물 구할 식량혁명,"축산업은 대기 온난화의 주범 / 지구 4분의1이 가축 방목에 사용 / 2013년 세계 첫 소줄기세포 배양 / 햄버거용 패티 저렴하게 만들어 / 고기 등 실험실서 키우는 공정으로 / 20년내 대규모 청정고기 생산가능    폴 샤피로/이진구/흐름출판/1만6000원   클린 미트/폴 샤피로/이진구/흐름출판/1만6000원   닭고기, 돼지고기, 소고기 등 현대인의 식탁에 오르는 고기들은 우리 배를 불리고 행복감을 준다. 하지만 동시에 인간과 이 지구를 병들게 하는 위험한 동반자이기도 하다. 인류의 멸종을 부를 수도 있는 대기 온난화의 주범은 축산업이다. 자동차, 버스, 트럭, 기차, 배, 비행기, 로켓 등 지구상의 모든 탈것이 내뿜는 온실가스의 총합보다 축산업이 내뿜는 온실가스의 양이 훨씬 많다고 한다. 동물에게 투여되는 항생제의 대부분이 동물의 체중 증가와 밀집 사육 시에 일어날 수 있는 질병을 예방하기 위해서인데 최종 소비자인 인류는 바로 이 항생제 덩어리를 먹고 있다.  TED의 연사이자 세계 최초로 클린 미트를 시식한 인물인 저자 폴 샤피로는 인간과 동물을 모두 구할 방법이 없을지를 고민해오던 중 그에 대한 해답으로 찾은 것이 클린 미트(Clean Meat)다. 저자는 고기보다 더 깨끗하고 인간과 동물 모두에게 무해한 클린 미트가 식물성 고기로 만족하지 못하는 소비자들을 사로잡을 것이라고 확신한다고 말한다.  사실 클린 미트에 관한 언급은 오래됐다. 1931년 영국의 총리 윈스턴 처칠의 ‘50년 뒤의 세계’라는 글에서도 나온다. 처칠은 “우리는 가슴이나 날개를 먹기 위해 닭을 통째로 키우는 모순에서 벗어나 적절한 배양액 내에서 부위별로 닭을 키우게 될 것”이라고 했다. 70여년이 흐른 지금 놀랍게도 현실화되고 있다.  유엔식량농업기구에 따르면 현재 지구의 얼어붙지 않은 땅 중 4분의 1 이상이 가축 방목에 사용되고, 경작지 중 3분의 1은 농장 동물을 먹이는 용도로 쓰인다. 동물용 사료는 지구의 허파를 죽이는 주범이다. 수렵을 시작한 이후로 이어지고 있는 고기에 대한 인간의 욕망은 앞으로도 수그러들지 않고 지구의 환경을 더욱 망쳐놓을 수 있는 만큼 이 시점에서 인간과 동물, 지구 환경을 모두 구할 대담한 혁명이 클린 미트라는 게 저자의 설명이다.     소고기 등 현대인의 식탁에 오르는 고기들은 우리 배를 불리고 행복감을 주지만 지구를 병들게 한다. 특히 축산업은 인류의 멸종을 부를 수 있는 대기 온난화의 주범인 점은 주지의 사실이다. 저자 폴 샤피로는 클린 미트야말로 환경파괴, 동물 학대 등 세계가 직면한 문제를 해결할 식량혁명의 수단이 될 수 있다고 강조한다. 사진은 한우를 사육하고 있는 대관령 한우 목장. 세계일보 자료사진    우리말로 청정고기로 번역되는 클린 미트는 더는 공상과학소설에 나오는 이야기가 아니다. 2013년에 이미 세계 최초로 소 줄기세포를 배양해 햄버거용 패티를 만들었다. 생산 비용은 33만달러였다. 33만달러가 큰돈이 아니냐고 반문할 수 있지만, 첫 인간 게놈 프로젝트에 수십억 달러가 들었다는 사실을 상기시킨다. 현재는 겨우 수백 달러로 유전자 검사가 가능하다. 2016년 멤피스미트는 비교적 저렴한 가격인 1200달러로 세계 최초의 배양 미트볼을 생산해냈다. 멤피스미트는 2017년 더 낮은 가격으로 최초의 청정 닭고기 샌드위치와 비가라드소스를 끼얹은 프랑스식 오리 요리를 만들어 가까운 미래에 시장 출시를 노리고 있다.  적절한 연구와 투자가 이루어진다면 10~20년 안에 소나 닭을 키우는 비용보다 저렴하게 대규모로 청정고기를 생산할 수 있을 것이다. 스테이크를 먹고 싶다면 소를 키워서 도축할 것이 아니라 간단하게 스테이크만 키우면 되는 미래가 올 것이라고 저자는 확신한다.  저자는 클린 미트를 생산하기 위한 세포농업은 진짜 동물의 고기나 기타 동물 생산물 등을 실험실에서 키우는 공정으로 동물이 다치지 않을뿐더러 드넓은 농경지를 자연 서식지로 되돌려놓을 수 있다고 강조한다.  “19세기 불을 붙이기 위한 기름을 얻기 위해 전 세계의 고래는 거의 멸종에 가까워질 만큼 학살당했다. 포경산업의 폭주를 막은 건 한 지질학자가 석유에서 등유를 추출하는 방법을 발견했기 때문이다. 뉴욕의 말이 도심이 아닌 초원을 뛰어다닐 수 있게 된 것도 헨리 포드가 발명한 자동차 때문이었다. 사람들에게 계속 불을 끄고 다니라고 잔소리하는 방법이 있는가 하면 계속 켜두어도 소비 전력이 적은 전구를 개발하는 방법도 있다. 과학은 인류 역사에서 늘 변화와 혁신의 최전선에 있었다. 지금 인류를 위협하고 있는 것이 엄청난 양의 고기를 생산해내는 시스템에 있다면, 그에 대한 해답을 과학에서 찾는 건 어쩌면 너무도 당연한 일이다.” 저자는 선택은 전적으로 우리에게 달렸다고 강조한다.   박태해 선임기자 pth1228@segye.comⓒ 세상을 보는 눈, 세계일보"
17,2019.12.26. 오전 8:24,‘지글지글’ 송년회마저도…축산 농가 울상,"중국 북송때 최고의 문장가로 불리는  소동파. 이런 이야기를 할 정도로  돼지고기 애호가였습니다.""대나무가 없으면 사람은 속물이 되고, 돼지고기가 없으면 몸이 마른다, 대나무와 돼지고기 중 하나를 고르라면 당연히 돼지고기를 선택할 것이다.""라고까지 했습니다.한 번은 이렇게 좋아하는 돼지고기를  솥에 끓여놨다가  잠시 한 눈을 팔았는데, 타버린 줄 알았던 돼지고기 맛이 기가 막혔고.. 그래서 탄생한 음식이  바로 '동파육'입니다. 우리나라 국민도 소동파 만큼은 아니더라도 돼지고기, 좋아하시죠,요즘 한창 송년회 시기인데, 이 송년회 대표 메뉴가 삼겹살일 정도죠.그래서 12월은 양돈농가에선  송년회 특수를 누리는 시기였는데요. 그런데, 올해는요,  사정이 많이 다르다고 합니다.돼지고기 수요가 많아야할 시기인데 찾는 사람이 오히려 줄고, 그래서  돼지고기값도 내려가고 있다는 겁니다. 한국육류유통수출협회에 따르면 이번달 셋째주, 그러니까 지난주 돼지고기 평균 도매가격은 1㎏당 3149원으로 그 전주 가격인 3771원보다  13%가까이 떨어졌습니다. 2주 연속 돼지고기 값이  떨어진 건데,  대목이라는 12월에 이런 일이 일어난 겁니다. 이런 가격은  농업관측본부와 협회가 예상한 이달 돼지고기 평균 도매가인 3600원에서 3900원에 못 미치는 수준입니다. 양돈 농가의 대목을 이끌 이른바 '송년회 돼지고기 특수'가 왜 약해진 걸까요?먼저 이 이야기를 해야할 것 같은데, 예전에는 기업에서  반드시 송년회를 하는  문화가 있었다면,  요즘엔 송년회를 해도 그만,  또 안 해도 그만이라는  문화가 있는 게 사실입니다. 단체로 모여서 밥을 먹는 게  과연 무슨 의미가 있을까하는  젊은 직장인들이 많은 게 사실이죠. 또 송년회를 한다고 하더라도  '삼겹살에 소주 한잔' 이런 식의, 이른바 '정통파 방식'이 아닌  영화나 연극 관람 등으로 송년회를 하는 경향도 늘고 있죠.  이런 식으로 회식이나 송년회 문화가 바뀌고 있는 데다가, 결정적으로 지난 9월에는 국내에서 처음  아프리카돼지열병이 발병하면서 돼지고기 소비가 큰 타격을 받았습니다.병에 걸린 돼지고기는  아예 출고 자체가 되지 않고, 정말 정말 혹여나 먹더라도  인체 감염 가능성이 없는데도 말입니다. 그러니까 송년회 시즌 전부터 양돈 농가의 시름은 깊어진 건데요, 겪고 있는 어려움, 어느 정도일까요? 지금 보시는 화면, 전주의 축협 행사장 모습인데요.막연한 불안감에  돼지고기가 안 팔리다보니까 소비자들에게  안전을 홍보하면서..삼겹살부터 목살까지 시중 가격의 70% 아래로 싸게 팔면서  소비자들에게 어려움을 호소하고 있는 겁니다.양돈 농가들은 이제  생존을 걱정해야 하는 처집니다.값이 떨어지다보니 애타게 키운 돼지를  팔면 팔수록 손해기 때문입니다. 이른바 '사룟값도 안 나온다' 이 이야기죠.이야기 들어보시죠.[김정기/한돈협회 완주군 지부장/지난달 15일 : ""지금 돼지 한마리 팔면 110kg 기준, 12만 원 적자가 나고 있습니다. 우리 돼지 안심하고 드시면 좋겠습니다.""]전반적으로 돼지고기 소비가 줄다보니까..소시지 생산업체 등 육가공업계에서도 가공 물량을 줄이고 있습니다. 이렇게 농가, 육가공업계, 소매점 등 업계 전반으로 불황이  확대되는 모양새입니다. 그렇다면 앞으로는 어떨까요? 양돈농가에선  이제 설 명절 수요를 기대하고 있습니다.하지만, 문제는  설 명절이 지나고 나면  돼지고기 소비가 살아날만한  호재가 없다는 겁니다. 전반적인 소비 불황에다  소고기와 닭고기 등 대체재들이  약진하고 있기 때문입니다. 양돈농가의 시름이  이래저래 깊어지고 있습니다. 친절한뉴스였습니다.우정화 기자 (jhw01@kbs.co.kr)▶ ‘애피소드’KBS의 첫 동물 뉴스 프로그램!▶ 콕! 찍어주는 재미 ‘크랩(KLAB)’▶ 네이버 채널 KBS뉴스 구독! 시원하게 털어드립니다"
18,2019.12.11. 오전 4:02,[너섬情談-황교익] 갈라파고스가 된 치킨 공화국,"‘소확행’할 게 치킨뿐인 국민들이라 대형보다 맛은 떨어져도 ‘1인1닭’할 소형을 지지한국의 치킨은 맛이 없다. 이 평가는 나의 개인적인 기호에 따른 것이 아니다. 과학적으로 맛이 없다. 농촌진흥청이 ‘육계 경영 관리’라는 책자에서 한국 치킨은 맛없음을 과학적 데이터로 공박한 바가 있다. 치킨 공화국 대한민국의 치킨은 1.5㎏짜리 소형 육계로 튀긴다. 외국은 2.8㎏ 내외의 대형 육계로 치킨을 튀긴다. 2배 차이가 난다. 농촌진흥청은 1.5㎏짜리 소형 육계와 비교해 2.8㎏짜리 대형 육계의 맛이 어떤지에 대해 이같이 설명하고 있다. “고기 맛에서 중요한 역할을 하는 지방이 일반 닭은 0.12%인 것에 반해 대형 닭은 0.46%로 3.8배임. 감칠맛 나는 핵산물질 이노신산 함량이 일반 닭에 비해 대형 닭이 많음. 쓴맛을 내는 무기물 성분인 P(인)가 일반 닭은 2412ppm이고 대형 닭은 2251ppm. 이외에도 쫄깃함을 느끼게 하는 전단력, 소비자가 좋아하는 황색소 등이 일반 닭에 비해 대형 닭이 많음.” 대형 육계라는 단어에 노계나 폐닭을 떠올리는 사람들이 있다. 노계나 폐닭은 산란계에 쓰이는 용어이다. 달걀 생산 효율이 떨어지는, 2~3년 묵은 산란계는 솎아내게 되는데, 이런 산란계가 노계 혹은 폐닭이라는 이름으로 시장에 나온다. 육계는 노계니 폐닭이니 하는 것이 없다. 육계(肉鷄)는 이름 그대로 고기를 먹기 위한 닭이므로 적절한 몸무게가 나가면 바로 잡는다. 1.5㎏짜리 육계는 사육 일수가 30일이고, 2.8㎏짜리 육계는 사육 일수가 40일이다. 대형 육계는 소형 육계에 비해 10일 더 키울 뿐이다. 치킨 공화국 대한민국에는 “영계가 맛있다”는 신화가 떠돈다. 영계는 연계(軟鷄)의 ‘연’을 영어 ‘영(young)’으로 대체한, 말장난으로 탄생한 단어이다. 연계는 ‘연한 닭’이라는 뜻이다. 닭은 120일 정도에 이르면 어른 닭이 된다. 암탉은 알을 낳고 수탉은 암탉을 거느리는 장닭이 된다. 어른 닭이 되면 닭고기가 질겨진다. 그 이전의 닭이 연계이다. 대체로 100일 전후의 닭을 연계라 하였다. 치킨 공화국 대한민국 외 다른 나라 국민이 먹는 대형 육계는, 농촌진흥청이 권장하는 대형 육계는, 40일 정도 키운 닭이다. 예전의 연계를 기준으로 보면 병아리 수준이다. 그러니 대형 육계는 영계가 아니므로 맛이 없을 것이라는 말은 반관습적이며 비과학적이다. 육계를 크게 키우면 치킨 가격이 올라가지 않을까 걱정을 하는 분들이 있을 것이다. 닭을 키우는 데 10일이 더 걸리니 비용이 발생한다. 그런데 10일간의 고기 증산으로 얻는 이익이 10일간의 사육 비용을 상계하고도 남는다. 40일 키운 2.8㎏짜리 대형 육계가 30일 키운 1.5㎏짜리 소형 육계보다 경제적이다. 농촌진흥청의 과학적 설명은 이렇다. ‘대형 육계 생산의 이점’이라는 제목 아래에 있는 설명이다. “생산비 20% 수준 절감. 병아리 가격 25% 이상 절감. 생산자재 30% 수준 절감. 노동력 30% 수준 절감. 가공비 20% 수준 절감.” 대형 육계로 치킨을 튀기면 맛도 좋아지고 닭고기 무게당 가격까지 싸지게 된다. 농가는 생산비를 줄여서 이득이고 소비자는 치킨 가격이 조금이라도 내릴 것이니 이득이다. 무엇보다도 치킨 공화국 대한민국 국민이 맛있는 치킨을 먹을 수 있어서 이득이다. 모두가 이득이다. 소형 육계 치킨을 마리당 파는 업체들 빼고는. 치킨 공화국 대한민국 국민 모두에게 이득인 대형 육계 치킨이 왜 우리에게는 주어지지 못하는 것일까. 세계인들은 다들 맛있고 값싼 2.8㎏의 대형 육계로 치킨을 조리하여 먹는데, 왜 치킨 공화국 대한민국 국민만 맛없고 비싼 1.5㎏의 소형 육계로 치킨을 조리하여 먹는 것일까. 대한민국은 도대체 어떻게 하여 갈라파고스가 되었을까. 한국만 유독 작은 닭으로 치킨을 튀기고 이 치킨은 맛이 없다는 말을 하는 내게 돌아오는 것은 비난뿐이다. “외국인도 맛있다고 하는 한국 치킨을 왜 맛없다고 하나요. 비애국자입니다”라고 공격한다. 너무 작아서 ‘1인 1닭’을 할 수밖에 없는 소형 육계 치킨을 마치 맛있어서 ‘1인 1닭’을 하게 된 듯이 허위 마케팅을 하는 업체들을 소비자들이 적극적으로 보호하는 진풍경이 벌어지고 있다. ‘소확행’ 할 수 있는 것이라고는 치킨밖에 없는 치킨 공화국 국민의 애달픈 자존심이 이 나라를 갈라파고스로 격리시키고 있다. 슬픈 치킨이다.황교익 칼럼니스트[국민일보 채널 구독하기][취향저격 뉴스는 여기] [의뢰하세요 취재대행소 왱]GoodNews paper ⓒ 국민일보(www.kmib.co.kr), 무단전재 및 재배포금지		"
19,2019.12.27. 오후 7:45,‘바른 먹거리’ 위한 상생협력 훈풍 … 식품업계 상생협력은,"			과거에 비해 먹거리에 대한 관심이 높아지면서 국내 식품산업도 꾸준히 성장해 왔다. 식품산업통계정보(FIS)에 따르면 지난 2016년 식품산업 시장규모는 205.4조원으로, 이는 10년 전인 2006년과 비교해 109.5%(약 107조원) 증가한 수치다. 이러한 성장세와 함께 소비자들의 소비성향도 변모하고 있다. 식품을 고르는 기준과 안목이 까다로워진 것은 물론이고, 이를 넘어서 윤리적인 생산․유통 과정을 거친 ‘바른 먹거리’에 대한 관심이 커지고 있는 것.이에 식품업계는 농가 또는 협력사와의 상생협력을 통해 ‘바른 먹거리’ 생산에 박차를 가하고 있다. 기업이 보유한 원료 재배 노하우나 품질 관리 프로세스 교육, 자금지원 등을 통해 협력사의 경쟁력을 제고시킴으로써 높은 품질의 원료 또는 제품을 공급받는 선순환 구조를 구축하는 것이다. 글로벌 기업부터 국내 기업까지 식품 및 유통업계의 상생협력 사례를 모아봤다.◆ 네슬레, 커피 농가와 상생하는 ‘네스카페 플랜’글로벌 식품 기업 네슬레의 커피 브랜드 네스카페는 일찍이 지역 커피 농가와 상생협력의 일환으로 ‘네스카페 플랜’을 시행해 오면서 지속가능한 커피 생산을 실현하고 있다. 네스카페는 2010년 커피가격이 폭락한 데 반해 중간상인들이 취하는 이득은 커져 농가의 수익성이 하락하고 있는 상황을 확인하고, ‘지속적인 커피 공급망 개선’을 목표로 한 네스카페 플랜을 시작했다.네스카페 플랜 제공2016년까지 커피 재배 농가에 생산력 및 질병 저항력이 강한 커피 묘목을 1억6000만 그루 이상 제공했으며, 커피 농가에 농업 기술을 교육하고 원두를 직접 구매했다. 이를 통해 커피 농가들은 작물의 품질 개선을 달성하고 높은 소득을 올렸으며, 네스카페 또한 이들을 통해 안정적으로 고품질의 원두를 확보할 수 있었다. 네스카페는 농가 존중, 지역사회 존중 및 지구 존중 이라는 3가지 기반으로 2020년까지 총 3억 5천만 스위스프랑(한화 약 4186억)을 투자해 2억2000 그루의 묘목을 배포하고, 책임감 있게 재배된 원두 공급량을 전체 커피 공급량의 70%까지 늘려나간다는 계획이다.◆ 하림, 협력사 경쟁력 제고를 위한 동반성장 프로그램하림은 지속적인 동반성장 프로그램을 통해 협력업체들과 상생을 추구하고 있다. 지난해 하림은 업계 최초로 협력사의 경쟁력을 높이고 지속성장을 지원하기 위해 상생펀드 80억원을 조성 및 운영했다. 농가를 비롯해 협력사 50여개 기업의 원활한 자금조달과 성장을 지원하기 위해 상생펀드 80억원을 조성해 저금리로 사업자금을 지원 계획을 세운 것. 지난 4월 닭고기 가공제품 생산설비 현대화를 희망하는 김제의 한 식품업체에 상생펀드 4억1000만원을 대출키로 결정하며 상생펀드 첫 결실을 맺었다. 최근에는 협력업체와의 동반성장 도모를 위해 기술혁신 컨설팅을 열었으며, 협력사들의 자동화 설비 도입과 생산성 향상을 위해 상생펀드를 지원하고 전문 인력 양성을 위한 교육에도 참여할 수 있는 다양한 프로그램을 마련해 나가기로 약속했다.◆ GS리테일, 파트너사 HACCP 인증 취득 돕기 위한 ‘GS리테일 해썹아카데미’GS리테일은 GS25와 GS수퍼마켓에 상품을 공급하는 중소 식품 제조 파트너사들의 위해 ‘HACCP(안전관리인증기준)’ 인증 취득을 돕기 위해 ‘GS리테일 해썹아카데미’를 진행하고 있다. GS리테일은 중소 파트너사들이 해썹 인증 취득에 대한 니즈는 있으나 취득 준비에 어려움을 겪는 것을 확인하고, 중소 파트너사에 실질적인 도움이 될 수 있도록 교육 및 컨설팅을 제공하는 것. 특히 교육에 필요한 모든 비용은 GS리테일이 대신 지불해 중소 파트너사들의 비용 부담을 덜어줬다. 해썹아카데미를 통해 중소 파트너사들은 물질적, 시간적 낭비 없이 보다 체계적으로 해썹 인증 취득을 준비할 수 있으며, GS리테일 역시 중소 파트너사의 경쟁력 강화가 상품력으로 이어지는 상생 관계를 이어갈 수 있게 됐다고 회사 측은 평가했다. 강동완 기자 enterfn@mt.co.kr▶ 영상으로 보는  고수들의 재테크 비법 ▶ 박학다식 '이건희칼럼' <저작권자 ⓒ '성공을 꿈꾸는 사람들의 경제 뉴스' 머니S, 무단전재 및 재배포 금지>		"
