,날짜,기사제목,기사내용
0,2019.12.21. 오전 12:47,"브라질, 소고기 중국 수출 증가로 내수시장 가격파동 우려","			올해 소비자 가격 25% 이상 올라…당국, 물가 관리에 비상(상파울루=연합뉴스) 김재순 특파원 = 중국에 대한 브라질산 소고기 수출이 빠르게 늘어나면서 브라질 국내에서 가격 파동이 우려되고 있다.    소고기 소비자 가격 급등으로 물가 안정 기조가 흔들리면서 당국의 물가 관리에 균열이 생겼다. 20일(현지시간) 브라질 정부의 통계기관인 국립통계원(IBGE)에 따르면 소고기 소비자 가격은 이달 들어서만 17.71% 오른 것으로 나타났다.    올해 전체적으로는 25.69% 올라 물가 상승을 부추기는 요인으로 지적되고 있다.    이에 따라 12월 물가 상승률이 1%를 넘을 가능성이 있는 것으로 관측되면서 당국의 물가 관리에 비상이 걸렸다. 11월까지 최근 12개월 물가 상승률은 3.27%, 올해 1∼11월 누적 물가 상승률은 3.12%로 집계됐다.    올해 연간 물가 상승률이 중앙은행의 억제 목표 범위인 2.75∼5.75%를 벗어나지는 않을 것으로 보이지만, 역대 최저 수준을 유지하던 물가 안정 기조는 흔들리게 됐다.    중앙은행은 물가 상승률 기준치를 4.25%로 설정하고 ±1.5%의 허용 한도를 두고 있다.브라질의 육류 매장중국에 대한 브라질산 소고기 수출이 빠르게 늘어나면서 브라질 국내 소비자 가격 급등으로 물가 안정 기조가 흔들리고 있다 [브라질 뉴스포털 UOL]앞서 브라질 언론은 국내 소고기·돼지고기·닭고기 생산이 꾸준히 늘고 있으나 중국에 대한 수출이 빠르게 늘어나면서 내수 물량이 부족해져 소비자 가격이 가파른 상승세를 나타내고 있다고 전했다.    브라질 경제연구재단(FIPE) 자료를 기준으로 육류 소비자 가격은 지난 10월부터 10% 안팎의 상승세를 나타내고 있다.    중국 정부는 브라질산 육류, 특히 소고기 수입을 대폭 확대하겠다는 뜻을 밝혔다.    브라질소고기수출업협회(Abeic)에 따르면 지난해 중국에 대한 브라질산 소고기 수출은 32만2천400t(14억9천만 달러)으로 수출량과 수출액은 2017년 대비 52%와 60% 증가세를 나타냈다.    미국 농무부 자료를 기준으로 브라질의 소고기 생산량은 2017년 955만t에서 2020년에는 1천80만t으로 13% 늘어날 것으로 보인다. 수출량은 185만6천t에서 260만t으로 40% 증가할 전망이다.    돼지고기 생산량은 372만5천t에서 415만5천t으로 12% 늘어나고, 수출량은 78만6천t에서 105만t으로 34% 증가할 것으로 예상된다.    닭고기 생산량은 1천361만2천t에서 1천397만5천t으로 3%, 수출량은 384만7천t에서 404만t으로 5% 증가할 것으로 보인다. fidelis21c@yna.co.kr▶확 달라진 연합뉴스 웹을 만나보세요▶네이버 [연합뉴스] 채널 구독   ▶뭐 하고 놀까? #흥"
1,2019.12.23. 오후 2:08,"중국, 11월 돈육 수입 150% 급증…소·닭고기도 덩달아 늘어","[이미지출처=로이터연합뉴스][아시아경제 베이징=박선미 특파원] 아프리카돼지열병 영향으로 중국의 11월 돼지고기 수입량이 150%나 급증했다.23일 중국 해관총서 통계에 따르면 중국이 11월 수입한 돼지고기 양은 22만9707톤을 기록, 1년 전 같은 기간 보다 150% 넘게 증가했다. 11월 수입량은 전월 17만7426톤 보다도 30% 증가한 수치다. 세계 최대 돼지고기 소비국인 중국은 지난해 8월 발병한 아프리카돼지열병 때문에 아직까지도 돼지고기 공급부족이 심각한 상황이다. 게다가 내년 1월 돼지고기 소비가 많은 설 연휴를 앞두고 있어 도매상들은 돼지고기 재고 비축에 공격적으로 나서고 있다.지난 11월 중국의 돼지고기 가격은 작년 동월보다 110.2%나 급등했다. 이 여파로 중국의 11월 소비자물가지수(CPI)가 작년 동월보다 4.5%나 폭등하기도 했다.중국 정부는 돼지고기 공급 안정을 위해 돼지고기를 더 다양한 국가들로부터 수입하고 대체육 공급을 늘리고 있는 상황이다. 11월 중국의 닭고기 수입량은 7만7895톤으로 1년 전보다 70.9% 증가했고, 소고기 수입량 역시 18만6984톤으로 79.3% 늘었다.베이징=박선미 특파원 psm82@asiae.co.kr▶ 2020년 경자년(庚子年), 나의 신년운세와 토정비결은?▶ 즉석당첨! 아시아경제 구독하고 세로TV받자! ▶ 재미와 지식이 가득한 '과학을읽다'<ⓒ경제를 보는 눈, 세계를 보는 창 아시아경제 무단전재 배포금지>		"
2,2019.12.20. 오전 4:52,"브라질 대통령, 소고기 가격 상승에 ""원주민 땅서 사육 늘려야""","			광산 개발 활동 규제 완화도 추진…환경단체 반발 예상(상파울루=연합뉴스) 김재순 특파원 = 중국에 대한 소고기 수출 확대로 브라질 내 소비자 가격이 상승하자 자이르 보우소나루 대통령이 원주민 땅에서 소 사육을 늘려야 한다는 뜻을 밝혔다. 19일(현지시간) 브라질 언론에 따르면 보우소나루 대통령은 이날 소고기 가격 안정을 위한 대책의 하나로 원주민 땅에서 소 사육을 늘리는 방안을 적극적으로 고려할 것이라고 말했다.    실제로 소고기 가격 상승은 역대 최저 수준을 유지하던 물가를 자극하고 있다.    중국에 대한 수출이 급격하게 늘고 국내 공급 물량이 부족해지면서 11월 소고기 가격은 8.09% 올랐다.    소고기 외에 돼지고기·닭고기 수출도 빠르게 늘어나면서 육류 소비자 가격은 지난 10월부터 10% 안팎의 상승세를 나타내고 있다.브라질 대통령 '엄지 척'보우소나루 대통령이 브라질리아 대통령궁 앞에서 지지자들에게 엄지손가락을 세워 인사하고 있다. [브라질 뉴스포털 UOL]보우소나루 대통령은 소 사육 확대뿐 아니라 광산 개발을 허용하는 법안도 곧 의회에 보낼 것이라고 말했다.    보우소나루 대통령의 발언은 원주민 보호구역에서 소 사육과 광산 개발을 대폭 허용하겠다는 뜻을 밝힌 것으로 해석되면서 환경단체 등의 강한 반발이 예상된다.    한편, 브라질에서 원주민 보호 활동을 벌이는 종교단체 '목회자위원회(CPT)'는 최근 발표한 자료를 통해 올해 아마존 열대우림 등에서 발생한 충돌로 최소한 27명이 살해됐으며 이 가운데 원주민 지도자가 7명 포함됐다고 밝혔다.    원주민 지도자 피살 사례는 11년 만에 가장 많다. 지난해는 2명이 피살됐다.    위원회는 최종 자료가 내년 4월께 나올 것이라며 실제 인명피해는 훨씬 더 많을 수 있다고 말했다. fidelis21c@yna.co.kr▶확 달라진 연합뉴스 웹을 만나보세요▶네이버 [연합뉴스] 채널 구독   ▶뭐 하고 놀까? #흥"
3,2019.12.26. 오전 9:57,닭·오리·계란도 이력제 시행…비용 상승에 가격 오를라 ‘촉각’,"내년부터 축산물 이력제 확대 시행업계는 산업위축 우려·재검토 주장  생산비 상승에 가격인상 우려도[헤럴드경제=이혜미 기자] 소와 돼지에만 적용됐던 축산물 이력제가 내년부터 닭·오리·계란 등 가금산물까지 확대된다. 이들 축산품에 대한 소비자 신뢰가 강화돼 소비가 활성화되는 등 순기능을 기대하는 시선이 크다. 다만 관련 시설 유지 및 보수 등에 비용 발생이 불가피해, 이같은 농가의 비용 상승이 가격 인상으로 이어지지 않을까 하는 우려도 나온다.26일 농림축산식품부에 따르면, 기존 소와 돼지에 적용해온 축산물 이력제가 내년 1월1일부터 닭·오리·계란(가금산물)까지 확대된다. 축산물 이력제는 가축·축산물의 이력 정보를 투명하게 공개해 가축 방역과 축산물에 대한 소비자 신뢰를 높이기 위한 제도다. 이에 따라 내년부터 닭·오리·계란도 사육·도축·포장·판매 등 단계별로 이력을 공개해야 한다.사육 단계에선 농장 등록, 가축 이동 신고, 사육 현황 신고 등이 의무화된다. 닭·오리 농장주는 매달 말 사육 현황을 축산물품질평가원 또는 축산물이력제 모바일 앱을 통해 신고해야 한다. 농장 등록을 하지 않은 경영자는 축산물품질평가원에 농장식별번호를 신청해야 한다. 도축 단계에선 이력번호를 신청·표시하고, 도축 처리 결과와 거래 내역을 신고해야 한다. 계란은 이력관리시스템을 통해 이력번호를 발급받아 포장지에 표시하고, 판매점 등과 거래한 내역을 신고할 필요가 있다.닭 사육농장 관련 이미지 [제공=123rf]농식품부는 축산물 이력제가 확대 시행되면 위생 문제 등이 발견됐을 시 신속하게 이동 경로를 추적해 회수 및 유통 차단이 가능해질 것으로 기대하고 있다.다만 사육농가에선 육계시장이 침체된 가운데 이력제 시행에 따른 추가 비용이 발생할 경우 산업 위축이 더 심화될 것으로 우려하고 있다. 현재 닭고기 시장은 공급과잉 상황이 장기화하고 있는 데다 냉동 닭고기 수입은 지속 증가하고 있어 시름이 깊은 형편이다. 축산물품질평가원이 운영하는 축산유통정보에 따르면 올해 11월 평균 생계(중, 1.4㎏ 이상~1.6㎏ 미만) 유통가격은 ㎏당 1054원으로 전년 동월(1242원) 대비 15.1% 하락했다.업계에선 소·돼지와 가금류의 유통 환경이 다른 점을 감안해 계도기간 부여를 넘어, 제도 자체를 전면 재검토할 필요가 있다는 목소리도 나온다. 소·돼지 두수에 비해 닭 등의 개체수가 현저하게 많기 때문에 관리에 어려움이 더 클 수 밖에 없다는 것이다. 실제로 마니커의 경우 도계장 두 곳(경기 동두천, 충남 천안)에서 하루 작업하는 물량만 약 30만수에 달한다.계란의 경우엔 이미 산란일자 표시가 의무화돼 시행되고 있는 상황에서 이력제까지 적용하는 것은 효율성이 떨어진다는 게 업계 입장이다. 사실상 이중규제라는 지적이 나온다.일각에선 이력제 시행에 따른 추가 비용 발생이 가격에 영향을 미칠 가능성도 제기한다. 이력제 관련 인건비와 설비 유지 및 보수 비용 등이 발생하면서 이같은 생산비 상승이 소비자가격 인상으로 이어지지 않을까 하는 우려가 나오는 것이다. 앞서 한국축산물처리협회는 축산물 이력제와 관련 시설 유지·보수에 소요되는 비용을 정부에서 지원해줄 것을 요구하기도 했다.한 닭고기 가공업체 관계자는 “아직 닭고기 가격에 반영할 계획은 없지만 축산물 이력제로 인해 생산비가 약간 상승하는 것은 사실”이라며 “당분간은 기존 가격 그대로 운영하면서 추이를 지켜볼 예정이다”고 말했다.ham@heraldcorp.com▶네이버에서 헤럴드경제 채널 구독하기 ▶헤럴드경제 사이트 바로가기 - Copyrights ⓒ 헤럴드경제 & heraldbiz.com, 무단 전재 및 재배포 금지 -		"
4,2019.12.09. 오후 3:34,"올해 소비자 식품구입…“가격 중시, 대형 할인점 구입 늘어”","KREI ‘식품소비행태조사 결과발표대회’ 개최, 일본제품 불매운동과 식품소비도 조사2019 식품소비행태조사 결과발표대회 ⓒKREI작년과 올해 소비자들이 식품을 구입할 경우 ‘가격’을 가장 중요시한 것으로 나타났다. 2017년에는 ‘맛’과 ‘소포장’을 중시했었다. 식품을 주로 구입하는 장소로는 대형 할인점 구입이 늘어난 것으로 조사됐다. 대형 할인점 비중은 37.6%로 가장 높았고, 동네 중소형 슈퍼마켓에서 식품을 주로 구입하는 가구도 29.4%로 높은 수준이었으나 전년 대비 2.8%p 감소했다. 재래시장에서 식품을 구입한다는 응답 비중은 몇 년째 감소해 올해는 2016년 24.8%의 절반 수준인 11.5%를 기록했다. 작년 14.1% 보다도 2.6%가 줄었다.이 같은 결과는 한국농촌경제연구원(KREI)이 6일 서울 aT센터에서 개최한 ‘2019 식품소비행태조사 결과발표대회’를 통해 공개됐다. 인터넷으로 식품을 구입하는 가구의 비중도 지속적으로 증가했다. 올해는 절반(44.6%)에 가까운 가구에서 온라인을 통해 식품을 구입한다고 응답했으며, 이들 중 73.5%는 모바일을 통해 구입하는 것으로 나타났다. G마켓이나 쿠팡과 같은 오픈마켓·소셜커머스에서 식품을 구입하는 비중이 51.1%였으며, 30.7%는 대형 할인점의 온라인매장에서 식품을 구입하는 것으로 나타났다. 이 비중은 전년 대비 모두 감소했는데, 마켓컬리나 헬로네이처 등 온라인 식품 전문몰이 12.1%를 차지하며 성장한 것이 배경인 것으로 판단됐다. 오픈마켓·소셜커머스는 작년에 이어 ‘저렴한 가격’, 대형 할인점 온라인매장은 ‘좋은 품질’을 기반으로 소비자들의 선택을 받는 것으로 조사됐지만, 이 두 유통채널 간 차이가 올해 상당히 완화된 것으로 나타나 두 채널이 소비자의 선택을 받는 이유가 유사해지고 있는 특징을 보였다. 식품 구입 주기는 다소 길어졌는데, 주 1회 이상 식품을 구입한다고 응답한 비중이 2018년 89.0%를 차지했으나 2019년에는 84.4%로 하락했다. 구입 주기가 길어진 만큼 1회 식품 구입 시 지출액은 2018년 5만6001원에서 2019년 5만9792원으로 3800원 가량 증가했다.환경에 대한 관심이 증가하면서 친환경 식품을 구입하는 가구의 비중 또한 증가했다. 39.9%의 가구에서 친환경 식품을 월 1회 이상 구입한다고 답했으며, 친환경 식품을 구입하는 이유는 안전·건강·환경 순으로 나타났다. 안전이 차지하는 비중은 전년 대비 감소했으며, 건강과 환경 때문이라고 답한 비중은 전년 대비 상승하고 있는 추세다.건강에 대한 관심도 확대되면서 기능성 식품을 구입하는 가구의 비중 또한 늘었다. 기능성 식품을 취식하는 가구 비중은 77.9% 수준으로, 전년 대비 가장 크게 취식했다고 응답한 비중이 늘어난(16.8%→25.7%) 품목은 ‘발효미생물류(유산균, 프로바이오틱스)’인 것으로 나타났다.또한 올해 식품 주 구입 장소를 결정할 때나 식품류별 구입을 결정할 때 소비자들은 ‘가격’을 가장 중시했다. 가격(쌀·과일)에 이어 구입의 편리성(육류·유제품, 수산물), 맛(채소), 안전성(가공식품) 등으로 중요하게 생각했으며, 가장 중요하게 고려한다는 응답 비중이 가장 크게 감소한 항목은 품질(쌀·채소·과일), 맛(육류·유제품, 가공식품), 가격(수산물)인 것으로 나타났다.식품 구입 중 쌀 구입 시 10kg 미만으로 구입한다는 비중이 작년 7.7%에서 올해 8.0%로 소폭 증가했으며, 계란을 10개 이하로 구입한다는 비중 또한 2018년 23.8%에서 2019년 24.5%로 증가했다. 쇠고기·돼지고기·닭고기 구입 시 포장된 형태로 구입한다는 응답 비중 또한 빠르게 증가하고 있는데, 쇠고기의 경우 2018년 50.7%에서 2019년 55.9%로 상승했다. 수입 쌀 섭취 의향은 크게 증가(6.9%→12.8%)함에 따라 구입 경험도 16.0%에서 21.9%로 증가한 반면, 미국산 쇠고기 취식 의향은 감소(35.7%→30.3%)했다.일주일에 가족과 함께 식사하는 횟수는 소폭(0.13회) 감소해 12.0회였으며, 청소년의 규칙적 식사 비중은 전년(74.6%)에 비해 증가한 78.3%로 나타났으며, 성인의 규칙적 식사 비중은 전년 대비 2.4%p 감소해 71.9%를 기록했다. 이외에 특별조사로 진행된 ‘일본제품 불매운동과 식품소비’ 조사에서는 전체 소비자의 23.6%만이 일본 제품을 부정적으로 생각하고 있었음에도 불구하고, 81.5%가 일본제품 불매운동에 찬성했다. 실제 불매운동 찬반에 영향을 미친 것은 뉴스(94.3%)와 지인(80.6%)으로 나타났다. 불매운동으로 인해 실제 일본제품 구매를 포기한 경험이 있다고 응답한 소비자 중 일본 식품 구매를 포기했다고 응답한 소비자 비중이 83.9%로, 다른 제품군에 비해 압도적으로 높았다. 이는 일본제품 불매운동이 식품소비와 밀접하게 연결돼 있음을 시사한다. 향후 불매운동 지속 기간에 대해서는 1~3년이라고 응답한 비중이 34.4%로 가장 높았으며, 다음으로 3년 이상이 25.9%를 차지해 지속기간이 상당히 중장기화 될 가능성이 있음을 보였다.이 같은 2019 식품소비행태조사(CBSF, The Consumer Behavior Survey for Food)는 가구 내 식품 주구입자(3337가구), 성인(6176명) 및 청소년 가구원(610명)을 대상으로 조사했으며, 가구와 개인의 식품소비 및 외식행태와 식생활 파악을 목적으로 2013년부터 매년 실시되고 있다.데일리안 이소희 기자 (aswith@naver.com)ⓒ (주)데일리안 - 무단전재, 변형, 무단배포 금지		"
5,2019.12.31. 오후 3:15,"HMR·에어프라이어에 웃고, ASF에 울고…주류는 ‘테진아’","2019년 식품업계 결산HMR 고속성장하고, 에어프라이어와 냉동식품 상승효과ASF로 돼지고기 대한 소비자 불안감 증대하이트진로, 신제품 2종 연타석 홈런액상 전자담배 논란은 현재진행형CJ제일제당의 생선 HMR 시리즈 (사진=CJ제일제당)[이데일리 이성웅 기자] 올해 식품업계는 HMR(가정간편식)이 시장을 휩쓴 한해였다. 한켠에선 아프리카돼지열병(ASF)이 국내에 상륙하며 업계에 긴장감이 돌기도 했다.주류업계에선 간만에 히트상품이 탄생했다. 하이트진로의 맥주 신제품 ‘테라’와 소주 신제품 ‘진로이즈백’이 연타석 홈런을 쳤다. 담배업계는 연초 액상형 전자담배에 대한 기대감이 부풀었지만 미국발 건강 이슈로 이내 꺾였다. 다사다난했던 2019년 식품업계를 주요 이슈를 통해 되짚어 본다.◇불황 속 한줄기 희망된 HMRHMR은 최근 수년간 국내 식품업계에서 가장 빠른 성장세를 보여주고 있는 제품군이다. 식품업계가 불황을 겪고 있는 와중에도 HMR은 1인 가구의 증가가 빠른 매출 성장으로 이어졌다. 15일 한국농수산식품유통공사(aT)에 따르면 국내 HMR 시장 규모는 올해 4조원을 넘어설 전망이다. 오는 2023년엔 5조원 규모까지 성장해 지난 2016년 대비 2.5배 이상 커질 것으로 추정된다.HMR의 인기에 기존 제조업체들은 경쟁대상을 외식업체로 잡을 정도로 제품을 프리미엄화시켰다. 반면, 외식 프랜차이즈들도 자사 대표 상품을 앞세워 HMR 시장에 뛰어들었다.요리하는 즐거움을 놓치고 싶지 않는 소비자들을 겨냥한 ‘밀키트’ 시장도 활성화됐다. 이마트 트레이더스 ‘보이는 에어프라이어’ (사진=이마트)◇에어프라이어 뜨니 냉동식품도 활짝에어프라이어가 주방 필수 가전으로 자리잡으면서 냉동식품도 인기를 끌었다. 국내 에어프라이어 보급률은 40%를 넘은 것으로 추정된다. 등장 초기만 해도 고가의 제품이 많았지만, 최근에 저렴한 대용량 제품들이 속속 등장하면서 보급률이 폭발적으로 늘었다.에어프라이어로 간편하게 냉동식품을 조리할 수 있게 되면서 냉동식품도 다양화·프리미엄화를 겪었다. 제조업체들은 아예 에어프라이어 전용 냉동식품을 선보이고 있다. 신세계푸드는 에어프라이어 전용 브랜드 ‘올반 에어쿡’을 선보였다. CJ제일제당이 선보인 고메 프라잉스낵은 출시 100일만에 매출 220억원을 올려 전년 대비 50% 가까이 매출이 늘었다. 에어프라이어는 냉동만두 시장에도 훈풍을 불러왔다. 에어프라이어 조리를 염두에 두고 얇은 피와 푸짐한 속을 채운 프리미엄 만두들이 시장을 견인했다. 올해 냉동만두 시장 규모는 4800억원으로 역대 최대치를 기록할 전망이다.지난 10월 경남 창원에서 열린 ‘2019 마산국화축제’에서 관람객들이 한돈 요리를 시식 하고 있다.이번 행사는 아프리카돼지열병(ASF)으로 인한 국민 불안 해소와 한돈산업 위기 극복을 위해 진행된 소비 촉진 행사이다. (사진=대한한돈협회)◇우려하던 ASF, 결국 상륙세계적으로 ASF가 유행하면서 국내서도 우려의 목소리가 나오던 중 지난 9월 경기도 파주에서 첫 ASF 확진 사례가 나왔다.파주에 이어 김포, 연천, 강화까지 ASF가 삽시간에 퍼지면서 돼지고기 수급에 비상이 걸렸다. ㎏ 당 돼지고기 가격은 한때 6000원을 넘기며 40% 이상 오르기도 했다. 식품업계도 비상사태였다. 당장 돼지고기 수급이야 수입산으로 대체하면 되지만, 돼지고기가 들어간 가공육에 대한 소비자 불안감은 쉽게 잡을 수 있는 것이 아니기 때문이다.ASF 초기 폭등했던 돼지고기 가격은 소비 위축으로 이내 폭락해 농가 위기로 이어졌다. 돼지고기의 생산자물가는 지난 10월, 전월 대비 32.5% 떨어졌다. 돼지고기 도매가격은 kg당 3156원으로 전년 동기 대비 19.3% 낮았다. 다행히 연말을 향해 갈수록 ASF가 잡히면서 돼지고기 가격도 지난달부터 서서히 정상범위에 들어가기 시작했다.ASF 유행은 대체육에 대한 관심이 높아지는 계기도 됐다. 기존 돼지고기의 대체재인 닭고기는 물론 실험실에서 만들어진 인공육 개발도 활기를 띠기 시작했다.하이트진로 ‘테라’(왼쪽)와 ‘진로이즈백’ (사진=하이트진로)◇‘테진아’가 쌍끌이한 주류업계주류업계에선 하이트진로가 최고의 한해를 보냈다. 테라는 지난 3월 출시 후 누적 판매량이 4억5600만병을 넘어섰다. ‘청정라거’ 콘셉트로 출시한 테라는 초록색 맥주병과 호주 골든트라이앵글 맥아 등으로 기존 제품들과 차별화를 뒀다. 레트로 열풍에 기댄 진로이즈백 역시 시장에서 성공을 거뒀다. 과거 국내 대표 소주였던 ‘진로’의 하늘빛 병으로 향수를 불러 일으키면서도 도수는 16.9도로 낮춰 젊은층까지 사로잡았다. 출시 2달만에 1000만병을 팔아 연간 목표치를 조기에 달성했다. 지난 11월말 기준으로 1억병이 넘게 팔렸다. 여기에 기존 소주 ‘참이슬’은 경쟁상대인 롯데주류 ‘처음처럼’이 주춤한 사이 시장 1위를 공고히했다. 그 결과 하이트진로는 턴어라운드에 성공했다. 지난 3분기 영업이익은 492억원으로 전년 동기 대비 67.9% 증가했다. 매출은 5291억원으로 5.8% 늘었다.지난 10월 서울 시내 편의점 GS25에서 점원이 판매중단된 가향 액상 전자담배를 수거하고 있다. GS25는 정부의 사용 중단 권고에 따라 이날부터 쥴에서 생산하는 액상 담배 트로피칼·딜라이트·크리스프 3종과 KT&G의 시트툰드라 1종 등 총 4종의 판매를 중단하기로 했다. (사진=연합뉴스)◇반년 채 못 간 ‘액상형 전자담배’ 기대감담배시장에선 연초부터 액상형 전자담배에 대한 기대감이 커졌었다. ‘전자담배계의 애플’로 불리는 쥴랩스가 국내 시장에 진출하며 폐쇄형 액상 전자담배(CSV) 시장을 열었다. 이어 KT&G도 ‘릴 베이퍼’를 출시해 액상형 시장에 맞불을 놨다.잇따라 신제품이 나오며 액상형 전자담배 시장 점유율은 지난 5월 0.85%에서 6월 1.3%로 증가했다. 액상형 전자담배가 기지개를 펴고 있을 즈음 미국에선 액상형 전자담배가 원인으로 추정되는 폐손상 사례가 1500건 가까이 발생했다. 이에 우리 정부도 지난 10월 사용 중단을 강력하게 권고했다. 편의점 등 주요 유통업체들도 자체적으로 판매 중단을 결정했다. 식품의약품안전처가 나서 액상 성분 분석을 진행한 결과 쥴랩스와 KT&G를 포함해 총 13개 제품에서 비타민E 아세테이트가 검출됐다. 이는 미국 질병통제예방센터가 유력한 폐 손상 의심물질로 지목한 성분이다. 비타민E 아세테이트 외에도 글리셀린 등 성분에 대한 인체 유해성 검증도 아직 남아있다.전자담배 사용자와 업계 관계자들이 모인 한국전자담배산업협회에선 정부가 증세를 위한 포석을 깔고 있는 것이라며 팽팽한 대립이 이어지고 있다.이성웅 (saintlee@edaily.co.kr)네이버 홈에서 ‘이데일리’ 뉴스 [구독하기▶]꿀잼가득 [영상보기▶] , 청춘뉘우스~ [스냅타임▶]＜ⓒ종합 경제정보 미디어 이데일리 - 무단전재 & 재배포 금지＞"
