,날짜,기사제목,기사내용
36,2019.03.10. 오후 12:46,하노이회담의 아쉬움을 달래줄 베트남 쌀국수 맛집 [주바리의 까칠한 味수다],"띤띤 쌀국수지난주 하노이 북미회담이 모두의 바람을 깨고 결렬돼 실망이 크셨죠? 기대하던 ‘빅딜’은 고사하고 ‘노딜’로 끝나는 바람에 김이 새 버렸으니 말이죠. 주바리는 번외로 김정은 위원장과 트럼프 대통령의 ‘쌀국수 만찬’이 있지는 않을까 기대감을 갖고 있었거든요. 아니면 김 위원장이 싱가포르의 경우처럼 일정에 없던 관광을 마친 후 하노이 쌀국수 맛집에 깜짝 방문을 하지는 않을까 내심 기다렸지 뭡니까. 우리의 아쉬운 마음을 맛있는 베트남 식당에 가서 풀어보면 어떨까 합니다. 제가 태국 다음으로 좋아하는 동남아 음식인 베트남 요리. 최근엔 ‘제2의 붐’이 일어난 듯 프랜차이즈 쌀국수 집들이 우후죽순 생겨났지만 제대로 하는 곳이 없어 서운하셨던 분들 함께 가 보아요.■ 팻누들(구 포치민)블링블링한 인테리어로 방문할 때마다 기분 좋아지는 광화문 디타워 5층에 위치한 ‘팻누들’은 미국식 베트남 요리를 선봬는 곳이랍니다. 가장 기본인 쇠고기 쌀국수는 무난하게 호불호 없는 맛이더라고요. 나쁘게 말하면 개성이 없는 듯해도 쌀국수 초보자의 입문용으로도 강추해요. 팻누들 쌀국수팻누들닭고기 요리도 호평이 자자하고 매운 향을 가미한 오징어튀김인 ‘팻츠 스파이스 스퀴드’를 맛보니 튀김 공력이 제법이더라고요. 중간에 숙주를 추가해 달라고 하면 생으로 줄지 데친 것으로 줄지 묻는데요. 꼭 데친 숙주를 넣으시길. 식은 국물에 생숙주를 넣으면 비린내가 날 수 있거든요. 짜조(6500원)는 가격에 비해 양도 부실할뿐더러 맛도 soso하니 비추 메뉴.■비엣콴MSG 맛이 느껴져 프랜차이즈 쌀국수 집에 절대 안 가는 주바리의 입맛을 사로잡은 ‘비엣콴’은 현지인 요리사가 만든 베트남 요리를 맛볼 수 있습니다. 특히 하노이식 쌀국수라 오늘 주제와도 딱 맞는 식당. 원래 베트남 북부지방 쌀국수는 숙주를 넣지 않지만 요구하는 손님들이 많은지 따로 접시에 내주더라고요. 빼고 먹으면 국물맛이 섭섭한 고수도 부족하면 추가해 줘요. 무엇보다 진한 육수가 일품. 비엣콴 쌀국수비엣콴 냄차가운 국물에 돼지고기 볶음과 쌀국수를 담가 먹는 분짜도 별미이고, 숯불향이 살아 있는 꼬치나 새우와 야채가 알차게 들어 있는 베트남 만두 ‘냄’도 맛보지 않으면 서운할걸요. 점심시간에는 쌀국수나 볶음밥에 전병+음료수로 구성된 세트메뉴가 착한 가격에 제공되는 것은 꿀팁. 위치는 헌법재판소를 조금 지나 재동초등학교 옆길로 20~30m 들어오면 2층에 위치해 있어요.■띤띤주바리의 ‘최애’ 베트남 쌀국수집인 ‘띤띤’은 경리단길 주택가 사이에 위치해 있어요. 아직 ‘미식회’ 등 맛집 소개 방송을 타지 않은 덕에 소문 안 내고 몰래 아껴두고 있었더랬죠ㅋㅋ. 좌석이 대여섯개뿐인 작은 공간이라 오히려 아늑한 분위기가 저는 좋더라고요. 다른 식당과 달리 띤띤의 쌀국수 국물은 닭고기를 베이스로 해요. 그래서 감칠맛이 더 풍부하죠. 얼큰한 게 당기시면 ‘스파이시 씨푸드 누들 스프’을 추천해요. 띤띤이 매력적인 건 모닝글로리(공심채), 그린파파야샐러드(솜땀) 등 현지 맛을 살린 사이드 메뉴도 훌륭하기 때문이죠. 게살볶음누들을 올리거나 양념된 돼지고기를 곁들인 밥 메뉴도 빠지지 않아요. 가짓수가 많지 않기 때문에 2~3번 방문으로 메뉴도장깨기 가능. 하노이나 사이공 맥주를 곁들이면 금상첨화랍니다.띤띤 스파이시 누들띤띤최근엔 광화문 SFC빌딩 지하 식당가에 2호점을 오픈했다고 하니 ‘서식지’ 인근이시면 참조하시길…. 물론 본점만은 못하다는 평이 있긴 하더라고요ㅋㅋ. 쌀국수 맛집으로 퍼펙트에 가까운 ‘띤띤’의 한 가지 흠이라면 메뉴판이 현지 언어와 영어로만 돼 있다는 점.주현수 기자 joohs@kyunghyang.com▶ [스포츠경향 인기 무료만화 보기]▶ [지금 옆사람이 보고있는 뉴스]©스포츠경향(sports.khan.co.kr), 무단전재 및 재배포 금지		"
37,2019.03.06. 오후 2:37,"그랜드 앰배서더 서울 풀만 더 킹스 '봄, 프랑' 프로모션","그랜드 앰배서더 서울 어소시에이티드 위드 풀만의 프리미엄 라이브 뷔페 '더 킹스 (THE KING'S)'는 오는 4월 30일까지 '프랑스의 봄(Le Printemps de France)'을 테마로 한 '봄, 프랑' 프로모션(사진)을 선보인다고 6일 밝혔다.이번 프로모션으로 신선한 제철 식재료를 이용한 프렌치 메뉴들이 섹션 별로 준비된다. 니스식 샐러드(Salade Niçoise), 연어 리예트(Salmon Rillettes), 디종식 닭고기 요리(Chicken Dijon), 마늘, 허브, 버터를 곁들인 부르기뇽식 달팽이 요리(Escargot a la Bourguinonne), 사보아 지방의 감자 그라탱 타르티플레트(Tartiflette) 등 다채로운 요리와 디저트로 프랑스 미식을 경험할 수 있다. 또 치즈 섹션에서는 카망베르(Camembert), 브리(Berie), 에멘탈(French Emmental), 미몰레트(Mimolette), 그뤼에르 드 콩테(Gruyere de Comte)와 세계 3대 블루 치즈 중 하나로 손꼽히는 로크포르(Roquefort) 치즈까지 다양하게 제공돼 더욱 풍성한 다이닝을 선사한다.특히 오는 21일에는 매년 전 세계에서 펼쳐지는 프랑스 미식 축제 '구 드 프랑스(Goût de France)' 참여를 기념해 프랑스 남부지역인 프로방스(Provence) 지역 요리를 선보인다. 프로방스 지역은 지중해의 따뜻한 햇볕과 풍요로운 대지로 다양한 야채와 과일, 올리브 생산지로도 유명하다. 프로방스 허브를 곁들인 마르세유식 홍합, 지역 전통 요리인 생선 스튜 부야베스(Bouillabaisse), 프로방스식 채소 스튜인 라타투이(Ratatouille) 등 특색 있는 요리를 즐길 수 있다.한식, 중식, 해산물, 샐러드, 그릴, 디저트 등 10개 섹션에서 총 150여 가지 요리를 맛볼 수 있는 더 킹스에는 8석에서 40석까지 6개의 별실이 마련돼 있다. 가격은 성인 주중 점심 기준으로 8만 원(부가세 포함), 저녁은 8만 8000원이다.황상욱 기자 eyes@busan.com"
38,2019.03.18. 오전 9:33,마니커 온라인 쇼핑몰 '진심닭컴' 오픈...경쟁사보다 최대 15% 할인,"         닭고기 가공업체 마니커가 닭가슴살 전문 인터넷 쇼핑몰 '진심닭컴'을 오픈한다고 18일 밝혔다.  진심닭컴은 고객 신뢰를 높이기 위해 마니커가 자체 생산한 닭고기만을 원재료로 사용하고 직영으로 운영하는 정통 닭가슴살 쇼핑몰이다. 마니커는 그 동안 신선육 중심의 원료육 공급업체라는 이미지가 강했지만 '진심닭컴'을 통해 가공제품도 얼마든지 잘 만들 수 있다는 것을 입증하기 위해 진심닭컴을 오픈했다고.  진심닭컴의 가장 큰 특징은 재미와 편의를 고려한 제품구성으로 화면을 열면 가장 먼저 눈에 띄는 것이 독특한 명칭의 제품 메뉴다. 각각의 메뉴 명칭에 닭가슴살을 작은 볼 형태로 만들어 한입에 간편하게 먹을 수 있다는 의미의 '간편하닭', 스팀으로 조리해서 수분을 잡아 닭가슴살 특유의 퍽퍽한 느낌을 없애고 부드러운 식감을 살렸다는 의미의 '부드럽닭' 등 제품 특징을 그대로 적용해서 고객이 쉽게 선택할 수 있도록 만들었다. 그 밖에도 '요리닭', '순수닭', '씬난닭', '알차닭' 등 모두 6개의 메뉴에 데리야키와 양념치킨부터 허브, 깻잎, 청양고추까지 독특한 맛을 더하고 스테이크와 소시지 등 다양한 종류를 구비했다.  마니커는 타 쇼핑몰들보다 평균 10~15% 정도 할인된 가격에 제공하고 최저 10%부터 최대 14%까지 월등히 높은 구매 적립금을 지급하는 등 마진 포기수준의 가격 정책을 앞세워 '진심닭컴'을 가성비 최고의 닭가슴살 쇼핑몰로 만들겠다는 의지를 보였다.  마니커 관계자는 ""진심닭컴이라는 이름과 6개의 새 브랜드에 각오와 자신감이 그대로 담겨있다""며 ""품질과 맛, 가격 등 모든 면에서 경쟁 우위에 있어 머지 않아 닭가슴살 대표 쇼핑몰이 될 것""이라고 말했다.  한편 '진심닭컴'에서는 출석체크 쿠폰증정 이벤트, 구매고객 대상 100% 당첨 룰렛 이벤트, 100원 특가 이벤트 등 첫날부터 대대적인 오픈 기념행사로 축제 분위기를 띄우고 있다.   cynical73@fnnews.com 김병덕 기자   ▶ 세상의 모든 골 때리는 이야기 'fn파스'▶ 속보이는 연예뉴스 fn스타  ※ 저작권자 ⓒ 파이낸셜뉴스. 무단 전재-재배포 금지		"
40,2019.03.14. 오전 8:50,"홈플러스, 고기대방출 2탄...한우 최대 반값 할인","			홈플러스가 한우, 돼지고기 등을 대폭 할인하는 ‘고기대방출 2탄’에 나선다고 14일 밝혔다. 홈플러스는 지난 일주일(7~13일) 시행한 고기대방출 1탄 행사로 축산 매출이 급증하자, 14일부터 20일까지 추가로 행사를 진행하기로 했다. 홈플러스에 따르면 고기대방출 행사가 진행된 지난 일주일간 국내산 돈육은 평소 2배인 60톤이 팔려 나갔다. 홈플러스는 이번 행사를 위해 한우는 평소 5배 물량인 100톤을, 돼지 뒷다리는 평소 9배인 60톤을 준비했다. 훈제오리(2배), 수입육(5배), 닭고기(2배) 등도 평소보다 물량을 늘려 저렴하게 판매한다. 대표적으로 한우 곰거리는 회원을 대상으로 50% 할인한다. 1등급 등심 100g은 5690원에, 국거리·불고기용은 3493원에 판다. 돼지 뒷다리는 14~17일 시중 브랜드 돈육 값의 절반 수준인 350원에 선보인다. 홈플러스는 또 돈육 전품목과 냉동양지샤브샤브 3종을 각각 20%, 40% 할인할 계획이다. 쌈채소, 깐마늘, 청양고추, 토마토 등 다양한 야채도 저렴하게 판매한다. 이창수 홈플러스 마케팅총괄부장은 ""창립 22주년을 기념하고 서민 물가 안정에 기여하고자 3~6개월 전부터 품목별로 많게는 100배 이상의 물량을 확보하고 자체 마진 축소를 통해 주요 생필품 가격을 낮췄다""고 말했다. [안소영 기자 seenrun@chosunbiz.com]chosunbiz.com"
42,2019.03.14. 오전 6:53,"홈플러스 '고기 대방출' 성공에 2탄 진행한다…""돼지 뒷다리 100g에 350원""","[아시아경제 이지은 기자]홈플러스가 지난 주 진행한 '고기 대방출' 기획전 성공에 힘입어 2탄을 선보인다고 14일 밝혔다.홈플러스에 따르면 이달 7일부터 13일까지 일주일간 고기 대방출 기획전을 실시한 결과 전국 축산 매출이 전년 동기 대비 8% 이상 뛰었다. 닭고기는 고객들이 6만여 마리를 카트에 쓸어 담으면서 매출은 전년 동기 대비 30% 이상 신장했고, 양념육은 53%, 수입육은 11% 이상의 높은 매출 신장률을 기록했다. 또 국내산 돈육도 평소 2배인 60톤, 고등어는 10배인 5만 마리 이상 팔려 나갔다. 이에 홈플러스는 14일부터 20일까지 고기 대방출 2탄을 추가 전개키로 했다.농협안심한우를 마이홈플러스 회원 대상 최대 50% 할인한다. 한우 곰거리(사골·꼬리반골·잡뼈·우족)는 50% 할인 판매하며, 대표 상품인 1등급 등심(100g)을 5690원에, 1+등급 등심(100g)을 6890원에, 국거리·불고기(100g)는 각 3493원에 판다. 훈제오리 기획팩(1㎏)은 9990원, 돼지 뒷다리(100g)는 14~17일 4일간 시중 브랜드 돈육 값의 절반 수준인 350원에 판매한다. 마이홈플러스 회원 대상 브랜드 돈육 전품목과 냉동 양지 샤브샤브 3종(척아이롤, 양지, 업진살)은 각각 20%, 40% 할인 판매하며, 브랜드 닭고기도 최대 2000원 할인 판매한다. 훈제 삼겹(100g)을 1390원에, 두마리 후라이드 치킨을 9990원에 각각 판매한다. 고기와 함께 곁들이기에 좋은 다양한 식품도 저렴하게 판매한다. 친환경 쌈채소 4종은 각 2000원, 깐마늘, 청양고추, 미니쌈추, 먹적상추와 미니쌈추는 봉당 각 1500원에 판매한다. 이밖에도 홈플러스는 22주년을 기념한 '쇼핑하라 2019' 행사를 이달 27일까지 이어 가면서 장바구니 물가 부담을 낮춘다는 방침이다. 이창수 홈플러스 마케팅총괄부장은 ""창립 22주년을 기념하고 서민 물가 안정에 기여하고자 3~6개월 전부터 품목별로 많게는 100배 이상의 물량을 확보하고 자체 마진 축소를 통해 주요 생필품 가격을 낮췄다""며 ""3월 한 달간 대규모 행사를 전개하는 한편, 앞으로도 고객들의 생활 속에 빼놓을 수 없는 상품들을 저렴하게 선보여 나갈 것""이라고 밝혔다. 이지은 기자 leezn@asiae.co.kr▶ 아시아경제 채널 추가하고 에어팟, 해외여행비 받자!▶ 재미와 신기 '과학을읽다' ▶ 꿀잼 '인기만화'<ⓒ경제를 보는 눈, 세계를 보는 창 아시아경제 무단전재 배포금지>		"
52,2019.03.05. 오전 11:36,인조고기 식탁 오른다...첫 제품은 '치킨 너겟',"[한국경제TV 이영호 기자]동물 세포를 배양해 생산한 배양육이 연내에 시장에 나올 것으로 보인다.배양육은 동물에게서 떼어낸 작은 세포를 배양해 고깃덩이로 만든 것으로 장차 닥칠 것으로 예상되는 인류의 식량난 해결책이 될 것으로 기대된다.2013년 배양육으로 만든 세계 첫 햄버거 시식회가 영국 런던에서 열려 세계적인 뉴스가 됐지만 당시 햄버거 1개분 배양육 생산비가 개당 30달러 이상에 달해 실용화되지 못했다. 그러나 최근 미국 벤처기업이 배양육 생산비를 극적으로 낮추는데 성공, 상품화를 눈앞에 두고 있다고 NHK가 4일 보도했다.보도에 따르면 미국 캘리포니아주에 있는 스타트업 'JUST'사는 치킨 배양육을 몇달내로 시장에 내놓는다는 계획이다.이 회사 조시 테트릭 최고경영자(CEO)는 ""첫 제품은 치킨 너겟이 될 것""이라면서 ""몇개월내에 판매할 계획""이라고 말했다. 기술적으로 판매할 수 있는 단계까지 개발이 이뤄진 것으로 보인다.문제는 가격이다. 테트릭 CEO는 가격이 어느 정도가 될 것이냐는 거듭된 질문에도 가격 책정은 각국 개발업체의 경쟁에서 가장 중요한 전략의 하나라고 지적, 끝내 밝히기를 거부했다. 양산 규모에 따라서도 달라지는 만큼 현재로서는 밝힐 수 없다고 한다.첫 판매국이 어디가 될 것이냐는 질문에는 ""아시아의 어느 곳이 될 것""이라고 말했다. ""중국 정부가 관심을 갖고 있는 건 분명하고 싱가포르와 홍콩도 관심을 보이고 있다""고 한다. NHK는 취재일정을 조정하는 동안 테트릭 CEO가 갑자기 중국 출장을 가는 바람에 일정조정이 미뤄지기도 했다면서 식량부족에 대한 위기감이 강한 중국 등 아시아 국가를 첫 판매지로 고려하고 있다는 느낌을 받았다고 전했다.취재진이 방문한 이 회사 연구실은 시험관과 기자재가 놓여있는 흔히 볼 수 있는 연구실과 다릉없었다. 촬영을 하지 않는 조건으로 둘러본 배양장치에서는 투명한 용기속에 든 배양액 속에서 세포가 분열을 반복하며 빠르게 증식하고 있었다. 현미경으로 확대해 보니 살아있는 세포가 그물눈 처럼 증식하고 있다.세포 1개가 치킨 너겟 1개분의 '고깃덩이'로 자라는데는 2주일 정도 걸린다. 배양액의 성분을 묻자 식물에서 유래한 단백질 등이 들어 있다는 대답이 돌아왔다. 세계 각지의 식물에서 채취한 영양분을 조합해 어떻게 빨리, 저렴하게 세포를 배양할지 방대한 데이터 베이스를 구축해 연구를 거듭한다고 한다. 한 연구원은 ""가축의 사료와 똑같은 영양분을 세포에 공급해주면 자연히 성장한다""고 설명했다.회사 측은 배양육으로 만든 치킨 너겟 시식기회를 제공했다. 취재팀이 지켜보는 가운데 배양육을 기름에 넣고 1분여 기다리자 너겟이 완성됐다. 외관은 보통 너겟과 전혀 다르지 않았다. 반으로 잘라보니 속은 약간 미끄러운 느낌이다. 흰색으로 너겟이라기 보다 어묵에 가까워 보였다. 먹어보니 식감이 예상했던 것보다 탄력이 있고 닭고기 맛 그대로였다. 눈을 가리고 시식하면 보통 가게에서 파는 치킨 너겟과 구분할 수 없을 정도였다.(연합뉴스)이영호기자 hoya@wowtv.co.kr▶ 네이버 홈에서 [한국경제TV] 채널 구독하기 [생방송보기]▶ 대한민국 재테크 총집결! - [증권 / 주식상담 / 부동산]ⓒ 한국경제TV, 무단 전재 및 재배포 금지		"
56,2019.03.07. 오후 12:45,"GS수퍼마켓, GS25! 차별화 된 해외 먹거리로 고객 잡는다!","GS리테일이 운영하는 GS수퍼마켓, GS25가 특별한 오렌지를 선보인다.GS수퍼마켓과 GS25는 과육이 자몽과 비슷한 붉은 색을 띠는 ‘속 빨간 오렌지’ 3천톤을 들여와 판매한다.GS리테일은 올해 1월 미국 캘리포니아주에 있는 150만평 규모의 속 빨간 오렌지 농가와 ‘GS리테일 지정 농장’ 계약을 체결하고 본격적인 판매를 시작한다. 지난 해 100만평 규모의 캘리포니아주 오렌지 농가와 계약을 통해 대왕 오렌지 등 고품질 오렌지 판매를 시작한데 이어 두 번째 해외 지정 농장이다.일명 속 빨간 오렌지의 정식 명칭은 ‘카라카라 품종’ 오렌지로, 일반 오렌지에 비해 신맛은 적고 당도가 높은 것이 특징이다. 과육이 붉어 해외에서는 색다른 오렌지로 인기를 끌고 있으며, 비타민 A, C가 풍부해 파워오렌지라 불리는 상품이다./ GS25 제공 @머니S MNB, 식품 외식 유통 · 프랜차이즈 가맹 & 유망 창업 아이템의 모든 것붉은색 과육으로 인해 자몽과 오렌지의 교배종으로 오해를 받기도 하는 카라카라 오렌지는 1976년 베네수엘라에 있는 카라카라 지역에서 처음 발견된 오렌지 고유 품종 중 하나다.GS리테일은 기존에 만나보기 힘들었던 특별한 오렌지를 알뜰한 가격으로 제공하는 만큼 고객들의 큰 호응이 있을 것으로 기대하고 있다.GS리테일이 차별화 된 먹거리를 지속 선보이는 것은 SNS의 발달, 소확행 트렌드 확산 등으로 인해 특별함을 원하는 고객들이 늘어나기 때문이다. 이러한 고객들의 니즈에 맞춰 해외에서 인기 있는 색다른 상품을 적극적으로 들여와 가까운 GS25, GS수퍼마켓에서 간편하게 구매할 수 있도록 하고 있는 것.속 빨간 오렌지 외에도 태국 여행 중 꼭 구매해야 하는 상품 중 하나로 알려진 쿤나 망고도 유통업계 최초로 들여와 GS수퍼마켓, GS25에서 판매를 시작했다. 쿤나 망고는 망고 과육을 말린 건망고 상품으로 풍부한 향과 쫄깃한 식감 등으로 큰 인기를 얻고 있는 상품이다. 가격은 5500원.이 밖에도 GS25는 지난 해 베트남 다낭 여행 시 꼭 구매해야 하는 상품으로 유명한 현지 쌀국수 1위 포띠뽀(쇠고기맛 쌀국수)를 들여와 큰 인기를 끌고 있으며, 이달부터 시리즈인 포띠가(닭고기맛 쌀국수)도 들여와 판매를 시작하는 등 해외 여행 먹킷 리스트를 고객들에게 제공하기 위해 최선을 다하고 있다.정이동 GS리테일 과일팀장은 “그동안 GS수퍼마켓 등을 운영하면서 쌓인 상품 소싱 노하우와 온오프라인 판매망을 바탕으로 고객들에게 차별화 된 과일을 선보이고 있다”며 “고객들에게 고품질 상품을 안정적으로 제공하기 위해 미국 현지 오렌지 농가와 지정 농장 계약을 진행하는 등 새로운 시도를 지속하고 있다”고 말했다.  강동완 기자 ▶ 고수들의 재테크 비법 ▶ 박학다식 '이건희칼럼' <저작권자 ⓒ '성공을 꿈꾸는 사람들의 경제 뉴스' 머니S, 무단전재 및 재배포 금지>		"
58,2019.03.03. 오후 6:06,‘찬밥신세’ 한식 뷔페는 소비자 입맛을 돌릴 수 있을까,"			스테이크 위주의 고가 정책을 펼치던 페밀리레스토랑을 대체하며 대표적 가족 외식 장소로 자리매김해왔던 한식뷔페들이 1년새 절반가까이 매장이 감소하는 등 위기를 겪고 있다. 경기불황에 중소기업 적합업종 지정, 여기에 가정간편식 제품들의 품질이 올라가며 3중고를 겪고 있기 때문인 것으로 분석되지만, 일부에서는 맛 차별화에 실패하며 초기의 신선함을 잃은 것이 원인이란 지적이 나온다.3일 업계에 따르면 CJ푸드빌의 대표 한식뷔페 브랜드 ‘계절밥상’의 매장 수는 지난해 말일 기준 29개까지 급감했다. 1년 전이었던 2017년 말 54개였던 것을 감안하면 절반가까이 줄어든 셈. 지난 1월에는 CJ그룹의 푸드빌 매각설이 돌만큼 그룹 내 입지가 위태로운 지경에 이르기도 했다.이에 대해 CJ푸드빌 관계자는 “수익 구조 개선 및 내실 강화를 위한 사업 구조 개선 차원”이라며 “‘선택과 집중’ 전략을 통해 부진 매장은 영업을 종료하고, 수익이 좋은 매장은 상권 및 라이프스타일 변화에 맞춰 특화 매장으로 선보이고 있다”고 설명했다.계절밥상 매장 전경. CJ푸드빌 홈페이지신세계푸드가 운영하는 ‘올반’의 매장 수 역시 2017년 15개 매장에서 현재는 12개로 줄어들었다.이를 두고 외식업계의 한 관계자는 “상대적으로 낮은 가격을 맞추기 위해 ‘거기서 거기’인 메뉴를 유지하면서 비슷한 가격대의 가정간편식과 차별성을 강조하지 못 한 것이 주된 원인”이라고 분석하면서 “여기에 중소기업 적합업종으로 지정되면서 신규 출점이 제한되고 있는데다 경기 불황까지 겹쳤다”고 덧붙였다.외식업은 지난 2013년 중소기업 적합업종에 지정돼 이들 대기업은 역세권 100ｍ 안쪽이나, 연면적 2만㎡ 이상의 복합 시설에만 신규 점포를 낼 수 있는 등의 규제를 받고 있다. 최근 들어서는 정부가 새로 추진하고 있는 생계형 적합업종 분류에 포함될 가능성도 높아지고 있어 관련 사업 확대는 상대적으로 녹록지 않은 상황이다.이를 위한 타개책으로 업계는 요리의 품질을 높이는 등 ‘격’을 높이려는 노력과 함께 일부 메뉴를 같은 이름의 가정간편식 제품으로 내놓는 등 저마다 대응에 나서고 있다.‘계절밥상’은 지난해 연말 여의도 IFC 점을 즉석조리를 강화한 ‘라이브 스튜디오 8’로 개편했다. 즉석에서 닭고기·돼지고기 메뉴를 제공하고, 새우와 가리비 등 인기 해산물을 요리하는 것이 특징. CJ푸드빌에 따르면 이 매장의 매출은 지난해 같은 기간에 비해 30% 이상 늘었다. 또한 일부 인기메뉴를 가정간편식으로 구성한 제품들도 좋은 반응을 얻고 있다는 설명이다.올반 매장 내부. 신세계푸드 홈페이지‘올반’ 또한 서울 중심에 위치한 센트럴시티 점을 지난 연말 팔도 한식을 맛볼 수 있는 ‘한옥’과 BBQ 코너 ‘붓처스’, 주문 즉시 메뉴를 만들어주는 ‘더 라이브’ 등을 갖춘 ‘올반 프리미엄’ 매장으로 업그레이드 하는 한편 비교적 매출이 적은 일부 매장을 프리미엄 해물 뷔페인 ‘보노보노’로 전환 오픈했다. 역시 가정간편식 시장도 지속적으로 확대해 현재 대형 마트 등에서 판매되고 있는 올반 제품은 200여 종에 달하며 매출액 또한 전체 매출의 15%에 이르는 것으로 알려졌다.이충진 기자 hot@kyunghyang.com▶ [스포츠경향 인기 무료만화 보기]▶ [지금 옆사람이 보고있는 뉴스]©스포츠경향(sports.khan.co.kr), 무단전재 및 재배포 금지		"
