,날짜,기사제목,기사내용
0,2019.03.26. 오전 11:35,"4월 한우·돼지고기 값 내리고, 닭고기·계란값 오른다","			한국농촌경제연구원 농업관측본부 통계 분석 예측축산 물가 하락 (PG)[제작 최자윤] 일러스트    (나주=연합뉴스) 박철홍 기자 = 올해 4월 한우와 돼지고기의 도맷값이 지난해 같은 기간보다 소폭 하락하는 데에 반해, 닭고기와 계란의 도맷값은 오를 것으로 관측됐다. 26일 한국농촌경제연구원 농업관측본부의 축산관측에 따르면 올해 4월 한우 1등급 평균 도매가격은 지난해 4월 평균가격 1만8천105원보다 하락한 1㎏당 1만6천700~1만7천700원 수준을 기록할 것으로 예상한다.    이는 4월 한우 도축 마릿수가 늘어날 것으로 예상한 결과에 따른 것이다.     국내 쇠고기 가격 하락으로 지난 3월 초 쇠고기 수입량이 전년보다 7.6% 감소하는 등 올해 전체 쇠고기 수입량이 감소할 전망이다.    돼지고기 도맷값도 돼지 사육 증가에 따른 등급판정 마릿수 증가로 하락하겠다.돼지 목심[촬영 이상학]    오는 4월 돼지고기 생산량은 지난해보다 증가한 8만t 내외로 예상되는데, 4월 돼지고기 도매가격은 지난해 4월 4천439원 평균가격보다 하락해 1㎏당 4천100~4천300원대 가격을 형성하겠다.    돼지고기 수출국인 중국에서 아프리카돼지열병(ASF)이 발병, 돼지 사육 마릿수가 큰 폭으로 감소하면서 돼지고기 수입량도 장기적으로 감소할 전망이다.    생산성이 떨어진 닭고기와 계란 도맷값은 오를 전망이다.    4월 생계 유통가격은 생산성이 좋았던 전년 동기보다 출하가 줄어, 지난해 1천234원보다 높은 1㎏당 1천300~1천500원을 기록하겠다.    4월 계란 가격도 닭을 낳을 수 있는 산란계의 마릿수 감소로 전년 대비 소폭 상승한 800~900원을 기록할 것으로 보인다.    계란값 전년 대비 상승세는 5월까지 이어져 5월 계란 가격은 750~850원을 기록하겠다.    농촌경제연구원 농업관측본부는 ""축산관측 정보는 사육·출하의향 등 각종 통계자료로 수집 분석한 결과로 구체적인 가격 동향은 수급여건에 따라 달라질 수 있다""고 밝혔다.  pch80@yna.co.kr▶네이버 홈에서 [연합뉴스] 채널 구독하기▶뭐 하고 놀까? #흥  ▶쇼미더뉴스! 오늘 많이 본 뉴스영상"
1,2019.03.28. 오전 10:43,"[주간밥상물가]따뜻한 날씨, 채소류 생산 늘며 가격하락","닭고기 사육마릿수 증가로 공급 원활꾸준한 수요, 생산량 감소로 딸기값 상승세【그래픽=뉴시스】3월 4주 주간 밥상물가 동향(73품목 서울 지역 기준, 자료:한국물가협회)       hokma@newsis.com 【서울=뉴시스】이예슬 기자 =3월 마지막주 생활물가 동향을 보면 기온량과 일조량 증가로 채소류 품목 대부분이 하락세에 거래됐다.닭고기는 육계 사육마릿수 증가로 공급이 원활하면서 대부분 지역에서 가격이 떨어졌다. 28일 한국물가협회에 따르면 전체 조사대상 73품목 중 서울지역 기준, 소고기·감자·마늘·감귤 등 16품목이 상승했고, 닭고기·고구마·상추·대파 등 10품목은 하락세를 보였다.◇채소류당근은 제주산 출하가 꾸준해 지난주에 이어 하락세에 거래됐다. 1㎏ 기준 서울·대구·대전에서 2.7~6.9% 내려 2690원~2900원선에서 판매됐다. 부산·광주는 2980원·2900원으로 약보합세에 거래됐다.무는 공급량이 충분한 가운데 매기가 한산하면서 서울·대구·광주에서 한 개에 7~14.4% 내려 각각 1190원씩에 거래됐다. 부산과 대전은 각각 1180원, 1280원으로 약보합세에 팔렸다.애호박은 기온이 오르며 산지 출하물량 증가로 하락세를 나타냈다. 부산·대구·대전에서 개당 30.4%·16.1%·7.2% 내린 960원·1250원·1280원에 거래됐다. 서울과 광주는 1380원·1300원으로 지난주와 같았다.◇축산물 닭고기는 육계 사육마릿수 증가로 공급이 원활하면서 대부분 지역에서 하락세였다. 생닭 한 마리(1㎏) 당 서울·부산·대구·대전에서 3.8%·3.3%·9.1%·1.7% 내린 5760원·5780원·5000원·5800원에 거래됐다. 광주는 5250원으로 약보합세였다.소고기 한우는 시중 수요가 증가하면서 등심(1등급) 500g 기준 서울·부산·광주에서 2.5%·18.3%·9.6% 오른 4만7210원·4만1300원·3만9950원에 판매됐다. 대구와 대전에서는 4만7450원·4만4000원으로 지난주와 같은 시세를 유지했다.◇과일류딸기는 수요가 꾸준한 가운데 최근 큰 일교차에 따른 생산량 감소로 상승세를 보였다. 1㎏ 기준 서울·부산·대전에서 11.7%·15%·4.4% 오른 1만620원·9890원·9500원에 판매됐다. 대구는 10% 내린 1만원에 팔렸다. 광주는 9990원으로 보합세를 나타냈다. 감귤은 하우스산으로 품종이 교체되면서 상승세에 거래됐다. 서울·대구·대전에서 100g 당 9.6%·11.1%·7.1% 오른 744원·600원·675원에 판매됐다. 부산과 광주는 각각 620원, 650원으로 강보합세를 나타냈다.◇수산물 오징어는 조업부진으로 어획물량이 감소한 가운데 반입량에 따라 지역별로 엇갈린 시세를 나타냈다. 한 마리당 서울과 대구는 19.8%, 2.5% 오른 4780원, 3680원이었다. 광주와 대전은 5%, 2% 내린 3790원, 3900원에 거래됐다. 부산은 3680원으로 지난주와 같았다.ashley85@newsis.com▶ 네이버에서 뉴시스 채널 구독하기▶ 뉴시스 빅데이터 MSI 주가시세표 바로가기 <저작권자ⓒ 공감언론 뉴시스통신사. 무단전재-재배포 금지.>"
2,2019.03.07. 오전 11:20,[3월 첫째주 밥상물가]사육 증가로 닭고기 가격 하락,"배·딸기 등 과일가격도 내림세【그래픽=뉴시스】3월 1주 주간 밥상물가 동향(73품목 서울 지역 기준, 자료:한국물가협회)       hokma@newsis.com【서울=뉴시스】이예슬 기자 = 3월 첫째 주 생활물가 동향을 보면 육계 사육 마릿수가 늘면서 닭고기 가격이 하락세를 보였다.배는 저장물량이 감소하면서 산지 출하물량이 줄어 상승세였다. 딸기는 기온상승에 따른 생육 호조로 생산량이 늘면서 값이 내렸다.7일 한국물가협회에 따르면 전체 조사대상 73품목 중 서울 지역기준 무·시금치·배·고등어 등 8품목이 상승했고, 닭고기·고구마·대파·딸기 등 15품목은 하락세를 보인 것으로 조사됐다.◇축산물닭고기는 사육 마릿수의 증가로 지난주에 이어 하락세를 나타냈다. 생닭 한 마리(1kg) 당 서울·대구·광주에서 0.8%·2.9%·9.1% 내린 6160원·5000원·5000원씩에 거래됐다. 부산·대전은 각각 6580원, 5900원으로 약보합세에 판매됐다.돼지고기 궁급은 꾸준히 이뤄지고 있지만 학교들이 개학하면서 급식 수요로 소비가 증가해 등락이 엇갈렸다.삼겹살 500g 당 서울·대구·광주는 9.4%·6%·6.7% 내린 9530원·7000원·6950원에 판매됐다. 부산과 대전은 0.7%, 2.3% 오른 9800원, 9000원에 거래됐다.◇과일류배는 수요가 한산함에도 저장물량 감소로 산지 출하물량이 줄면서 가격이 올랐다. 개당 서울·부산·대전에서 10.3%·11.7%·2.6% 오른 3640원·2960원·4000원에 거래됐다. 대구와 광주는 각각 4660원에 판매되면서 강보합세였다.딸기는 기온상승에 따른 생육 호조로 생산량이 늘면서 하락세에 거래됐다. 서울·부산·대구에서 1㎏ 기준 6.7%·19.4%·10% 내린 9920원·7980원·9900원에 판매됐다. 광주·대전은 1만1800원·1만1130원으로 지난주와 같았다.◇채소류대파는 생육 여건이 호전되면서 지난주에 이어 내림세였다. 한 단에 서울·부산·대전에서 3.9%·13.5%·3.9% 내린 2480원·1280원·2480원에 판매됐다. 대구와 광주는 2840원, 2990원으로 약보합세를 나타냈다.애호박도 산지 출하물량이 늘면서 하락세였다. 서울·부산·대구·광주·대전에서 개당 6.8%·7.8%·6.3%·37.1%·6.8% 내린 1380원·1180원·1490원·1000원·1380원에 거래됐다.◇수산물고등어는 어획물량 감소로 가격이 오르면서 서울과 대전에서 한 마리에 0.7%, 1.9% 오른 2800원, 2750원에 판매됐다. 부산과 대구, 광주는 3280원·2780원·2490원으로 강보합세를 나타냈다.ashley85@newsis.com▶ 네이버에서 뉴시스 채널 구독하기▶ 뉴시스 빅데이터 MSI 주가시세표 바로가기 <저작권자ⓒ 공감언론 뉴시스통신사. 무단전재-재배포 금지.>"
3,2019.03.27. 오후 2:50,"롯데마트, 창립 21주년 맞아 21일간 ‘극한가격’ 행사 나선다","			[디지털타임스 김아름 기자] 창립 21주년을 맞은 롯데마트가 '다시 돌아온 통큰 치킨'을 앞세워 3주간 연중 최대 행사에 돌입한다.롯데마트는 오는 28일부터 4월 17일까지 21일간 '극한도전'을 테마로 한 행사를 진행한다고 27일 밝혔다. 행사기간 동안 총 1600여 개 품목의 상품을 할인 및 초특가로 선보인다. 이번 행사는 가격에 초점을 둔 '극한가격'과 우수한 품질에 중점을 둔 '극한품질', 다양한 혜택을 위한 '극한혜택' 총 3가지 콘셉트로 준비했다.우선 28일부터 다음달 3일까지 7일간 100% 국내산 냉장 닭을 사용한 '통큰 치킨' 을 마리당 5000원에 판매한다. 이번에 선보이는 통큰 치킨은 해썹(HACCP) 인증을 받은 도계장에서 생산했으며 온 가족이 먹기 좋도록 900g내외의 닭고기를 사용한 것이 특징이다.수입 소고기 전 품목에 대해서도 최대 50% 할인행사를 진행하며 '랍스터(420g/해동/캐나다산)'는 8800원에, 완도산 활 전복(특대)을 3300원에 선보인다.창립 21주년 기간 동안 고객에게 더 많은 혜택을 주기 위한 '극한혜택' 테마의 행사도 진행한다. 롯데마트 PB브랜드인 'Only Price' 일부 상품에 대해 엘 포인트를 21배 추가 적립해주며 요리하다와 스윗허그 일부 상품에 대해 21% 카드사 할인을 진행한다.문영표 롯데마트 대표는 ""최근 생필품 가격 상승과 더불어 소비 심리가 많이 위축되어 있는 것 같다""며 ""창립 21주년을 맞아 롯데마트의 전사적 역량을 총 집중시킨 행사인 만큼 대한민국 체감물가를 낮춰 내수경기 활성화에 도움이 될 수 있기를 기대한다""고 말했다.김아름기자 armijjang@dt.co.kr롯데마트가 오는 4월 17일까지 창립 21주년 기념 행사에 나선다. 사진은 행사기간 동안 마리당 5000원에 판매되는 '통큰 치킨'. <롯데마트 제공>     디지털타임스 홈페이지 바로가기 / 디지털타임스 뉴스 더보기네이버 채널에서 '디지털타임스'를 구독해주세요."
4,2019.03.31. 오전 12:14,"신이 허락한 음식, '할랄 푸드' 직접 먹어보니","까다로운 인증 절차에 믿고 먹는 '할랄 푸드'할랄 인증 간식, 할랄 음식 직접 먹어봤다 (사진=스냅타임) 이태원에 있는 이슬람 사원. 이슬람 사원 앞에는 할랄 음식을 쉽게 구할 수 있다.‘할랄 푸드(Halal Food)’가 주목받고 있다. 할랄 푸드는 무슬림들을 위해 이슬람 율법을 거스르지 않고 만들어진 음식이다. 짙은 종교적인 색채에도 엄격한 기준을 거쳐 생산되고 유통 과정이 투명해 믿을 수 있는 음식이라는 긍정적인 평가를 받고 있다.실제로 할랄 푸드를 경험해보고 싶어하는 의향은 비교적 높은 것으로 조사됐다. 1000명의 성인남녀를 대상으로 한 트렌드 모니터의 조사에 따르면 전체의 57%(570명)가 향후 할랄 푸드를 먹어보고 싶은 생각이 있다고 밝혔다. 최근 할랄 푸드에 대한 관심이 생겼다는 김성희(가명. 27) 씨는 ""소비자로서는 종교의 문제를 떠나서 깐깐한 할랄 푸드 인증을 받았다고 하면 믿음이 가는 것 같다""며 “동시에 이색적이고 특이할 것 같아서 한 번 먹어보고 싶다”고 말했다.그래서 스냅타임이 할랄 푸드를 먹어보러 직접 이태원에 다녀왔다.할랄은 이슬람 율법에 따라 이슬람교도인 무슬림이 ‘먹고 쓸 수 있도록 허용된 것’을 총칭하는 용어로 아랍어로 ‘허용된 것’이라는 뜻이다. 이슬람 국가들에서는 식음료, 화장품, 의약품 등 제품과 여행, 물류, 금융 등 서비스에 이르기까지 폭넓게 할랄이 적용되고 있다. 할랄 푸드는 알코올이 들어 있지 않은 상품, 소·양·산양·사슴·닭·오리 등의 육류, 우유(소·낙타·산양의 젖), 민물고기를 제외한 생선, 신선한 야채·과일, 말린 과일, 견과류와 콩류다.할랄 인증 간식은 이태원 이슬람 사원 주변에서 쉽게 구할 수 있다. 이슬람 사원 주변  'national foods mart'에서 다양한 할랄 푸드를 판다. 가게에 들어가면 다양한 국내외 음식들이 있다. 할랄 푸드 인증 마크가 따로 있기는 하지만 가게에서 쉽게 찾아 볼 수 없었기 때문에 사장님께 물어봤다. (사진=스냅타임) 이슬람 사원 주변 마트에 가면 쉽게 할랄 푸드를 구매할 수 있다.사장님은 할랄 푸드를 원산지를 보고 확인했다. 인도, 파키스탄, 인도네시아 등이 원산지인 과자, 컵라면은 할랄 푸드라고 했다. 먹어본 것만 먹는 '초딩 입맛'에게 두려운 새로운 간식 체험은 그나마 익숙해 보이는 과자를 고르는 것으로 시작됐다. 2개의 비스킷 사이 초콜릿 크림이 들어간 초콜릿 샌드와 패스츄리 과자를 골랐다. 컵라면은 치킨 소토 맛과 매워 보이는 맛 2가지를 골랐다.가격은 한국 과자, 컵라면과 크게 다르지 않았다. 처음 사는 낯선 간식에 돈이 많이 나올 것이라 예상하며 꽉 쥐고 있던 카드를 선뜻 내밀었다. 과자와 컵라면 모두 1000원~2000원 정도였다. 가게에서 만난 익명의 한 손님은 ""외국 제품이고 엄격한 과정을 거쳐서 생산된 할랄 제품이라고 하니 비쌀 것 같다는 생각을 했던 것 같다""고 말했다. (사진=스냅타임) 할랄 인증 간식할랄 인증 간식 맛 또한 익숙한 맛이었다. 요즘 길거리에 많이 보이는 세계 과자 할인점에 가면 쉽게 구매할 수 있는 외국의 과자들과 비슷한 맛이었다. 한국 과자 중에 맛이 비슷한 과자는 아직 찾지 못했다.다만 인도네시아에서 온 컵라면은 향신료 맛이 강했다. 치킨소토맛 컵라면은 향신료를 잘 먹는 사람들도 중간에 포기하기에 이르렀고, 매운맛 컵라면은 고수 향이 강했다. 자칭 '고수의 고수'는 매운맛 컵라면을 국물까지 다 먹었다. 베트남 쌀국수나 태국 ?양꿍 같은 음식을 잘 먹는 분들이라면 할랄 인증 컵라면도 문제없을 것이다.다음은 요르단 전통의 할랄 음식을 먹었다. 처음 먹는 음식이다 보니 직원분이 추천해주는 것을 그대로 시켜 먹었다. 특이했던 점은 제일 먼저 소스를 골라야 한다. 그 다음으로 애피타이저, 샐러드, 메인 메뉴 순으로 주문하면 된다. (사진=스냅타임) 홈머스 소스. 병아리 콩을 갈아서 레몬즙, 올리브유와 섞은 걸쭉하면서도 부드럽고 고소한 소스다. 처음에 사진으로만 봤을 때는 예쁘게 펼쳐져 있어 식전 빵인 줄로만 알았다. 가격은 8000원.스냅타임은 홈머스 소스, 팔라펠, 타볼리 샐러드, 갈릭버터 피타, 비리아니를 주문했다. 홈머스 소스는 병아리 콩을 갈아서 레몬즙, 올리브유와 섞은 걸쭉하면서도 부드럽고 고소한 소스다. 처음에 사진으로만 봤을 때는 예쁘게 펼쳐져 있어 식전 빵인 줄로만 알았다. 가격도 8000원이었기 때문이다. (사진=스냅타임) 팔라펠. 병아리 콩이나 잠두를 다진 마늘이나 양파, 파슬리, 커민, 고수 잎 등과 함께 갈아 만든 반죽을 둥근 모양으로 튀긴 음식.팔라펠은 병아리 콩이나 잠두를 다진 마늘이나 양파, 파슬리, 커민, 고수 잎 등과 함께 갈아 만든 반죽을 둥근 모양으로 튀긴 음식이다. 타볼리 샐러드는 양파를 다진 뒤 쿠스쿠스, 레몬즙, 올리브유 등을 넣어 버무린 샐러드다. 갈릭버터 피타는 밀가루를 발효시켜 만든 원형의 넓적한 빵이다. 맛과 모양이 인도의 난과 비슷했다. (사진=스냅타임) 타볼리 샐러드. 양파를 다진 뒤 쿠스쿠스, 레몬즙, 올리브유 등을 넣어 버무린 샐러드.애피타이저는 누구나 맛있게 먹을 수 있을 만큼 익숙한 맛이었다. 사장님이 맛있게 먹는 법을 알려주시겠다며 직접 시범을 보여주셨다. 피타에 홈머스 소스와 반으로 가른 팔라펠, 타볼리 샐러드를 함께 올려 먹는 방법이다. 타코와 비슷한 맛이다. (사진=스냅타임) 메인 메뉴 비리아니. 생쌀에 향신료에 잰 고기 등의 재료를 미리 볶아 반쯤 익힌 쌀과 함께 찐 쌀 요리다. 닭고기와 양 고기, 베지테리안 3가지 종류가 있다. 위 사진은 양 고기.메인 메뉴 비리아니는 생쌀에 향신료에 잰 고기 등의 재료를 미리 볶아 반쯤 익힌 쌀과 함께 찐 쌀 요리다. 닭고기와 양 고기, 베지테리안 3가지 종류가 있다. 양 고기를 주문했는데 고기가 엄청 부드러워 칼을 쓰지 않아도 잘라지는 감자탕에 들어있는 고기 같았다. 양 고기 특유의 냄새는 나지 않았지만 향신료 향이 강했다.음식을 다 먹고 자리에서 일어나는데 직원분이 아직 식후 차가 나오지 않았다며 급히 일어났다. 다시 앉아 기다리는데 요르단에서는 식후에 차를 마시는 전통이 있다며 전통차를 가지고 오셨다. 알던 맛, 홍차였다.할랄 푸드가 '특별하고 다른' 맛일 것이라고 예상한 것이 민망해질 만큼 모두 ‘알던’ 맛이었다. 사실 ‘특별하고 다를 것’이라는 생각은 낯선 것에 대해 쉽게 가진 선입견이었다./스냅타임김정은 (1derland@edaily.co.kr)총상금 1050만원, 사진 공모전 [나도 사진 기자다▶]이데일리 [구독하기▶] , 청춘뉘우스~ [스냅타임▶]＜ⓒ종합 경제정보 미디어 이데일리 - 무단전재 & 재배포 금지＞"
5,2019.03.10. 오전 6:07,"치킨값 2만원에 '편의점 치킨' 찾는다…""올들어 매출 26%↑""","			(서울=연합뉴스) 이신영 기자 = 닭고기 가격 상승과 배달비 도입 등으로 '치킨값 2만원 시대'가 되면서 이보다 저렴한 '편의점 치킨'이 대안으로 떠오르고 있다.     주머니가 얇은 소비자들이 한 마리에 1만원 미만인 편의점 치킨으로 눈을 돌리면서 매출이 늘고 있다고 업계 관계자들이 10일 전했다.    매장에서 직접 튀겨 파는 편의점 치킨은 유명 프랜차이즈 치킨 업체의 제품보다 상대적으로 저렴한 데다 조각형 제품도 있어 1인 가구와 혼술족 사이에서도 인기다.     편의점 CU(씨유)의 점포에서 판매되는 프라이드치킨 매출은 해마다 늘고 있다.  CU의 프라이드치킨 매출은 2016년 전년 동기 대비 7.1% 성장했으나, 2017년에는 14.3%, 2018년에는 16.5%로 증가 폭을 더 벌렸다.    특히 지난해 말 프랜차이즈 업체들의 '치킨 2만원 시대'가 열린 후인 올해 1∼2월의 매출이 전년 동기와 비교해 26.1%나 뛴 것으로 나타났다.     전국 2천200여개 점포에서 치킨을 판매하는 CU는 이에 기본 프라이드치킨 외에도 어디서나 편하게 먹을 수 있는 꼬치 타입도 판매하는 등 상품의 종류를 다양화하고 있다. 편의점 치킨 상품[CU 제공=연합뉴스]    또 다른 편의점인 GS25도 조각 치킨을 포함해 매장에서 직접 만들어 판매하는 간식류 매출이 2017년에는 전년 동기 대비 59.6% 성장했고, 2018년에는 24.4% 증가하는 등 꾸준히 늘고 있다고 전했다.     올해 들어 이달 6일까지의 매출은 전년 동기 대비 23.6% 늘어난 것으로 집계됐다.     편의점 치킨의 인기는 소비자들에게 '2만원대 치킨'이 부담스러워진 것도 이유이지만, 1인 가구의 증가와 주 52시간 근무제 도입에 따라 집에서 가볍게 술을 즐기는 음주문화가 확산한 데서도 영향을 받은 것으로 풀이된다.  eshiny@yna.co.kr▶네이버 홈에서 [연합뉴스] 채널 구독하기▶뭐 하고 놀까? #흥  ▶쇼미더뉴스! 오늘 많이 본 뉴스영상"
